corp,dpto,mpio,name,party,wp_no
Alcaldía,CALDAS,LA DORADA,ANA MILENA YUMAYUZA CANO,PARTIDO ALIANZA SOCIAL INDEPENDIENTE ASI,32907
Alcaldía,CALDAS,LA DORADA,CESAR ARTURO ALZATE MONTES,MOVIMIENTO POR EL PROGRESO DE LA DORADA,32906
Alcaldía,CALDAS,LA DORADA,CRISTIAN ANDRES VALENZUELA MONJE,PARTIDO LIBERAL COLOMBIANO,32909
Alcaldía,CALDAS,LA DORADA,DIEGO  PINEDA ALVAREZ,PARTIDO CAMBIO RADICAL,32908
Alcaldía,CALDAS,LA DORADA,JOSE RAMIRO CAMACHO BUSTOS,PARTIDO POLO DEMOCRATICO ALTERNATIVO,32910
Alcaldía,CALDAS,LA DORADA,LUIS CARLOS PINEDA HERRERA,CENTRO DEMOCRATICO,32905
