corp,dpto,mpio,name,party,wp_no
Alcaldía,ANTIOQUIA,ARBOLETES,ALVARO  GONZALEZ AVILA,PARTIDO LIBERAL COLOMBIANO,1523
Alcaldía,ANTIOQUIA,ARBOLETES,CARLOS ANDRES TORDECILLA MORALES,PARTIDO UNION PATRIOTICA UP,1525
Alcaldía,ANTIOQUIA,ARBOLETES,FRANCIA  POO MADERA,CENTRO DEMOCRATICO,1520
Alcaldía,ANTIOQUIA,ARBOLETES,JAHIRA MILENA GOMEZ GONZALEZ,PARTIDO CONSERVADOR COLOMBIANO,1522
Alcaldía,ANTIOQUIA,ARBOLETES,JUAN CARLOS ADAMS VELLOJIN,PARTIDO SOCIAL DE UNIDAD NACIONAL PARTIDO DE LA U,1524
Alcaldía,ANTIOQUIA,ARBOLETES,LORENZO II ACUÑA ROMERO,PARTIDO CAMBIO RADICAL,1521
