corp,dpto,mpio,name,party,wp_no
Alcaldía,TOLIMA,IBAGUE,EMMANUEL ENRIQUE ARANGO GOMEZ,CENTRO DEMOCRATICO,103108
Alcaldía,TOLIMA,IBAGUE,GUILLERMO ALFONSO JARAMILLO MARTINEZ,MOVIMIENTO ALTERNATIVO INDIGENA Y SOCIAL MAIS,103110
Alcaldía,TOLIMA,IBAGUE,JHON ESPER TOLEDO CASTAÑEDA,CAMBIO RADICAL-PARTIDO DE LA U,103107
Alcaldía,TOLIMA,IBAGUE,POMPILIO DE JESUS AVENDAÑO LOPERA,MOVIMIENTO AUTORIDADES INDIGENAS DE COLOMBIA AICO,103111
Alcaldía,TOLIMA,IBAGUE,RICARDO ALFONSO FERRO LOZANO,FIRME POR IBAGUE,103109
Alcaldía,TOLIMA,IBAGUE,RUBEN DARIO RODRIGUEZ GONGORA,PARTIDO LIBERAL COLOMBIANO,103112
