corp,dpto,mpio,name,party,wp_no
Alcaldía,BOYACA,CHIQUINQUIRA,CARLOS HERNANDO PACHON LUCAS,PARTIDO POLO DEMOCRATICO ALTERNATIVO,25696
Alcaldía,BOYACA,CHIQUINQUIRA,CESAR AUGUSTO CARRILLO ORTEGON,PARTIDO SOCIAL DE UNIDAD NACIONAL PARTIDO DE LA U,25697
Alcaldía,BOYACA,CHIQUINQUIRA,EDGAR ORLANDO PINEDA MARTINEZ,MOVIMIENTO AUTORIDADES INDIGENAS DE COLOMBIA AICO,25690
Alcaldía,BOYACA,CHIQUINQUIRA,JEFFERSON LEONARDO CARO CASAS,PARTIDO ALIANZA SOCIAL INDEPENDIENTE ASI,25691
Alcaldía,BOYACA,CHIQUINQUIRA,JOSE ARMANDO QUIÑONES GARZON,PARTIDO ALIANZA VERDE,25692
Alcaldía,BOYACA,CHIQUINQUIRA,JOSE RICARDO SALINAS TORRES,PARTIDO CONSERVADOR COLOMBIANO,25694
Alcaldía,BOYACA,CHIQUINQUIRA,LUZ DEYANIRA GONZALEZ CASTILLO,PARTIDO LIBERAL COLOMBIANO,25695
Alcaldía,BOYACA,CHIQUINQUIRA,WILMAR ANCISAR TRIANA GONZALEZ,PARTIDO CAMBIO RADICAL- PARTIDO OPCION CIUDADANA- MOVIMIENTO ALTERNATIVO INDIGENA Y SOCIAL,25693
Alcaldía,BOYACA,CHIQUINQUIRA,ZICO ANTONIO SUAREZ SUAREZ,CENTRO DEMOCRATICO,25689
