corp,dpto,mpio,name,party,wp_no
Alcaldía,BOYACA,VENTAQUEMADA,CARLOS ALBERTO RUIZ LOPEZ,PARTIDO OPCION CIUDADANA,32036
Alcaldía,BOYACA,VENTAQUEMADA,CARLOS JULIO MELO ALDANA,ENTRE TODOS SI PODEMOS,32032
Alcaldía,BOYACA,VENTAQUEMADA,JOSE MIGUEL GARAY BARRERA,PARTIDO ALIANZA SOCIAL INDEPENDIENTE ASI,32033
Alcaldía,BOYACA,VENTAQUEMADA,NELSON  BOHORQUEZ OTALORA,PARTIDO CONSERVADOR COLOMBIANO - CENTRO DEMOCRATICO,32034
Alcaldía,BOYACA,VENTAQUEMADA,WILSON EDUARDO REINA MORENO,PARTIDO LIBERAL COLOMBIANO,32035
