corp,dpto,mpio,name,party,wp_no
Alcaldía,HUILA,PITALITO,CARLOS AUGUSTO ROJAS ORTIZ,PARTIDO CONSERVADOR COLOMBIANO,65783
Alcaldía,HUILA,PITALITO,CESAR MAURICIO SIERRA VALENCIA,PARTIDO OPCION CIUDADANA,65785
Alcaldía,HUILA,PITALITO,EDGAR  MUÑOZ TORRES,PARTIDO ALIANZA SOCIAL INDEPENDIENTE ASI,65781
Alcaldía,HUILA,PITALITO,EDNA ROCIO PLAZAS RAMIREZ,PARTIDO POLO DEMOCRATICO ALTERNATIVO,65786
Alcaldía,HUILA,PITALITO,GENARO  LOZADA MENDIETA,PARTIDO LIBERAL COLOMBIANO,65784
Alcaldía,HUILA,PITALITO,JORGE IVAN COCUNUBO CASTELLANOS,PARTIDO ALIANZA VERDE,65782
Alcaldía,HUILA,PITALITO,MIGUEL ANTONIO RICO RINCON,GRAN ALIANZA POR PITALITO,65779
Alcaldía,HUILA,PITALITO,SILVIO  GOMEZ CLAROS,CENTRO DEMOCRATICO,65778
Alcaldía,HUILA,PITALITO,YOBANY  OROZCO VALENCIANO,MOVIMIENTO ALTERNATIVO INDIGENA Y SOCIAL MAIS,65780
