corp,dpto,mpio,name,party,wp_no
Alcaldía,BOYACA,GARAGOA,FABIO AUGUSTO AREVALO ,PARTIDO LIBERAL COLOMBIANO,27080
Alcaldía,BOYACA,GARAGOA,HUGO JOSE MORENO ALFONSO,PARTIDO ALIANZA VERDE,27077
Alcaldía,BOYACA,GARAGOA,JULIO ERNESTO SANABRIA GUERRA,PARTIDO SOCIAL DE UNIDAD NACIONAL PARTIDO DE LA U,27082
Alcaldía,BOYACA,GARAGOA,LUIS ALBERTO LEGUIZAMON ALFONSO,PARTIDO CONSERVADOR COLOMBIANO,27079
Alcaldía,BOYACA,GARAGOA,MARCO ANTONIO SOGAMOSO RUBIANO,PARTIDO OPCION CIUDADANA,27081
Alcaldía,BOYACA,GARAGOA,MARIA ARACELY ROA VARGAS,CENTRO DEMOCRATICO,27076
Alcaldía,BOYACA,GARAGOA,WILLIAM GENARO PARRA SERRANO,PARTIDO CAMBIO RADICAL,27078
