corp,dpto,mpio,name,party,wp_no
Alcaldía,BOLIVAR,CARTAGENA,ANDRES FERNANDO BETANCOUR GONZALEZ,GSC CARTAGENA CONFIRMA,21314
Alcaldía,BOLIVAR,CARTAGENA,ANTONIO QUINTO GUERRA VARELA,PARTIDO CONSERVADOR COLOMBIANO,21318
Alcaldía,BOLIVAR,CARTAGENA,COMITE PROMOTOR VOTO EN BLANCO,PARTIDO POLO DEMOCRATICO ALTERNATIVO,113295
Alcaldía,BOLIVAR,CARTAGENA,FABIO YEZID CASTELLANOS HERRERA,PARTIDO ALIANZA VERDE,21317
Alcaldía,BOLIVAR,CARTAGENA,GINA DEL ROSARIO BENEDETTI DE VELEZ,CENTRO DEMOCRATICO,21315
Alcaldía,BOLIVAR,CARTAGENA,MANUEL VICENTE DE JESUS DUQUE VASQUEZ,PRIMERO LA GENTE,21320
Alcaldía,BOLIVAR,CARTAGENA,REINALDO RAFAEL MANJARREZ MUÑOZ,PARTIDO UNION PATRIOTICA UP,21319
Alcaldía,BOLIVAR,CARTAGENA,ROSARIO MAGDALENA ROMERO IBARRA,MOVIMIENTO AUTORIDADES INDIGENAS DE COLOMBIA AICO,21316
Alcaldía,BOLIVAR,CARTAGENA,WILLIAM  GARCIA TIRADO,TODO POR CARTAGENA,21321
