corp,dpto,mpio,name,party,wp_no
Alcaldía,HUILA,OPORAPA,JOHN FAIVER TRUJILLO VALENZUELA,PARTIDO OPCION CIUDADANA,65213
Alcaldía,HUILA,OPORAPA,MARCO ANTONIO MOLINA MAZABEL,PARTIDO CONSERVADOR COLOMBIANO,65212
Alcaldía,HUILA,OPORAPA,NOHEMI  NORIEGA PARRA,CENTRO DEMOCRATICO,65209
Alcaldía,HUILA,OPORAPA,PABLO JOHN TRUJILLO MOTTA,PARTIDO CAMBIO RADICAL,65211
Alcaldía,HUILA,OPORAPA,WILINGTON  CABRERA SALAZAR,PARTIDO ALIANZA SOCIAL INDEPENDIENTE ASI,65210
Alcaldía,HUILA,OPORAPA,YESID  MOTTA TRUJILLO,PARTIDO SOCIAL DE UNIDAD NACIONAL PARTIDO DE LA U,65214
