corp,dpto,mpio,name,party,wp_no
Alcaldía,BOLIVAR,CLEMENCIA,ALFONSO  AYOLA LLANOS,PARTIDO ALIANZA VERDE,21663
Alcaldía,BOLIVAR,CLEMENCIA,GERARDO  MAY PADILLA,CENTRO DEMOCRATICO,21660
Alcaldía,BOLIVAR,CLEMENCIA,JAIME  CONEO CASTRO,PARTIDO LIBERAL COLOMBIANO,21665
Alcaldía,BOLIVAR,CLEMENCIA,JOSE DEL CARMEN OSPINO HERNANDEZ,MOVIMIENTO AUTORIDADES INDIGENAS DE COLOMBIA AICO,21661
Alcaldía,BOLIVAR,CLEMENCIA,JOSE FERLEY CONEO BALLESTEROS,PARTIDO OPCION CIUDADANA,21666
Alcaldía,BOLIVAR,CLEMENCIA,LUCIO EMILIANO MANFIOLI RIVERA,PARTIDO ALIANZA SOCIAL INDEPENDIENTE ASI,21662
Alcaldía,BOLIVAR,CLEMENCIA,MIGUEL GUILLERMO GRAU SALCEDO,UNIDOS SEGUIMOS AVANZANDO,21667
Alcaldía,BOLIVAR,CLEMENCIA,YAMIL DONALDO CONEO TAFUR,PARTIDO CONSERVADOR COLOMBIANO,21664
