corp,dpto,mpio,name,party,wp_no
Alcaldía,META,VILLAVICENCIO,ESPERANZA  VARGAS QUIMBAYA,MOVIMIENTO CIVICO LA VOZ DEL PUEBLO,76003
Alcaldía,META,VILLAVICENCIO,FERNANDO  RIVERA SARAZA,PARTIDO DE LA U EN VILLAVO VAMOS BIEN,76006
Alcaldía,META,VILLAVICENCIO,GABRIEL ERNESTO PARRADO DURAN,PARTIDO POLO DEMOCRATICO ALTERNATIVO,76007
Alcaldía,META,VILLAVICENCIO,JAIME ALBERTO RODRIGUEZ ARIAS,PARTIDO ALIANZA VERDE,76004
Alcaldía,META,VILLAVICENCIO,JENNIFER KRISTIN ARIAS FALLA,CENTRO DEMOCRATICO,76001
Alcaldía,META,VILLAVICENCIO,VICTOR DELIO SANCHEZ GOMEZ,PARTIDO CONSERVADOR COLOMBIANO,76005
Alcaldía,META,VILLAVICENCIO,WILMAR ORLANDO BARBOSA ROZO,UNIDOS PODEMOS Y CAMBIO RADICAL,76008
