corp,dpto,mpio,name,party,wp_no
Alcaldía,TOLIMA,LERIDA,CAROLINA  HURTADO BARRERA,LERIDA CENTRO DE DESARROLLO REGIONAL - FIRMES POR LERIDA,103459
Alcaldía,TOLIMA,LERIDA,ELVIA MARIA GARZON PACHECO,PARTIDO CAMBIO RADICAL,103460
Alcaldía,TOLIMA,LERIDA,JAIME  GONZALEZ ,PARTIDO POLO DEMOCRATICO ALTERNATIVO,103462
Alcaldía,TOLIMA,LERIDA,JUAN CARLOS CASTAÑEDA NARVAEZ,CENTRO DEMOCRATICO,103457
Alcaldía,TOLIMA,LERIDA,LUIS CARLOS AMEZQUITA CARDENAS,PARTIDO CONSERVADOR COLOMBIANO,103461
Alcaldía,TOLIMA,LERIDA,MARCO ANTONIO OSPINA VELANDIA,COMPROMISO TOTAL,103458
