corp,dpto,mpio,name,party,wp_no
Alcaldía,ATLANTICO,PONEDERA,ALVARO EMILIO SARMIENTO PACHECO,PARTIDO CONSERVADOR COLOMBIANO,16386
Alcaldía,ATLANTICO,PONEDERA,ANGELICA MARIA ARIZA CARRACEDO,PARTIDO SOCIAL DE UNIDAD NACIONAL PARTIDO DE LA U,16390
Alcaldía,ATLANTICO,PONEDERA,ARISTARCO  ROMERO MERIÑO,PARTIDO LIBERAL COLOMBIANO,16387
Alcaldía,ATLANTICO,PONEDERA,LUZ ELENA MENCO ROJANO,PARTIDO OPCION CIUDADANA,16388
Alcaldía,ATLANTICO,PONEDERA,OSCAR DARIO SANTODOMINGO PAYERAS,PARTIDO POLO DEMOCRATICO ALTERNATIVO,16389
Alcaldía,ATLANTICO,PONEDERA,PLUTARCO JOSE HERRERA REALES,MOVIMIENTO ALTERNATIVO INDIGENA Y SOCIAL MAIS,16383
Alcaldía,ATLANTICO,PONEDERA,RAFAEL ALFONSO LASCANO CONTRERAS,PARTIDO ALIANZA VERDE,16384
Alcaldía,ATLANTICO,PONEDERA,VANESA ILIANA BOLIVAR MARTINEZ,PARTIDO CAMBIO RADICAL,16385
