corp,dpto,mpio,name,party,wp_no
Alcaldía,CUNDINAMARCA,LA PALMA,ADRIAN  TOVAR ESPITIA,CENTRO DEMOCRATICO,56567
Alcaldía,CUNDINAMARCA,LA PALMA,GUILLERMO  MARROQUIN AVELLANEDA,PARTIDO OPCION CIUDADANA,56570
Alcaldía,CUNDINAMARCA,LA PALMA,JOHN JAIRO PULIDO PULGARIN,MOVIMIENTO AUTORIDADES INDIGENAS DE COLOMBIA AICO,56568
Alcaldía,CUNDINAMARCA,LA PALMA,JOSE GERSAIN BUSTOS ALVAREZ,PARTIDO CAMBIO RADICAL,56569
Alcaldía,CUNDINAMARCA,LA PALMA,LEONARDO ENRIQUE RAMIREZ ZARATE,PARTIDO SOCIAL DE UNIDAD NACIONAL PARTIDO DE LA U,56571
