corp,dpto,mpio,name,party,wp_no
Alcaldía,CORDOBA,SAN PELAYO,JAIRO AUGUSTO MAFIOLY COLON,PARTIDO OPCION CIUDADANA,51279
Alcaldía,CORDOBA,SAN PELAYO,LUIS ENRIQUE LENGUA PAEZ,PARTIDO LIBERAL COLOMBIANO,51278
Alcaldía,CORDOBA,SAN PELAYO,MARIA ALEJANDRA FORERO PAREJA,PARTIDO SOCIAL DE UNIDAD NACIONAL PARTIDO DE LA U,51280
Alcaldía,CORDOBA,SAN PELAYO,OSWALDO MANUEL NEGRETE CAUSIL,PARTIDO CAMBIO RADICAL,51276
Alcaldía,CORDOBA,SAN PELAYO,ROBERTO EDUARDO GONZALEZ PATERNINA,PARTIDO CONSERVADOR COLOMBIANO,51277
Alcaldía,CORDOBA,SAN PELAYO,WILLIAM ESTEBAN CAVADIA HERNANDEZ,PARTIDO ALIANZA VERDE,51275
