corp,dpto,mpio,name,party,wp_no
Alcaldía,HUILA,BARAYA,AFFIF  CAMPOS SEFAIR,PARTIDO CONSERVADOR COLOMBIANO,63476
Alcaldía,HUILA,BARAYA,EDUARDO  AVILES RIVERA,MOVIMIENTO ALTERNATIVO INDIGENA Y SOCIAL MAIS,63472
Alcaldía,HUILA,BARAYA,ENRIQUE  HERRERA LUCUARA,PARTIDO SOCIAL DE UNIDAD NACIONAL PARTIDO DE LA U,63478
Alcaldía,HUILA,BARAYA,JOSE ARBEY ORTIZ VALENCIA,MOVIMIENTO AUTORIDADES INDIGENAS DE COLOMBIA AICO,63473
Alcaldía,HUILA,BARAYA,LUIS ENRIQUE CARDOSO TOVAR,PARTIDO CAMBIO RADICAL,63475
Alcaldía,HUILA,BARAYA,SANDRA PATRICIA SILVA SOTO,PARTIDO ALIANZA VERDE,63474
Alcaldía,HUILA,BARAYA,SANDRO GEIRLER ALVARADO SERRATO,PARTIDO LIBERAL COLOMBIANO,63477
