corp,dpto,mpio,name,party,wp_no
Alcaldía,ANTIOQUIA,MEDELLIN,EUGENIO ENRIQUE PRIETO SOTO,PARTIDO LIBERAL COLOMBIANO,7938
Alcaldía,ANTIOQUIA,MEDELLIN,FABIO ALONSO SALAZAR JARAMILLO,PARTIDO ALIANZA VERDE - PARTIDO ALIANZA SOCIAL INDEPENDIENTE (ASI),7937
Alcaldía,ANTIOQUIA,MEDELLIN,FEDERICO ANDRES GUTIERREZ ZULUAGA,CREEMOS,7935
Alcaldía,ANTIOQUIA,MEDELLIN,GABRIEL JAIME RICO BETANCUR,GRAN ALIANZA POR MEDELLÍN,7936
Alcaldía,ANTIOQUIA,MEDELLIN,HECTOR MANUEL HOYOS MENESES,PARTIDO POLO DEMOCRATICO ALTERNATIVO,7939
Alcaldía,ANTIOQUIA,MEDELLIN,JUAN CARLOS ROBERTO VELEZ URIBE,CENTRO DEMOCRATICO,7934
