corp,dpto,mpio,name,party,wp_no
Alcaldía,ANTIOQUIA,SOPETRAN,ADRIAN ALBERTO VAHOS URIBE,PARTIDO ALIANZA VERDE,11413
Alcaldía,ANTIOQUIA,SOPETRAN,FREDY ARMANDO METAUTE ESCUDERO,PARTIDO POLO DEMOCRATICO ALTERNATIVO,11415
Alcaldía,ANTIOQUIA,SOPETRAN,JORGE ELIECER QUICENO MACHADO,MOVIMIENTO ALTERNATIVO INDIGENA Y SOCIAL MAIS,11412
Alcaldía,ANTIOQUIA,SOPETRAN,LEON DARIO TOBON ORREGO,CENTRO DEMOCRATICO,11411
Alcaldía,ANTIOQUIA,SOPETRAN,LUIS FELIPE TOBON GONZALEZ,PARTIDO SOCIAL DE UNIDAD NACIONAL PARTIDO DE LA -U- Y PARTIDO CAMBIO RADICAL,11416
Alcaldía,ANTIOQUIA,SOPETRAN,YEISON ESTIVEN PANIAGUA GUTIERREZ,PARTIDO LIBERAL COLOMBIANO Y PARTIDO CONSERVADOR,11414
