corp,dpto,mpio,name,party,wp_no
Alcaldía,ANTIOQUIA,SALGAR,CARLOS ANDRES LONDOÑO VELEZ,CENTRO DEMOCRATICO,9842
Alcaldía,ANTIOQUIA,SALGAR,CARLOS EMEL CUERVO CAÑOLA,PARTIDO LIBERAL COLOMBIANO,9845
Alcaldía,ANTIOQUIA,SALGAR,DIVO  FRANCO SANTODOMING,MOVIMIENTO ALTERNATIVO INDIGENA Y SOCIAL MAIS,9843
Alcaldía,ANTIOQUIA,SALGAR,JOSE IGNACIO RUIZ GOMEZ,PARTIDO OPCION CIUDADANA,9846
Alcaldía,ANTIOQUIA,SALGAR,LUIS GUILLERMO CUARTAS FERNANDEZ,PARTIDO POLO DEMOCRATICO ALTERNATIVO,9847
Alcaldía,ANTIOQUIA,SALGAR,RAUL ANTONIO ALVAREZ ARANGO,PARTIDO CONSERVADOR COLOMBIANO,9844
Alcaldía,ANTIOQUIA,SALGAR,WILMAR DE JESUS PEREZ ARREDONDO,PARTIDO SOCIAL DE UNIDAD NACIONAL PARTIDO DE LA U,9848
