corp,dpto,mpio,name,party,wp_no
Alcaldía,HUILA,CAMPOALEGRE,ALDEMAR  GUTIERREZ MUÑOZ,PARTIDO CAMBIO RADICAL Y PARTIDO ALIANZA SOCIAL INDEPENDIENTE  ASI,63551
Alcaldía,HUILA,CAMPOALEGRE,ALDEMAR  QUESADA LOSADA,PARTIDO SOCIAL DE UNIDAD NACIONAL PARTIDO DE LA U,63554
Alcaldía,HUILA,CAMPOALEGRE,ELIZABETH  MOTTA ALVAREZ,PARTIDO LIBERAL COLOMBIANO,63552
Alcaldía,HUILA,CAMPOALEGRE,LEONOR MERCEDES OTERO LISCANO,PARTIDO ALIANZA VERDE,63550
Alcaldía,HUILA,CAMPOALEGRE,NELSON LEONARDO FIERRO GONZALEZ,CENTRO DEMOCRATICO,63549
Alcaldía,HUILA,CAMPOALEGRE,YONY  RODRIGUEZ DIAZ,PARTIDO POLO DEMOCRATICO ALTERNATIVO,63553
