corp,dpto,mpio,name,party,wp_no
Alcaldía,VALLE,ZARZAL,ALEXANDER  GOMEZ SALAZAR,PARTIDO ALIANZA SOCIAL INDEPENDIENTE ASI,111977
Alcaldía,VALLE,ZARZAL,CARLOS  GONGORA ,PARTIDO CONSERVADOR COLOMBIANO,111980
Alcaldía,VALLE,ZARZAL,CARLOS ENRIQUE GOMEZ ARBOLEDA,PARTIDO LIBERAL COLOMBIANO,111981
Alcaldía,VALLE,ZARZAL,CARLOS HECTOR CAICEDO BALANTA,PARTIDO CAMBIO RADICAL,111979
Alcaldía,VALLE,ZARZAL,JULIAN ALBERTO LLANOS LIBREROS,CENTRO DEMOCRATICO,111976
Alcaldía,VALLE,ZARZAL,LUZ ELENA LOPEZ ,PARTIDO SOCIAL DE UNIDAD NACIONAL PARTIDO DE LA U,111982
