corp,dpto,mpio,name,party,wp_no
Alcaldía,NARIÑO,LA CRUZ,ELENA  MARTINEZ MARTINEZ,PARTIDO CAMBIO RADICAL,78301
Alcaldía,NARIÑO,LA CRUZ,FABIO ORIOL MUÑOZ PALACIOS,PARTIDO ALIANZA VERDE,78300
Alcaldía,NARIÑO,LA CRUZ,GERMAN  BRAVO RUSSY,MOVIMIENTO AUTORIDADES INDIGENAS DE COLOMBIA AICO,78299
Alcaldía,NARIÑO,LA CRUZ,MARCO ROMAN PALACIOS ENRIQUEZ,LASI,78298
Alcaldía,NARIÑO,LA CRUZ,ROBERT GIOVANY LEDEZMA ORTEGA,LA CRUZ SOMOS TODOS,78297
Alcaldía,NARIÑO,LA CRUZ,VICTOR HUGO BOLAÑOS MUÑOZ,CENTRO DEMOCRATICO,78296
