corp,dpto,mpio,name,party,wp_no
Alcaldía,ANTIOQUIA,FRONTINO,CARLOS HERNANDO LORA SERNA,MOVIMIENTO CIVICO INDEPENDIENTE DE RENOVACION CIUDADANA,5137
Alcaldía,ANTIOQUIA,FRONTINO,FELIX ALFAZAR GONZALEZ MIRA,PARTIDO OPCION CIUDADANA,5142
Alcaldía,ANTIOQUIA,FRONTINO,FREDY ALONSO CARVAJAL TAMAYO,PARTIDO ALIANZA SOCIAL INDEPENDIENTE ASI,5138
Alcaldía,ANTIOQUIA,FRONTINO,JORGE LEON CASTRILLON CIFUENTES,PARTIDO CAMBIO RADICAL,5139
Alcaldía,ANTIOQUIA,FRONTINO,JOSE LUIS SARRAZOLA GUTIERREZ,PARTIDO LIBERAL COLOMBIANO,5141
Alcaldía,ANTIOQUIA,FRONTINO,JUDITH  HERRERA MORENO,PARTIDO SOCIAL DE UNIDAD NACIONAL PARTIDO DE LA U,5143
Alcaldía,ANTIOQUIA,FRONTINO,YUDY ESTELLA PULGARIN MARIN,PARTIDO CONSERVADOR COLOMBIANO,5140
