corp,dpto,mpio,name,party,wp_no
Alcaldía,VICHADA,PUERTO CARREÑO,EMILCE  ALVAREZ FAJARDO,PARTIDO ALIANZA VERDE,112809
Alcaldía,VICHADA,PUERTO CARREÑO,JAIR ESTEBAN BELTRAN HINOJOSA,PARTIDO CAMBIO RADICAL,112810
Alcaldía,VICHADA,PUERTO CARREÑO,LUIS ANTONIO ROBLEDO VALBUENA,PARTIDO LIBERAL COLOMBIANO,112811
Alcaldía,VICHADA,PUERTO CARREÑO,MARCOS  PEREZ JIMENEZ,CENTRO DEMOCRATICO,112808
Alcaldía,VICHADA,PUERTO CARREÑO,RAMON ANDRES PLATA FAJARDO,PARTIDO SOCIAL DE UNIDAD NACIONAL PARTIDO DE LA U - ALIANZA SOCIAL INDEPENDIENTE ASI,112813
Alcaldía,VICHADA,PUERTO CARREÑO,WILLIAM HENRY RIVERA ESCOBAR,PARTIDO OPCION CIUDADANA,112812
