corp,dpto,mpio,name,party,wp_no
Alcaldía,CUNDINAMARCA,TENJO,ALBERTO JAVIER GARCIA HERNANDEZ,"CAMBIO RADICAL, LA U, CONSERVADOR, OPCION CIUDADANA",60304
Alcaldía,CUNDINAMARCA,TENJO,JUAN GABRIEL GOMEZ CAMPOS,CENTRO DEMOCRATICO,60305
Alcaldía,CUNDINAMARCA,TENJO,RICARDO ANEIDER FORERO PALACIOS,PARTIDO LIBERAL COLOMBIANO,60308
Alcaldía,CUNDINAMARCA,TENJO,SONIA PATRICIA GONZALEZ BERNAL,"PARTIDO ALIANZA VERDE, MAIS, AICO",60307
Alcaldía,CUNDINAMARCA,TENJO,WILLIAM ALFONSO MUÑOZ BERNAL,PARTIDO POLO DEMOCRATICO ALTERNATIVO,60309
