corp,dpto,mpio,name,party,wp_no
Alcaldía,HUILA,ACEVEDO,GENTIL  TAPIERO BUITRAGO,PARTIDO OPCION CIUDADANA,63105
Alcaldía,HUILA,ACEVEDO,HILARIA  TRIANA OTALORA,MOVIMIENTOS DE AUTORIDADES INDIGENAS DE COLOMBIA AICO - PARTIDO LIBERAL,63101
Alcaldía,HUILA,ACEVEDO,LEIDY  GOMEZ BENITEZ,PARTIDO DE UNIDAD NACIONAL  Y PARTIDO CAMBIO RADICAL,63104
Alcaldía,HUILA,ACEVEDO,LUZDEY  ARTUNDUAGA CASTRO,PARTIDO CONSERVADOR COLOMBIA Y PÁRTIDO CENTRO DEMOCRATICO,63103
Alcaldía,HUILA,ACEVEDO,NACIANCENO  ORTIZ MONRROY,PARTIDO ALIANZA VERDE,63102
