corp,dpto,mpio,name,party,wp_no
Alcaldía,CORDOBA,CHINU,DIANA REGINA ALVAREZ RAMOS,PARTIDO LIBERAL COLOMBIANO,48052
Alcaldía,CORDOBA,CHINU,JULIO JAVIER LARA CASTILLO,PARTIDO ALIANZA VERDE,48050
Alcaldía,CORDOBA,CHINU,REYNALDO DE LOS REYES RUIZ VILLADIEGO,PARTIDO OPCION CIUDADANA,48053
Alcaldía,CORDOBA,CHINU,RICARDO ANDRES IGLESIA ZAMBRANO,PARTIDO POLO DEMOCRATICO ALTERNATIVO,48054
Alcaldía,CORDOBA,CHINU,TERESA MARIA SALAMANCA DE AVILEZ,PARTIDO CAMBIO RADICAL,48051
Alcaldía,CORDOBA,CHINU,YAMIR OSBALDO PINEDA FAILACH,PARTIDO ALIANZA SOCIAL INDEPENDIENTE ASI,48049
