corp,dpto,mpio,name,party,wp_no
Alcaldía,SANTANDER,MALAGA,FREDY ARLEY CACERES RAMIREZ,"PARTIDO OPCION CIUDADANA, PARTIDO LIBERAL Y PARTIDO CAMBIO RADICAL",95021
Alcaldía,SANTANDER,MALAGA,LUIS ALBERTO CASTRO ROJAS,PARTIDO UNION PATRIOTICA UP,95024
Alcaldía,SANTANDER,MALAGA,MILTON JOSE SUAREZ CABALLERO,CENTRO DEMOCRATICO,95019
Alcaldía,SANTANDER,MALAGA,OSCAR HERNANDO SUAREZ VEGA,PARTIDO POLO DEMOCRATICO ALTERNATIVO,95023
Alcaldía,SANTANDER,MALAGA,OSCAR MIGUEL JOYA ARENALES,COALICION PROGRAMATICA Y POLITICA ENTRE EL PARTIDO SOCIAL DE UNIDAD NACIONAL -PARTIDO DE LA U-,95020
Alcaldía,SANTANDER,MALAGA,RUBEN DARIO MORENO MENDEZ,PARTIDO ALIANZA SOCIAL INDEPENDIENTE ASI,95022
