corp,dpto,mpio,name,party,wp_no
Alcaldía,SUCRE,SAN PEDRO,ALBERTO DE JESUS HENAO PERALTA,PARTIDO POLO DEMOCRATICO ALTERNATIVO,99658
Alcaldía,SUCRE,SAN PEDRO,AUGUSTO RAFAEL BENITEZ DE LA OSSA,PARTIDO OPCION CIUDADANA,99657
Alcaldía,SUCRE,SAN PEDRO,ENRRIQUE CARLOS COHEN MENDOZA,PARTIDO SOCIAL DE UNIDAD NACIONAL PARTIDO DE LA U,99659
Alcaldía,SUCRE,SAN PEDRO,LILIANA CRISTINA BENITEZ ARRIETA,CENTRO DEMOCRATICO,99654
Alcaldía,SUCRE,SAN PEDRO,REBECA ISABEL CRUZ VERGARA,PARTIDO CAMBIO RADICAL,99656
Alcaldía,SUCRE,SAN PEDRO,ROQUELINO ANTONIO BEJARANO LAMBRAÑO,MOVIMIENTO AUTORIDADES INDIGENAS DE COLOMBIA AICO,99655
