corp,dpto,mpio,name,party,wp_no
Alcaldía,SANTANDER,SABANA DE TORRES,CARLOS FERNANDO PELUHA CASTRO,PARTIDO SOCIAL DE UNIDAD NACIONAL PARTIDO DE LA U,96326
Alcaldía,SANTANDER,SABANA DE TORRES,DARIO BUCHENICOW CABALLERO CHIQUILLO,MOVIMIENTO AUTORIDADES INDIGENAS DE COLOMBIA AICO,96322
Alcaldía,SANTANDER,SABANA DE TORRES,GIOVANNI  GARCES CABALLERO,PARTIDO ALIANZA VERDE,96323
Alcaldía,SANTANDER,SABANA DE TORRES,MIGUEL OMAR LEAL BOTELLO,CENTRO DEMOCRATICO,96320
Alcaldía,SANTANDER,SABANA DE TORRES,SAÚL  CAMARGO RIVERA,PARTIDO OPCION CIUDADANA,96325
Alcaldía,SANTANDER,SABANA DE TORRES,SNEYDER AUGUSTO PINILLA ALVAREZ,ASI-CONSERVADOR,96319
Alcaldía,SANTANDER,SABANA DE TORRES,SONIA MARIA SANCHEZ RUEDA,PARTIDO LIBERAL COLOMBIANO,96324
Alcaldía,SANTANDER,SABANA DE TORRES,WILLIAM FERNANDO VELANDIA ,MOVIMIENTO ALTERNATIVO INDIGENA Y SOCIAL MAIS,96321
