corp,dpto,mpio,name,party,wp_no
Alcaldía,CUNDINAMARCA,GUADUAS,EFRAIN EDUARDO CONTRERAS RAMIREZ,PARTIDO SOCIAL DE UNIDAD NACIONAL PARTIDO DE LA U,55826
Alcaldía,CUNDINAMARCA,GUADUAS,GERMAN  HERRERA GOMEZ,CENTRO DEMOCRATICO,55821
Alcaldía,CUNDINAMARCA,GUADUAS,GUILLERMO  RUIZ MOLINA,PARTIDO CAMBIO RADICAL,55825
Alcaldía,CUNDINAMARCA,GUADUAS,HUMBERTO  ORDOÑEZ PEREZ,PARTIDO ALIANZA SOCIAL INDEPENDIENTE ASI,55823
Alcaldía,CUNDINAMARCA,GUADUAS,JESUS EDISSON RAMIREZ MARTINEZ,PARA VOLVER A CREER,55822
Alcaldía,CUNDINAMARCA,GUADUAS,WILLIAM RICARDO GUERRERO MELO,PARTIDO ALIANZA VERDE,55824
