corp,dpto,mpio,name,party,wp_no
Alcaldía,BOYACA,VILLA DE LEIVA,ALBERT DARIO ESTUPIÑAN RODRIGUEZ,PARTIDO CONSERVADOR COLOMBIANO,32103
Alcaldía,BOYACA,VILLA DE LEIVA,CARLOS EDUARDO BERMUDEZ RUGET,CENTRO DEMOCRATICO,32100
Alcaldía,BOYACA,VILLA DE LEIVA,JOSUE JAVIER CASTELLANOS MORALES,COALICION MOVIMIENTO SIGNIFICATIVO DE CIUDADANOS TODOS POR VILLA DE LEYVA - ALIANZA VERDE,32101
Alcaldía,BOYACA,VILLA DE LEIVA,JUAN EVANGELISTA FARFAN CORZO,OPCIÓN CIUDADANA Y ALIANZA SOCIAL INDEPENDIENTE - ASI,32102
Alcaldía,BOYACA,VILLA DE LEIVA,VICTOR ALFONSO GAMBOA CHAPARRO,PARTIDO LIBERAL COLOMBIANO,32104
Alcaldía,BOYACA,VILLA DE LEIVA,VICTOR HUGO FORERO SANCHEZ,PARTIDO SOCIAL DE UNIDAD NACIONAL PARTIDO DE LA U,32105
