corp,dpto,mpio,name,party,wp_no
Alcaldía,TOLIMA,NATAGAIMA,ARCESIO  PERDOMO NAVARRO,ALIANZA POR NATAGAIMA Y CENTRO DEMOCRATICO,103995
Alcaldía,TOLIMA,NATAGAIMA,ASTRID  PAVA YARA,OPCION CIUDADANA Y ASI,103998
Alcaldía,TOLIMA,NATAGAIMA,BENJAMIN  SANJUANES ROMERO,MOVIMIENTO ALTERNATIVO INDIGENA Y SOCIAL MAIS,103996
Alcaldía,TOLIMA,NATAGAIMA,HECTOR  POMAR VANEGAS,PARTIDO POLO DEMOCRATICO ALTERNATIVO,104001
Alcaldía,TOLIMA,NATAGAIMA,JESUS ALBERTO MANIOS URBANO,PARTIDO LIBERAL COLOMBIANO,104000
Alcaldía,TOLIMA,NATAGAIMA,JUAN MANUEL HERRERA JIMENEZ,PARTIDO SOCIAL DE UNIDAD NACIONAL PARTIDO DE LA U,104002
Alcaldía,TOLIMA,NATAGAIMA,JUAN MANUEL ROJAS ROJAS,PARTIDO CAMBIO RADICAL,103999
Alcaldía,TOLIMA,NATAGAIMA,YILBER  GUEPENDO OLARTE,MOVIMIENTO AUTORIDADES INDIGENAS DE COLOMBIA AICO,103997
