corp,dpto,mpio,name,party,wp_no
Alcaldía,TOLIMA,VILLAHERMOSA,CESAR AUGUSTO RESTREPO ,PARTIDO CONSERVADOR COLOMBIANO,105353
Alcaldía,TOLIMA,VILLAHERMOSA,GERMAN DE JESUS URIBE ARCILA,PARTIDO SOCIAL DE UNIDAD NACIONAL PARTIDO DE LA U,105356
Alcaldía,TOLIMA,VILLAHERMOSA,GUSTAVO  GIRALDO OSORIO,PARTIDO ALIANZA VERDE,105351
Alcaldía,TOLIMA,VILLAHERMOSA,JOSE JAIRO MENDOZA RAMIREZ,PARTIDO OPCION CIUDADANA,105354
Alcaldía,TOLIMA,VILLAHERMOSA,JOSE RICARDO VALLEJO SANCHEZ,PARTIDO CAMBIO RADICAL,105352
Alcaldía,TOLIMA,VILLAHERMOSA,LEIDY ISABEL GONZALEZ BETANCOURT,PARTIDO POLO DEMOCRATICO ALTERNATIVO,105355
