corp,dpto,mpio,name,party,wp_no
Alcaldía,ANTIOQUIA,ENVIGADO,ANDRES DAVID TORRES GOMEZ,PARTIDO SOCIAL DE UNIDAD NACIONAL PARTIDO DE LA U,4841
Alcaldía,ANTIOQUIA,ENVIGADO,JHONY OSWALDO VELEZ QUINTERO,CENTRO DEMOCRATICO,4836
Alcaldía,ANTIOQUIA,ENVIGADO,JOSE HILARIO LOPEZ NIÑO,PARTIDO POLO DEMOCRATICO ALTERNATIVO,4840
Alcaldía,ANTIOQUIA,ENVIGADO,OSCAR DE JESUS VASQUEZ MEJIA,PARTIDO ALIANZA SOCIAL INDEPENDIENTE ASI,4837
Alcaldía,ANTIOQUIA,ENVIGADO,RAMIRO DE JESUS VARGAS MUÑOZ,PARTIDO ALIANZA VERDE,4838
Alcaldía,ANTIOQUIA,ENVIGADO,RAUL EDUARDO CARDONA GONZALEZ,PARTIDO LIBERAL COLOMBIANO,4839
