corp,dpto,mpio,name,party,wp_no
Alcaldía,PUTUMAYO,PUERTO GUZMAN,CARLOS HENRY CARDONA BENAVIDES,PARTIDO CAMBIO RADICAL,85213
Alcaldía,PUTUMAYO,PUERTO GUZMAN,GERARDO ANTONIO CHACON VALDERRAMA,COALICIÓN PROGRAMÁTICA  Y POLÍTICA  ENTRE LOS PARTIDOS LIBERAL COLOMBIANO Y PARTIDO SOCIAL DE UNIDAD,85210
Alcaldía,PUTUMAYO,PUERTO GUZMAN,JAHAMMEN  OCORO ,PARTIDO ALIANZA SOCIAL INDEPENDIENTE ASI,85211
Alcaldía,PUTUMAYO,PUERTO GUZMAN,JAMES ALEXCY CORDOBA TOVAR,PARTIDO CONSERVADOR COLOMBIANO,85214
Alcaldía,PUTUMAYO,PUERTO GUZMAN,RODRIGO  RIVERA RAMIREZ,PARTIDO ALIANZA VERDE,85212
