corp,dpto,mpio,name,party,wp_no
Alcaldía,MAGDALENA,REMOLINO,JOSE DE JESUS NOLASCO HERNANDEZ,PARTIDO OPCION CIUDADANA,71596
Alcaldía,MAGDALENA,REMOLINO,LUIS ALFONSO VIDAL TORRES,PARTIDO SOCIAL DE UNIDAD NACIONAL PARTIDO DE LA U,71597
Alcaldía,MAGDALENA,REMOLINO,MARIA DE LOS SANTOS POLO AVENDAÑO,PARTIDO ALIANZA SOCIAL INDEPENDIENTE ASI,71593
Alcaldía,MAGDALENA,REMOLINO,MILTON DE JESUS CANTILLO CANTILLO,PARTIDO ALIANZA VERDE,71594
Alcaldía,MAGDALENA,REMOLINO,RODOLFO DE JESUS QUANT GONZALEZ,PARTIDO LIBERAL COLOMBIANO,71595
