corp,dpto,mpio,name,party,wp_no
Alcaldía,CAUCA,TIMBIO,CARLOS JULIO ALEGRIA MANTILLA,PARTIDO CAMBIO RADICAL,41840
Alcaldía,CAUCA,TIMBIO,DIEGO HERNAN BERMUDEZ PORTILLA,CENTRO DEMOCRATICO,41836
Alcaldía,CAUCA,TIMBIO,HECTOR JAVIER ASTUDILLO GARZON,MOVIMIENTO ALTERNATIVO INDIGENA Y SOCIAL MAIS,41838
Alcaldía,CAUCA,TIMBIO,JAVIER ARNOBIO LOPEZ ARCOS,PARTIDO SOCIAL DE UNIDAD NACIONAL PARTIDO DE LA U,41842
Alcaldía,CAUCA,TIMBIO,LIBARDO  VASQUEZ MANZANO,COALICION PROGRAMATICA Y POLITICA,41837
Alcaldía,CAUCA,TIMBIO,MARTIN EMILIO ARROYAVE LOPEZ,PARTIDO CONSERVADOR COLOMBIANO,41841
