corp,dpto,mpio,name,party,wp_no
Alcaldía,ANTIOQUIA,MUTATA,CARLOS MARIO ARIAS QUIROZ,PARTIDO SOCIAL DE UNIDAD NACIONAL PARTIDO DE LA U,8268
Alcaldía,ANTIOQUIA,MUTATA,JAIRO ENRIQUE ORTIZ PALACIOS,PARTIDO CAMBIO RADICAL,8266
Alcaldía,ANTIOQUIA,MUTATA,JESUS ROBERTO SEPULVEDA ,CENTRO DEMOCRATICO,8264
Alcaldía,ANTIOQUIA,MUTATA,OSCAR ANTONIO CALLE GUZMAN,PARTIDO UNION PATRIOTICA UP,8269
Alcaldía,ANTIOQUIA,MUTATA,ROOSVELT JAIR OSPINA SEPULVEDA,PARTIDO LIBERAL Y PARTIDO CONSERVADOR,8267
Alcaldía,ANTIOQUIA,MUTATA,SILVIO  RIVAS ARCOS,PARTIDO ALIANZA VERDE,8265
