corp,dpto,mpio,name,party,wp_no
Alcaldía,ATLANTICO,SANTA LUCIA,BEY BALTAZAR BROCHERO RAVELO,PARTIDO CAMBIO RADICAL,17004
Alcaldía,ATLANTICO,SANTA LUCIA,GEOVANNY RAFAEL GONZALEZ SABALZA,PARTIDO ALIANZA VERDE,17003
Alcaldía,ATLANTICO,SANTA LUCIA,JORGE LUIS POLO MEDINA,PARTIDO CONSERVADOR COLOMBIANO,17005
Alcaldía,ATLANTICO,SANTA LUCIA,JOSE LEANDRO DUQUE JORDAN,MOVIMIENTO ALTERNATIVO INDIGENA Y SOCIAL MAIS,17002
Alcaldía,ATLANTICO,SANTA LUCIA,JOSE MARIA POLO PANTOJA,PARTIDO OPCION CIUDADANA,17007
Alcaldía,ATLANTICO,SANTA LUCIA,JOSE RAFAEL CARREÑO MARTINEZ,PARTIDO LIBERAL COLOMBIANO,17006
Alcaldía,ATLANTICO,SANTA LUCIA,JULIO CESAR ZARATE MUÑOZ,PARTIDO UNION PATRIOTICA UP,17009
Alcaldía,ATLANTICO,SANTA LUCIA,YAIR DE JESUS MEDINA GONZALEZ,PARTIDO SOCIAL DE UNIDAD NACIONAL PARTIDO DE LA U,17008
