corp,dpto,mpio,name,party,wp_no
Alcaldía,BOLIVAR,TIQUISIO (PTO. RICO),ABEL ALBERTO POLANCO LEMOS,MOVIMIENTO ALTERNATIVO INDIGENA Y SOCIAL - MAIS,7840
Alcaldía,BOLIVAR,TIQUISIO (PTO. RICO),FERNANDO ENRIQUE BERTEL MEZA,PARTIDO CONSERVADOR COLOMBIANO,7841
Alcaldía,BOLIVAR,TIQUISIO (PTO. RICO),JOSE ALFREDO JIMENEZ CASTILLO,PARTIDO CENTRO DEMOCRATICO,7839
Alcaldía,BOLIVAR,TIQUISIO (PTO. RICO),KAREN MELISSA CONTRERAS ACUÑA,PARTIDO CENTRO DEMOCRATICO,117785
Alcaldía,BOLIVAR,TIQUISIO (PTO. RICO),LINO JOSE DE LEON BOLAÑO,PARTIDO LIBERAL COLOMBIANO,7838
Alcaldía,BOLIVAR,TIQUISIO (PTO. RICO),MARLON  FLOREZ MARQUEZ,PARTIDO SOCIAL DE UNIDAD NACIONAL PARTIDO DE LA U,7842
