corp,dpto,mpio,name,party,wp_no
Alcaldía,TOLIMA,PIEDRAS,CARLOS ENRIQUE RUIZ OSPINA,PARTIDO ALIANZA VERDE,7117
Alcaldía,TOLIMA,PIEDRAS,CARLOS IVAN OLAYA BENAVIDES,PARTIDO CAMBIO RADICAL,7116
Alcaldía,TOLIMA,PIEDRAS,DIEGO FERNANDO RONDON TRIANA,PIEDRAS CON PROYECCION REGIONAL,7120
Alcaldía,TOLIMA,PIEDRAS,GERARDO ANDRES RODRIGUEZ BURITICA,PARTIDO CENTRO DEMOCRATICO,7115
Alcaldía,TOLIMA,PIEDRAS,JOHN ALEXANDER PINZON HERNANDEZ,UNIDOS PARA VOLVER A CREER,7121
Alcaldía,TOLIMA,PIEDRAS,JOSE ADALVER SANCHEZ TORRES,PARTIDO SOCIAL DE UNIDAD NACIONAL PARTIDO DE LA U,7119
Alcaldía,TOLIMA,PIEDRAS,JULIO CESAR GONGORA SANCHEZ,PARTIDO ALIANZA SOCIAL INDEPENDIENTE - ASI,7118
