corp,dpto,mpio,name,party,wp_no
Alcaldía,VALLE,EL CERRITO,CARLOS EDINSON CAMPOS GARZON,PARTIDO COLOMBIA JUSTA LIBRES,7409
Alcaldía,VALLE,EL CERRITO,CARLOS FRANCO VALLEJO ,PARTIDO COLOMBIA RENACIENTE,7410
Alcaldía,VALLE,EL CERRITO,JOSE ARLES TOBON GIRON,MOVIMIENTO ALTERNATIVO INDIGENA Y SOCIAL - MAIS,7408
Alcaldía,VALLE,EL CERRITO,JULIO ALFONSO ROJAS CAICEDO,PARTIDO SOCIAL DE UNIDAD NACIONAL PARTIDO DE LA U,7414
Alcaldía,VALLE,EL CERRITO,LUIS FERNANDO ARANGO ,EL CERRITO HUMANO,7415
Alcaldía,VALLE,EL CERRITO,LUIS FERNANDO OSORIO VARGAS,PARTIDO CAMBIO RADICAL,7412
Alcaldía,VALLE,EL CERRITO,LUZ DARY ROA PRADO,MOVIMIENTO AUTORIDADES INDIGENAS DE COLOMBIA - AICO,7413
Alcaldía,VALLE,EL CERRITO,REYNALDO  GARCIA BURGOS,PARTIDO ADA,7411
