corp,dpto,mpio,name,party,wp_no
Alcaldía,ANTIOQUIA,PEÑOL,ALEX  GIRALDO MONTOYA,PARTIDO CENTRO DEMOCRATICO,3997
Alcaldía,ANTIOQUIA,PEÑOL,DAMIAN  GARCES RESTREPO,AVANZA PEÑOL,4003
Alcaldía,ANTIOQUIA,PEÑOL,FRANCY LINEIDY RAMIREZ ARBELAEZ,PARTIDO COLOMBIA RENACIENTE,3998
Alcaldía,ANTIOQUIA,PEÑOL,JOHN DAIRO DUQUE ZULUAGA,UNIDOS POR EL PEÑOL,4002
Alcaldía,ANTIOQUIA,PEÑOL,JOSE OMAR GARCIA GARCIA,PARTIDO ADA,3999
Alcaldía,ANTIOQUIA,PEÑOL,LUIS GUILLERMO CIRO VERGARA,PARTIDO ALIANZA VERDE,4000
Alcaldía,ANTIOQUIA,PEÑOL,SORANY ANDREA MARIN MARIN,PARTIDO SOCIAL DE UNIDAD NACIONAL PARTIDO DE LA U,4001
