corp,dpto,mpio,name,party,wp_no
Alcaldía,CUNDINAMARCA,VENECIA,ALEJANDRO  MONTEALEGRE ,PARTIDO CONSERVADOR COLOMBIANO - AICO - MAIS,5205
Alcaldía,CUNDINAMARCA,VENECIA,ARNULFO  NINCO CORTES,PARTIDO FUERZA ALTERNATIVA REVOLUCIONARIA DEL COMUN FARC,5201
Alcaldía,CUNDINAMARCA,VENECIA,JOSE ORLANDO RODRIGUEZ SEGURA,PARTIDO ALIANZA VERDE,5203
Alcaldía,CUNDINAMARCA,VENECIA,LIDA CONSUELO CASTIBLANCO SANABRIA,PARTIDO CENTRO DEMOCRATICO,5200
Alcaldía,CUNDINAMARCA,VENECIA,LUZ ARELYS ARIZA LAITON,PARTIDO LIBERAL COLOMBIANO,5199
Alcaldía,CUNDINAMARCA,VENECIA,REYNEL  SILVA MARROQUIN,PARTIDO ADA,5202
Alcaldía,CUNDINAMARCA,VENECIA,YONY ALEXANDER ROMERO CRUZ,NUEVAS IDEAS NUEVO LIDERAZGO,5204
