corp,dpto,mpio,name,party,wp_no
Alcaldía,CHOCO,EL CARMEN,ALBEIRO  ZULETA RESTREPO,CAMINANDO UNIDOS POR EL ATRATO,5398
Alcaldía,CHOCO,EL CARMEN,JAIBERTH DE JESUS RIOS OQUENDO,PARTIDO SOCIAL DE UNIDAD NACIONAL PARTIDO DE LA U,5395
Alcaldía,CHOCO,EL CARMEN,JAIME ARTURO HERRERA MAYA,UN GOBIERNO SOCIAL CON INCLUSION PARA TODOS,5397
Alcaldía,CHOCO,EL CARMEN,JORGE LUIS SANCHEZ CARO,PARTIDO ALIANZA VERDE,5393
Alcaldía,CHOCO,EL CARMEN,NATALIA ANDREA MAZO PEREZ,PARTIDO CONSERVADOR COLOMBIANO,5392
Alcaldía,CHOCO,EL CARMEN,RAMON ANTONIO CARTAGENA MORALES,PARTIDO ALIANZA SOCIAL INDEPENDIENTE - ASI,5394
Alcaldía,CHOCO,EL CARMEN,RUBEN DARIO SANCHEZ HERRERA,SI EL CARMEN LO QUIERE ¡ASI SERA¡,5396
