corp,dpto,mpio,name,party,wp_no
Alcaldía,VAUPES,CARURU,BORIS ORLANDO HERNANDEZ MENESES,PARTIDO SOCIAL DE UNIDAD NACIONAL PARTIDO DE LA U,8342
Alcaldía,VAUPES,CARURU,CERVANDO  VALENCIA CORREA,PARTIDO ALIANZA SOCIAL INDEPENDIENTE - ASI,8341
Alcaldía,VAUPES,CARURU,FANNY  NARVAEZ VALENCIA,PARTIDO LIBERAL COLOMBIANO,8337
Alcaldía,VAUPES,CARURU,JAIRO RAUL MARTINEZ BERNAL,PARTIDO ALIANZA VERDE,8340
Alcaldía,VAUPES,CARURU,JHONY  MARTINEZ GONZALEZ,PARTIDO CAMBIO RADICAL,8339
Alcaldía,VAUPES,CARURU,JOHN LEIVER RAMIREZ NEIRA,PARTIDO CONSERVADOR COLOMBIANO,8338
