corp,dpto,mpio,name,party,wp_no
Alcaldía,PUTUMAYO,VILLAGARZON,CARLOS ARMANDO BENAVIDES ARTEAGA,PARTIDO SOCIAL DE UNIDAD NACIONAL PARTIDO DE LA U,8313
Alcaldía,PUTUMAYO,VILLAGARZON,HILIANA HIBETH TORO PIANDA,VILLA GARZÓN MI CORAZÓN,8316
Alcaldía,PUTUMAYO,VILLAGARZON,JALYLE MARLEY DIAZ ROJAS,CON DIOS Y CON EL  PUEBLO,8315
Alcaldía,PUTUMAYO,VILLAGARZON,JOSE ANDRES LOPEZ MUÑOZ,UNIDOS DE VERDAD,8314
Alcaldía,PUTUMAYO,VILLAGARZON,JOSE ULISES MORA MELO,PARTIDO ADA,8311
Alcaldía,PUTUMAYO,VILLAGARZON,LUIS EDUARDO GARCIA FRANCO,PARTIDO CONSERVADOR COLOMBIANO,8312
