corp,dpto,mpio,name,party,wp_no
Alcaldía,CORDOBA,CIENAGA DE ORO,ANA LUZ BEDOYA USTA,PARTIDO SOCIAL DE UNIDAD NACIONAL PARTIDO DE LA U,4717
Alcaldía,CORDOBA,CIENAGA DE ORO,ANDRES FRANCISCO BURGOS JAIME,PARTIDO CONSERVADOR COLOMBIANO,4714
Alcaldía,CORDOBA,CIENAGA DE ORO,DIOMEDES DOMINGO DIAZ MESTRA,PARTIDO COLOMBIA RENACIENTE,4713
Alcaldía,CORDOBA,CIENAGA DE ORO,EDUARDO ELIAS ZARUR FLOREZ,MOVIMIENTO AUTORIDADES INDIGENAS DE COLOMBIA - AICO,4716
Alcaldía,CORDOBA,CIENAGA DE ORO,EDUARDO JOSE DURANGO DURANGO,PARTIDO POLO DEMOCRATICO ALTERNATIVO,4718
Alcaldía,CORDOBA,CIENAGA DE ORO,NERLY DEL CARMEN SAEZ SALCEDO,PARTIDO ALIANZA VERDE,4715
Alcaldía,CORDOBA,CIENAGA DE ORO,OSCAR CARMELO CORDERO DURANGO,COLOMBIA HUMANA - UNIÓN PATRIÓTICA,4712
