corp,dpto,mpio,name,party,wp_no
Alcaldía,NARIÑO,BARBACOAS,ADAMS BAY RINCON MENESES,PARTIDO CAMBIO RADICAL,5941
Alcaldía,NARIÑO,BARBACOAS,BORIS ADEODATO SEGURA RINCON,MOVIMIENTO AUTORIDADES INDIGENAS DE COLOMBIA - AICO,5942
Alcaldía,NARIÑO,BARBACOAS,JUAN EDGARDO PAY NASTACUAS,MOVIMIENTO ALTERNATIVO INDIGENA Y SOCIAL - MAIS,5940
Alcaldía,NARIÑO,BARBACOAS,MARIO ALEXANDER HURTADO QUIÑONES,COALICION PROGRAMATICA Y POLITICA DENOMINADA MOVIMIENTO ALTERNATIVO SOCIAL MÁS,5944
Alcaldía,NARIÑO,BARBACOAS,NOHORA CAROLINA ORTIZ MORCILLO,PARTIDO SOCIAL DE UNIDAD NACIONAL PARTIDO DE LA U,5943
