corp,dpto,mpio,name,party,wp_no
Alcaldía,MAGDALENA,NUEVA GRANADA,HERNAN  BARRERA PRADA,PARTIDO DE REIVINDICACIÓN ÉTNICA -PRE-,5752
Alcaldía,MAGDALENA,NUEVA GRANADA,JAIRO SAUL FARELO NORIEGA,PARTIDO SOCIAL DE UNIDAD NACIONAL PARTIDO DE LA U,5756
Alcaldía,MAGDALENA,NUEVA GRANADA,JOSE JOAQUIN DE LEON MOSCOTE,PARTIDO ALIANZA VERDE,5754
Alcaldía,MAGDALENA,NUEVA GRANADA,LIZ PETRONA FONTALVO RUIZ,COALICION NUEVA GRANADA EN BUENAS MANOS,5757
Alcaldía,MAGDALENA,NUEVA GRANADA,ORLANDO RAFAEL PELUFFO CARDONA,COLOMBIA HUMANA - UNIÓN PATRIÓTICA,5751
Alcaldía,MAGDALENA,NUEVA GRANADA,PIEDAD DEL SOCORRO CERA CASTELLAR,PARTIDO CONSERVADOR COLOMBIANO,5753
Alcaldía,MAGDALENA,NUEVA GRANADA,ROBERTO LUIS STUMMO GUERRA,PARTIDO ALIANZA SOCIAL INDEPENDIENTE - ASI,5755
