corp,dpto,mpio,name,party,wp_no
Alcaldía,NARIÑO,CONTADERO,DAVID ALBEIRO BENAVIDES ARTEAGA,UNIDOS POR EL PROGRESO,5961
Alcaldía,NARIÑO,CONTADERO,FELIX GERMAN MEJIA PALACIOS,PARTIDO CENTRO DEMOCRATICO,5957
Alcaldía,NARIÑO,CONTADERO,GALO PORFIRIO CHAMORRO DAVILA,PARTIDO SOCIAL DE UNIDAD NACIONAL PARTIDO DE LA U,5960
Alcaldía,NARIÑO,CONTADERO,JUAN SEBASTIAN DAVILA SOLARTE,PARTIDO ALIANZA VERDE,5959
Alcaldía,NARIÑO,CONTADERO,NAYIVE IDALY DEL ROSARIO CEBALLOS VALLEJO,PARTIDO CONSERVADOR COLOMBIANO,5958
