corp,dpto,mpio,name,party,wp_no
Alcaldía,SANTANDER,SUAITA,EDUAR ALONSO GONZALEZ NINO,PARTIDO SOCIAL DE UNIDAD NACIONAL PARTIDO DE LA U,6576
Alcaldía,SANTANDER,SUAITA,ELKIN JAVIER CHACON SANABRIA,UNIDOS SOMOS MAS,6579
Alcaldía,SANTANDER,SUAITA,JAIRO ADELMO PORRAS RUSSI,PARTIDO ALIANZA VERDE,6574
Alcaldía,SANTANDER,SUAITA,JULIO CESAR VILLATE JESSEN,SUAITA DE PUERTAS ABIERTAS,6577
Alcaldía,SANTANDER,SUAITA,LAURA MAGALY PEÑA BARRERA,ALIANZA SOCIAL INDEPENDIENTE MOVIMIENTO ALTERNATIVO INDIGENA Y SOCIAL,6578
Alcaldía,SANTANDER,SUAITA,PABLO HERNANDO OSORIO CALDERON,MOVIMIENTO AUTORIDADES INDIGENAS DE COLOMBIA - AICO,6575
Alcaldía,SANTANDER,SUAITA,REINALDO ARIOLFO SUAREZ CORTES,PARTIDO DE REIVINDICACIÓN ÉTNICA -PRE-,6573
