corp,dpto,mpio,name,party,wp_no
Alcaldía,SUCRE,CHALAN,ALFREDO ANTONIO MERLANO PEREZ,MOVIMIENTO ALTERNATIVO INDIGENA Y SOCIAL - MAIS,6850
Alcaldía,SUCRE,CHALAN,ALVARO ENRIQUE BLANCO TOVAR,PARTIDO ALIANZA VERDE,6853
Alcaldía,SUCRE,CHALAN,ALVARO SEGUNDO MARTINEZ BUELVAS,PARTIDO ALIANZA SOCIAL INDEPENDIENTE - ASI,6854
Alcaldía,SUCRE,CHALAN,HECTOR MIGUEL BELTRAN ALVAREZ,COLOMBIA HUMANA - UNIÓN PATRIÓTICA,6848
Alcaldía,SUCRE,CHALAN,IVONE DEL CARMEN FERNANDEZ GUTIERREZ,PARTIDO CENTRO DEMOCRATICO,6849
Alcaldía,SUCRE,CHALAN,JORGE DAVID MENDEZ VANEGAS,PARTIDO CONSERVADOR COLOMBIANO,6852
Alcaldía,SUCRE,CHALAN,WILTON JOAQUIN BARRETO PEREZ,PARTIDO LIBERAL COLOMBIANO,6847
Alcaldía,SUCRE,CHALAN,YEDXANDER ENRIQUE PATERNINA MARTINEZ,PARTIDO ADA,6851
