corp,dpto,mpio,name,party,wp_no
Alcaldía,CAQUETA,SOLITA,AURORA  LEMUS SALDAÑA,PARTIDO CENTRO DEMOCRATICO,7587
Alcaldía,CAQUETA,SOLITA,CAMILO  GUTIERREZ MORENO,PARTIDO CONSERVADOR COLOMBIANO,7588
Alcaldía,CAQUETA,SOLITA,LUIS ANTONIO MORALES CUBILLOS,PARTIDO SOCIAL DE UNIDAD NACIONAL PARTIDO DE LA U,7590
Alcaldía,CAQUETA,SOLITA,LUIS EDUARDO OCAMPO GAVIRIA,PARTIDO POLO DEMOCRATICO ALTERNATIVO,7591
Alcaldía,CAQUETA,SOLITA,MARICEL  VALENCIA ENDO,ES EL MOMENTO DEL CAMBIO ÚNETE,7592
Alcaldía,CAQUETA,SOLITA,MELVIN ALEJANDRO MARTIN LEGUIZAMON,PARTIDO ALIANZA VERDE,7589
