corp,dpto,mpio,name,party,wp_no
Alcaldía,VALLE,GUACARI,CAROLINA  SANCHEZ CERVERA,PARTIDO CENTRO DEMOCRATICO,7436
Alcaldía,VALLE,GUACARI,DIDIER FERNANDO CARRILLO ,PARTIDO COLOMBIA RENACIENTE,7437
Alcaldía,VALLE,GUACARI,DIEGO FERNANDO BERRIO TASCON,COLOMBIA HUMANA - UNIÓN PATRIÓTICA,7435
Alcaldía,VALLE,GUACARI,MARIO GUILLERMO RUALES SALCEDO,PARTIDO LIBERAL COLOMBIANO,7434
Alcaldía,VALLE,GUACARI,OSCAR HERNAN SANCLEMENTE TORO,PARTIDO SOCIAL DE UNIDAD NACIONAL PARTIDO DE LA U,7439
Alcaldía,VALLE,GUACARI,YINE ZENAIDA PROAÑOS GONZALEZ,PARTIDO DE REIVINDICACIÓN ÉTNICA -PRE-,7438
