corp,dpto,mpio,name,party,wp_no
Alcaldía,BOLIVAR,REGIDOR,ELMIS IRNETH CONTRERAS MACHUCA,COLOMBIA HUMANA - UNIÓN PATRIÓTICA,7970
Alcaldía,BOLIVAR,REGIDOR,EZEQUIEL ANTONIO RUEDA FLOREZ,PARTIDO LIBERAL COLOMBIANO,7969
Alcaldía,BOLIVAR,REGIDOR,FAUSTINA EMILIA ARMESTO MACHUCA,PARTIDO CONSERVADOR COLOMBIANO,7972
Alcaldía,BOLIVAR,REGIDOR,HAROLD  QUIÑONES SANTODOMINGO,EL DESARROLLO CONTINUA,7974
Alcaldía,BOLIVAR,REGIDOR,HERIBERTO  URREGO GOMEZ,PARTIDO COLOMBIA RENACIENTE,7971
Alcaldía,BOLIVAR,REGIDOR,RUBEN DARIO BARROS ROMERO,PARTIDO ALIANZA VERDE,7973
