corp,dpto,mpio,name,party,wp_no
Alcaldía,NORTE DE SANTANDER,VILLA DEL ROSARIO,CARLOS JULIO SOCHA HERNANDEZ,PARTIDO SOCIAL DE UNIDAD NACIONAL PARTIDO DE LA U,6168
Alcaldía,NORTE DE SANTANDER,VILLA DEL ROSARIO,EUGENIO  RANGEL MANRIQUE,ES MOMENTO DE CRECER,6170
Alcaldía,NORTE DE SANTANDER,VILLA DEL ROSARIO,FRANCISCO JAVIER LONDOÑO PINZON,MOVIMIENTO ALTERNATIVO INDIGENA Y SOCIAL - MAIS,6166
Alcaldía,NORTE DE SANTANDER,VILLA DEL ROSARIO,HILSE YAMILE ALDANA PEREZ,PARTIDO CAMBIO RADICAL,6167
Alcaldía,NORTE DE SANTANDER,VILLA DEL ROSARIO,JUAN YENID SUAREZ GOMEZ,COALICION POR LA DEMOCRACIA Y LA PAZ,6169
Alcaldía,NORTE DE SANTANDER,VILLA DEL ROSARIO,LUIS GERSON RUIZ HERNANDEZ,PARTIDO CENTRO DEMOCRATICO,6165
