corp,dpto,mpio,name,party,wp_no
Alcaldía,ANTIOQUIA,CAÑASGORDAS,AICARDO ANTONIO URREGO USUGA,PARTIDO COLOMBIA RENACIENTE,4313
Alcaldía,ANTIOQUIA,CAÑASGORDAS,ELSY DEL SOCORRO CARDONA GARCIA,PARTIDO POLO DEMOCRATICO ALTERNATIVO,4316
Alcaldía,ANTIOQUIA,CAÑASGORDAS,JORGE MARIO OSORIO MUÑOZ,PARTIDO CENTRO DEMOCRATICO,4312
Alcaldía,ANTIOQUIA,CAÑASGORDAS,MARIBEL  GUISAO DIAZ,PARTIDO ALIANZA SOCIAL INDEPENDIENTE - ASI,4315
Alcaldía,ANTIOQUIA,CAÑASGORDAS,TOMAS AUGUSTO OSPINA ROJO,PARTIDO CONSERVADOR COLOMBIANO,4314
