corp,dpto,mpio,name,party,wp_no
Alcaldía,BOLIVAR,SANTA ROSA,ADOLFO ENRIQUE PADILLA ARROYO,MOVIMIENTO ALTERNATIVO INDIGENA Y SOCIAL - MAIS,8031
Alcaldía,BOLIVAR,SANTA ROSA,GUEMIS  REVOLLEDO GAMARRA,PARTIDO SOCIAL DE UNIDAD NACIONAL PARTIDO DE LA U,8035
Alcaldía,BOLIVAR,SANTA ROSA,JULIO CESAR GAMARRA CABARCAS,PARTIDO ALIANZA VERDE,8034
Alcaldía,BOLIVAR,SANTA ROSA,MARIO JAVIER RODRIGUEZ HERNANDEZ,PARTIDO LIBERAL COLOMBIANO,8029
Alcaldía,BOLIVAR,SANTA ROSA,MARTHA ELENA SAWADES RODRIGUEZ,PARTIDO CENTRO DEMOCRATICO,8030
Alcaldía,BOLIVAR,SANTA ROSA,RAFAEL  GOMEZ CARABALLO,PARTIDO CONSERVADOR COLOMBIANO,8032
Alcaldía,BOLIVAR,SANTA ROSA,YINETTE PAOLA CABARCAS TUÑON,PARTIDO CAMBIO RADICAL,8033
