corp,dpto,mpio,name,party,wp_no
Alcaldía,CALDAS,CHINCHINA,ALVARO  GARCIA VELASQUEZ,CONVERGENCIA ALTERNATIVA,8872
Alcaldía,CALDAS,CHINCHINA,CARLOS ALBERTO RIVEROS LOPEZ,PARTIDO SOCIAL DE UNIDAD NACIONAL PARTIDO DE LA U,8870
Alcaldía,CALDAS,CHINCHINA,CARLOS ANDRES BUILES HOYOS,PARTIDO DE REIVINDICACIÓN ÉTNICA -PRE-,8867
Alcaldía,CALDAS,CHINCHINA,CARLOS ARTURO GALVEZ MEJIA,PARTIDO ADA,8866
Alcaldía,CALDAS,CHINCHINA,EDUARDO ANDRES GRISALES LOPEZ,CHINCHINA AVANZA,8871
Alcaldía,CALDAS,CHINCHINA,FABIO ANDRES PALOMINO ATEHORTUA,PARTIDO ALIANZA VERDE,8869
Alcaldía,CALDAS,CHINCHINA,SANDRA LUCIA DIAZ TEJADA,PARTIDO CONSERVADOR COLOMBIANO,8868
