corp,dpto,mpio,name,party,wp_no
Alcaldía,SANTANDER,CIMITARRA,EDERSON  NIÑO NAVARRO,COLOMBIA HUMANA - UNIÓN PATRIÓTICA,6636
Alcaldía,SANTANDER,CIMITARRA,ERIKA PATRICIA GONZALEZ ,PARTIDO COLOMBIA JUSTA LIBRES,6637
Alcaldía,SANTANDER,CIMITARRA,GERMAN DARIO SALAZAR CAMARGO,PARTIDO CONSERVADOR COLOMBIANO,6638
Alcaldía,SANTANDER,CIMITARRA,HENRY  RIAÑO CASTILLO,CREEMOS EN CIMITARRA,6643
Alcaldía,SANTANDER,CIMITARRA,JIM ALEXANDER MORENO LANDAZABAL,PARTIDO ALIANZA VERDE,6640
Alcaldía,SANTANDER,CIMITARRA,NESTOR WADITH PAEZ VEGA,PARTIDO SOCIAL DE UNIDAD NACIONAL PARTIDO DE LA U,6641
Alcaldía,SANTANDER,CIMITARRA,SAMUEL  SOTO CARREÑO,PARTIDO CAMBIO RADICAL,6639
Alcaldía,SANTANDER,CIMITARRA,WILFRAN FERNANDO SABOGAL YARCE,W.S CON PROGRESO SOCIAL,6642
