corp,dpto,mpio,name,party,wp_no
Alcaldía,TOLIMA,ARMERO (GUAYABAL),CARLOS HERNANDO RIOS WENEYDY,PARTIDO ALIANZA VERDE,6968
Alcaldía,TOLIMA,ARMERO (GUAYABAL),LUIS ERNESTO OTAVO CUENCA,MOVIMIENTO AUTORIDADES INDIGENAS DE COLOMBIA - AICO,6969
Alcaldía,TOLIMA,ARMERO (GUAYABAL),LUZMILA  ROJAS ,PARTIDO CENTRO DEMOCRATICO,6965
Alcaldía,TOLIMA,ARMERO (GUAYABAL),MAURICIO  CUELLAR ARIAS,PARTIDO COLOMBIA JUSTA LIBRES,6966
Alcaldía,TOLIMA,ARMERO (GUAYABAL),MEDARDO  ORTEGA FONSECA,COALICION PARA LA ALCALDIA DE ARMERO GUAYABAL,6970
Alcaldía,TOLIMA,ARMERO (GUAYABAL),SOFIA INES SANCHEZ QUINTANA,PARTIDO CAMBIO RADICAL,6967
