corp,dpto,mpio,name,party,wp_no
Alcaldía,META,URIBE,DAVID ANTONIO MESTIZO LABIO,PARTIDO ADA,8201
Alcaldía,META,URIBE,DEISON  CANTOR RODRIGUEZ,PARTIDO ALIANZA SOCIAL INDEPENDIENTE - ASI,8203
Alcaldía,META,URIBE,INOCENCIO  HURTADO PALOMINO,URIBE META UNIDOS MAS HUMANOS,8206
Alcaldía,META,URIBE,LUIS MIGUEL TORRES VARGAS,PARTIDO ALIANZA VERDE,8202
Alcaldía,META,URIBE,LUZ GIOVANA VELANDIA SARMIENTO,PARTIDO COLOMBIA JUSTA LIBRES,8200
Alcaldía,META,URIBE,MARCELINO  CHACON GUEVARA,UNIDOS POR LA PAZ Y LA DEFENSA DEL TERRITORIO,8204
Alcaldía,META,URIBE,ROBINSON  RIAÑO RONDON,UNIDOS CONSTRUIMOS PAZ,8205
