corp,dpto,mpio,name,party,wp_no
Alcaldía,CUNDINAMARCA,FACATATIVA,ALBA ROCIO GARCIA GOMEZ,MOVIMIENTO AUTORIDADES INDIGENAS DE COLOMBIA - AICO,5326
Alcaldía,CUNDINAMARCA,FACATATIVA,DIEGO HERNAN GARZON PLAZAS,COALICIÓN DIEGO GARZON ALCALDE,5329
Alcaldía,CUNDINAMARCA,FACATATIVA,FRANCISCO ALVARO FAJARDO PINILLA,PARTIDO CENTRO DEMOCRATICO,5322
Alcaldía,CUNDINAMARCA,FACATATIVA,GUILLERMO  NAVARRETE HERNANDEZ,PARTIDO COLOMBIA JUSTA LIBRES,5323
Alcaldía,CUNDINAMARCA,FACATATIVA,GUILLERMO EDUARDO ALDANA DIMAS,PARTIDO POLO DEMOCRATICO ALTERNATIVO,5328
Alcaldía,CUNDINAMARCA,FACATATIVA,HENRY LUIS MIGUEL PEREZ SUAREZ,PARTIDO ALIANZA SOCIAL INDEPENDIENTE - ASI,5327
Alcaldía,CUNDINAMARCA,FACATATIVA,LUIS FERNANDO MORALES CASALLAS,PARTIDO DE REIVINDICACIÓN ÉTNICA -PRE-,5325
Alcaldía,CUNDINAMARCA,FACATATIVA,MARTHA HAYDEE CARRILLO SIERRA,PARTIDO CONSERVADOR COLOMBIANO - CR,5330
Alcaldía,CUNDINAMARCA,FACATATIVA,PABLO EVARISTO BERNAL MURILLO,PARTIDO ADA,5324
