corp,dpto,mpio,name,party,wp_no
Alcaldía,BOLIVAR,SAN ESTANISLAO,BORIS DE JESUS LLAMAS FERNANDEZ,PARTIDO DE REIVINDICACIÓN ÉTNICA -PRE-,7988
Alcaldía,BOLIVAR,SAN ESTANISLAO,JAIME DAVID ROA AMADOR,PARTIDO CAMBIO RADICAL,7989
Alcaldía,BOLIVAR,SAN ESTANISLAO,JHONY ALBERTO AMAYA MARTINEZ,PARTIDO COLOMBIA RENACIENTE,7987
Alcaldía,BOLIVAR,SAN ESTANISLAO,JOSE LUIS VARGAS CASTRO,MOVIMIENTO ALTERNATIVO INDIGENA Y SOCIAL - MAIS,7986
Alcaldía,BOLIVAR,SAN ESTANISLAO,RAFAEL DE JESUS VALLE RAMOS,PARTIDO LIBERAL COLOMBIANO,7985
