corp,dpto,mpio,name,party,wp_no
Alcaldía,ANTIOQUIA,SAN PEDRO,CLAUDIA MABEL VELASQUEZ ZAPATA,MOVIMIENTO AUTORIDADES INDIGENAS DE COLOMBIA - AICO,4085
Alcaldía,ANTIOQUIA,SAN PEDRO,GUSTAVO LEON ZAPATA BARRIENTOS,JUNTOS CONSTRUIMOS EL CAMBIO,4087
Alcaldía,ANTIOQUIA,SAN PEDRO,JADER ORLANDO GONZALEZ AGUDELO,PARTIDO CENTRO DEMOCRATICO,4082
Alcaldía,ANTIOQUIA,SAN PEDRO,JOSE DANILO ALVAREZ RODRIGUEZ,PARTIDO CONSERVADOR COLOMBIANO,4084
Alcaldía,ANTIOQUIA,SAN PEDRO,VICTORIA EUGENIA VELASQUEZ ZAPATA,PARTIDO SOCIAL DE UNIDAD NACIONAL PARTIDO DE LA U,4086
Alcaldía,ANTIOQUIA,SAN PEDRO,YOVANNY  VASQUEZ RUIZ,PARTIDO DE REIVINDICACIÓN ÉTNICA -PRE-,4083
