corp,dpto,mpio,name,party,wp_no
Alcaldía,PUTUMAYO,MOCOA,BALGER MAURICIO RODRIGUEZ RODRIGUEZ,PARTIDO LIBERAL COLOMBIANO,8250
Alcaldía,PUTUMAYO,MOCOA,ELVER PORFIDIO CERON CHICUNQUE,PARTIDO SOCIAL DE UNIDAD NACIONAL PARTIDO DE LA U,8255
Alcaldía,PUTUMAYO,MOCOA,HERNANDO  QUINTANA ARAYON,PARTIDO ADA,8253
Alcaldía,PUTUMAYO,MOCOA,JAIRO WILLIAM BRAVO CHAMORRO,COLOMBIA HUMANA - UNIÓN PATRIÓTICA,8251
Alcaldía,PUTUMAYO,MOCOA,JHON JAIRO IMBACHI LOPEZ,AHORA SI -LA RECONSTRUCCION ES CON EL PUEBLO-,8256
Alcaldía,PUTUMAYO,MOCOA,ONOFRE ANTONIO VASQUEZ GUZMAN,MOVIMIENTO ALTERNATIVO INDIGENA Y SOCIAL - MAIS,8252
Alcaldía,PUTUMAYO,MOCOA,ORLANDO  DIAZ FERREIRA,PARTIDO CONSERVADOR COLOMBIANO,8254
