corp,dpto,mpio,name,party,wp_no
Alcaldía,NARIÑO,MALLAMA (PIEDRANCHA),EDWIN MARCIAL ROSERO CASANOVA,COLOMBIA HUMANA - UNIÓN PATRIÓTICA,6060
Alcaldía,NARIÑO,MALLAMA (PIEDRANCHA),FRANCISCO GIOVANNI MELO REVELO,MOVIMIENTO AUTORIDADES INDIGENAS DE COLOMBIA - AICO,6062
Alcaldía,NARIÑO,MALLAMA (PIEDRANCHA),OSCAR YOVANNI BASTIDAS ESTRADA,UNIDOS POR EL PROGRESO DE MALLAMA,6064
Alcaldía,NARIÑO,MALLAMA (PIEDRANCHA),SHIRLEY ARACELLY BRAVO REY,PARTIDO COLOMBIA RENACIENTE,6061
Alcaldía,NARIÑO,MALLAMA (PIEDRANCHA),WILLIAM ROBERT ALVAREZ RUIZ,PARTIDO POLO DEMOCRATICO ALTERNATIVO,6063
