corp,dpto,mpio,name,party,wp_no
Alcaldía,ANTIOQUIA,JERICO,CARLOS ALBERTO PALACIO MONSALVE,COMPROMISO DE TODOS,3912
Alcaldía,ANTIOQUIA,JERICO,DAVID ALONSO TORO CADAVID,PARTIDO LIBERAL COLOMBIANO,3909
Alcaldía,ANTIOQUIA,JERICO,IVAN DARIO GOMEZ ZAPATA,PARTIDO SOCIAL DE UNIDAD NACIONAL PARTIDO DE LA U,3911
Alcaldía,ANTIOQUIA,JERICO,LIBIA STELLA OSORIO PELAEZ,PARTIDO CENTRO DEMOCRATICO,3910
Alcaldía,ANTIOQUIA,JERICO,NELSON AUGUSTO RESTREPO RESTREPO,ACUERDO CIUDADANO -UNIDOS POR JERICO-,3913
Alcaldía,ANTIOQUIA,JERICO,WILTON ALBERTO CHAVERRA RIOS,PARTIDO CONSERVADOR COLOMBIANO - ASI - CR - MAIS,3914
