corp,dpto,mpio,name,party,wp_no
Alcaldía,TOLIMA,ESPINAL,CARLOS ALBERTO BARRERO PRADA,PARTIDO CONSERVADOR COLOMBIANO,7020
Alcaldía,TOLIMA,ESPINAL,FABIO HERNAN BEDOYA RUBIO,PARTIDO ALIANZA SOCIAL INDEPENDIENTE - ASI,7023
Alcaldía,TOLIMA,ESPINAL,GERMAN  RODRIGUEZ GONGORA,PARTIDO COLOMBIA RENACIENTE,7019
Alcaldía,TOLIMA,ESPINAL,HELIO FABIO JIMENEZ NARVAEZ,PARTIDO ALIANZA VERDE,7022
Alcaldía,TOLIMA,ESPINAL,JHOAN FERNANDO NIÑO CALDERON,PARTIDO CAMBIO RADICAL,7021
Alcaldía,TOLIMA,ESPINAL,JUAN CARLOS TAMAYO SALAS,PARTIDO CENTRO DEMOCRATICO,7017
Alcaldía,TOLIMA,ESPINAL,RUTH  CASTRO SEGURA,CONVERGENCIA POR UNA NUEVA CIUDAD,7024
Alcaldía,TOLIMA,ESPINAL,YESID ESTEBAN DUARTE MESA,PARTIDO COLOMBIA JUSTA LIBRES,7018
