corp,dpto,mpio,name,party,wp_no
Alcaldía,BOLIVAR,VILLANUEVA,ANGEL AMIRO NOYA POLO,PARTIDO CENTRO DEMOCRATICO,7853
Alcaldía,BOLIVAR,VILLANUEVA,EDWIN  PUERTA OROZCO,PARTIDO SOCIAL DE UNIDAD NACIONAL PARTIDO DE LA U,7856
Alcaldía,BOLIVAR,VILLANUEVA,GREGORIO  CAMACHO CERA,PARTIDO CONSERVADOR COLOMBIANO,7855
Alcaldía,BOLIVAR,VILLANUEVA,IGNACIO  ANAYA TABORDA,PARTIDO POLO DEMOCRATICO ALTERNATIVO,7857
Alcaldía,BOLIVAR,VILLANUEVA,JULIO ENRIQUE SANCHEZ CERA,PARTIDO LIBERAL COLOMBIANO,7852
Alcaldía,BOLIVAR,VILLANUEVA,JUSTO  ALFARO VEGA,PARTIDO DE REIVINDICACIÓN ÉTNICA -PRE-,7854
