corp,dpto,mpio,name,party,wp_no
Alcaldía,TOLIMA,LERIDA,EINAR ALFONSO ORTIZ USECHE,PARTIDO DE REIVINDICACIÓN ÉTNICA -PRE-,7070
Alcaldía,TOLIMA,LERIDA,FERNEY MELLER CRUZ QUESADA,PARTIDO CENTRO DEMOCRATICO,7069
Alcaldía,TOLIMA,LERIDA,GERMAN  ORTIZ LERMA,PARTIDO ALIANZA SOCIAL INDEPENDIENTE - ASI,7071
Alcaldía,TOLIMA,LERIDA,JORGE  GARCIA PRADA,LERIDA AVANZA FIRME CON GARCIA,7072
Alcaldía,TOLIMA,LERIDA,LUIS CARLOS AMEZQUITA CARDENAS,PARTIDO CONSERVADOR COLOMBIANO - RE,7074
Alcaldía,TOLIMA,LERIDA,MARCO ANTONIO OSPINA VELANDIA,ENTRE TODOS RECUPERAREMOS A LERIDA,7073
