corp,dpto,mpio,name,party,wp_no
Alcaldía,VALLE,TULUA,DARIO  GOMEZ MERA,PARTIDO COLOMBIA JUSTA LIBRES,7300
Alcaldía,VALLE,TULUA,JOHN JAIRO GOMEZ AGUIRRE,PARTIDO SOCIAL DE UNIDAD NACIONAL PARTIDO DE LA U,7303
Alcaldía,VALLE,TULUA,JORGE ALBERTO CASTAÑO PARRA,PARTIDO CONSERVADOR COLOMBIANO,7301
Alcaldía,VALLE,TULUA,LUIS FERNANDO OCAMPO GIRALDO,PARTIDO CAMBIO RADICAL,7302
Alcaldía,VALLE,TULUA,MARCELINO  AYALA OCAMPO,CONVERGENCIA POR TULUA HUMANA,7304
Alcaldía,VALLE,TULUA,MARCO ALEJANDRO ARBELAEZ VARGAS,UNIDOS TRABAJANDO POR TULUA,7305
