corp,dpto,mpio,name,party,wp_no
Alcaldía,CASANARE,NUNCHIA,GILBERTO  NAVARRO PONGUTA,PARTIDO ALIANZA VERDE,7674
Alcaldía,CASANARE,NUNCHIA,JABIER  ROA ALARCON,PARTIDO SOCIAL DE UNIDAD NACIONAL PARTIDO DE LA U,7676
Alcaldía,CASANARE,NUNCHIA,JAIVER LEANDRO PEREZ ALFONSO,PARTIDO COLOMBIA JUSTA LIBRES,7672
Alcaldía,CASANARE,NUNCHIA,JULIA ELVIRA DIAZ CHINCHILLA,NUNCHIA SOCIAL Y EMPRENDEDORA,7677
Alcaldía,CASANARE,NUNCHIA,LUIS FERNANDO CABRERA OTALORA,PARTIDO COLOMBIA RENACIENTE,7673
Alcaldía,CASANARE,NUNCHIA,MARIBEL  CELY NEME,PARTIDO CENTRO DEMOCRATICO,7671
Alcaldía,CASANARE,NUNCHIA,NORBERTO  MARTINEZ ,MOVIMIENTO AUTORIDADES INDIGENAS DE COLOMBIA - AICO,7675
Alcaldía,CASANARE,NUNCHIA,ROSEMBERTH  ALBARRACIN RIVERA,PARTIDO LIBERAL COLOMBIANO,7670
