corp,dpto,mpio,name,party,wp_no
Alcaldía,TOLIMA,NATAGAIMA,ASTRID  PAVA YARA,PARTIDO CENTRO DEMOCRATICO,7098
Alcaldía,TOLIMA,NATAGAIMA,DAVID MAURICIO ANDRADE RAMIREZ,LO HICIMOS BIEN... POR AMOR A NATAGAIMA LO HAREMOS MEJOR,7106
Alcaldía,TOLIMA,NATAGAIMA,DUVIER  GARCIA LIS,PARTIDO COLOMBIA JUSTA LIBRES,7100
Alcaldía,TOLIMA,NATAGAIMA,EDGAR MAURICIO ZAMBRANO NIETO,MOVIMIENTO AUTORIDADES INDIGENAS DE COLOMBIA - AICO,7102
Alcaldía,TOLIMA,NATAGAIMA,EDWIN  TRUJILLO SOGAMOSO,PRIMERO NATAGAIMA,7105
Alcaldía,TOLIMA,NATAGAIMA,FLOR MARINA SOTO ,PARTIDO DE REIVINDICACIÓN ÉTNICA -PRE-,7101
Alcaldía,TOLIMA,NATAGAIMA,LAURA PATRICIA AYERBE CORTES,PARTIDO CONSERVADOR COLOMBIANO -  PU,7104
Alcaldía,TOLIMA,NATAGAIMA,SERGIO JOSE ORTIZ JAVELA,PARTIDO ALIANZA SOCIAL INDEPENDIENTE - ASI,7103
Alcaldía,TOLIMA,NATAGAIMA,VIRGILIO  ROJAS GULUMA,MOVIMIENTO ALTERNATIVO INDIGENA Y SOCIAL - MAIS,7099
