corp,dpto,mpio,name,party,wp_no
Alcaldía,SUCRE,PALMITO,DEIVIS ALBERTO LEDEZMA PACHECO,PARTIDO CONSERVADOR COLOMBIANO - PL,6756
Alcaldía,SUCRE,PALMITO,FABER FERNANDO ESTRADA MARTINEZ,PARTIDO COLOMBIA RENACIENTE,6754
Alcaldía,SUCRE,PALMITO,JORGE LUIS MARTINEZ HERNANDEZ,MOVIMIENTO ALTERNATIVO INDIGENA Y SOCIAL - MAIS,6752
Alcaldía,SUCRE,PALMITO,LIDA EUGENIA MONTERROZA BALETA,PARTIDO ADA,6755
Alcaldía,SUCRE,PALMITO,LUIS FELIPE QUINTANA PEREZ,COLOMBIA HUMANA - UNIÓN PATRIÓTICA,6751
Alcaldía,SUCRE,PALMITO,OSCAR ENRIQUE GOMEZ ESCUDERO,PARTIDO COLOMBIA JUSTA LIBRES,6753
