corp,dpto,mpio,name,party,wp_no
Concejo,NARIÑO,ALBAN (SAN JOSE),ADRIANA MARCELA VILLADA CORDOBA,PARTIDO ALIANZA VERDE,51374
Concejo,NARIÑO,ALBAN (SAN JOSE),ALVARO  CERON BOLAÑOS,PARTIDO ALIANZA VERDE,51376
Concejo,NARIÑO,ALBAN (SAN JOSE),ANDRES SEBASTIAN URBANO ORDOÑEZ,PARTIDO SOCIAL DE UNIDAD NACIONAL PARTIDO DE LA U,51378
Concejo,NARIÑO,ALBAN (SAN JOSE),ARNOLD  PASAJE MORILLO,PARTIDO CONSERVADOR COLOMBIANO,51349
Concejo,NARIÑO,ALBAN (SAN JOSE),BAYRON DARIO DIAZ BRAVO,PARTIDO ALIANZA VERDE,51373
Concejo,NARIÑO,ALBAN (SAN JOSE),CARLOS ANTONIO CORDOBA ORTIZ,PARTIDO DE REIVINDICACIÓN ÉTNICA -PRE-,51343
Concejo,NARIÑO,ALBAN (SAN JOSE),CARLOS JAVIER PALACIOS IRUA,PARTIDO CONSERVADOR COLOMBIANO,51356
Concejo,NARIÑO,ALBAN (SAN JOSE),CELY YAMILEX CABRERA GUTIERREZ,PARTIDO CAMBIO RADICAL,51362
Concejo,NARIÑO,ALBAN (SAN JOSE),CIELO JANETH MONCAYO ALVARADO,PARTIDO CONSERVADOR COLOMBIANO,51353
Concejo,NARIÑO,ALBAN (SAN JOSE),CRISTIAN DAVID LEDEZMA CARLOSAMA,PARTIDO CAMBIO RADICAL,51361
Concejo,NARIÑO,ALBAN (SAN JOSE),DAVID ERNESTO ARCOS ORTIZ,PARTIDO CAMBIO RADICAL,51363
Concejo,NARIÑO,ALBAN (SAN JOSE),DEIBY JHONATAN ORDOÑEZ GUERRERO,PARTIDO LIBERAL COLOMBIANO,51316
Concejo,NARIÑO,ALBAN (SAN JOSE),DIANA CAROLINA MORENO BOLAÑOS,PARTIDO DE REIVINDICACIÓN ÉTNICA -PRE-,51347
Concejo,NARIÑO,ALBAN (SAN JOSE),DILOLBER JESUS CORDOBA GOMEZ,PARTIDO COLOMBIA RENACIENTE,51340
Concejo,NARIÑO,ALBAN (SAN JOSE),DORA LILIA DIAZ ,PARTIDO CONSERVADOR COLOMBIANO,51358
Concejo,NARIÑO,ALBAN (SAN JOSE),EDY ISABEL MONCAYO LOPEZ,PARTIDO CONSERVADOR COLOMBIANO,51354
Concejo,NARIÑO,ALBAN (SAN JOSE),ELIECER MONAR ORTIZ HERNANDEZ,PARTIDO CAMBIO RADICAL,51367
Concejo,NARIÑO,ALBAN (SAN JOSE),ELKIN RUBEN HERNANDEZ ORDOÑEZ,PARTIDO SOCIAL DE UNIDAD NACIONAL PARTIDO DE LA U,51380
Concejo,NARIÑO,ALBAN (SAN JOSE),ESMERALDA DEL ROSARIO MONCAYO RIVERA,PARTIDO LIBERAL COLOMBIANO,51318
Concejo,NARIÑO,ALBAN (SAN JOSE),ESPERANZA  BOLAÑOS ERASO,PARTIDO ALIANZA VERDE,51377
Concejo,NARIÑO,ALBAN (SAN JOSE),EVER ANDRES ENRIQUEZ SALCEDO,PARTIDO DE REIVINDICACIÓN ÉTNICA -PRE-,51345
Concejo,NARIÑO,ALBAN (SAN JOSE),FRANCO JORGE OJEDA GOMEZ,PARTIDO CENTRO DEMOCRATICO,51325
Concejo,NARIÑO,ALBAN (SAN JOSE),FREDI FERNANDO CASTILLO BOTINA,PARTIDO COLOMBIA RENACIENTE,51334
Concejo,NARIÑO,ALBAN (SAN JOSE),FREDY ANDRES MARTINEZ CORDOBA,PARTIDO SOCIAL DE UNIDAD NACIONAL PARTIDO DE LA U,51387
Concejo,NARIÑO,ALBAN (SAN JOSE),GERMAN RICARDO CABRERA CASTILLO,PARTIDO CAMBIO RADICAL,51359
Concejo,NARIÑO,ALBAN (SAN JOSE),GIRALDO  PORTILLA TORO,PARTIDO COLOMBIA RENACIENTE,51332
Concejo,NARIÑO,ALBAN (SAN JOSE),HENRY MARINO DELGADO ,PARTIDO SOCIAL DE UNIDAD NACIONAL PARTIDO DE LA U,51383
Concejo,NARIÑO,ALBAN (SAN JOSE),JAIRO GUILLERMO ERASO ORDOÑEZ,PARTIDO SOCIAL DE UNIDAD NACIONAL PARTIDO DE LA U,51384
Concejo,NARIÑO,ALBAN (SAN JOSE),JESUS ANTONIO MARTINEZ MESIAS,PARTIDO CENTRO DEMOCRATICO,51326
Concejo,NARIÑO,ALBAN (SAN JOSE),JESUS HERNAN ARGOTY ,PARTIDO ALIANZA VERDE,51368
Concejo,NARIÑO,ALBAN (SAN JOSE),JESUS MARIANO ORDOÑEZ HERNANDEZ,PARTIDO LIBERAL COLOMBIANO,51313
Concejo,NARIÑO,ALBAN (SAN JOSE),JORGE LUIS CABRERA LOPEZ,PARTIDO LIBERAL COLOMBIANO,51317
Concejo,NARIÑO,ALBAN (SAN JOSE),JORGE URIBE BOLAÑOS ARCOS,PARTIDO ALIANZA VERDE,51370
Concejo,NARIÑO,ALBAN (SAN JOSE),JOSE FRANCO GRANDA ERASO,PARTIDO CONSERVADOR COLOMBIANO,51348
Concejo,NARIÑO,ALBAN (SAN JOSE),JOSE LIBARDO VIVEROS PORTILLA,PARTIDO SOCIAL DE UNIDAD NACIONAL PARTIDO DE LA U,51385
Concejo,NARIÑO,ALBAN (SAN JOSE),JOSE PRUDENCIO BOLAÑOS ORDOÑEZ,PARTIDO COLOMBIA RENACIENTE,51335
Concejo,NARIÑO,ALBAN (SAN JOSE),JOSE RUTILIO GUERRERO DIAZ,PARTIDO COLOMBIA RENACIENTE,51333
Concejo,NARIÑO,ALBAN (SAN JOSE),JUDITH SUSANA FONSECA ARCOS,PARTIDO COLOMBIA RENACIENTE,51336
Concejo,NARIÑO,ALBAN (SAN JOSE),LENY PATRICIA MUÑOZ GELPUD,PARTIDO LIBERAL COLOMBIANO,51320
Concejo,NARIÑO,ALBAN (SAN JOSE),LEONARDO  MORALES URBANO,PARTIDO LIBERAL COLOMBIANO,51312
Concejo,NARIÑO,ALBAN (SAN JOSE),LEYDY MARCELA MUÑOZ URBANO,PARTIDO CENTRO DEMOCRATICO,51331
Concejo,NARIÑO,ALBAN (SAN JOSE),LISBETH VANESSA ESPINOSA VIVEROS,PARTIDO CAMBIO RADICAL,51364
Concejo,NARIÑO,ALBAN (SAN JOSE),LUCIA DEL CARMEN BOLAÑOS ERAZO,PARTIDO LIBERAL COLOMBIANO,51321
Concejo,NARIÑO,ALBAN (SAN JOSE),LUIS ALIRIO BOLAÑOS NAVIA,PARTIDO CENTRO DEMOCRATICO,51329
Concejo,NARIÑO,ALBAN (SAN JOSE),LUIS ANTONIO ALBAN ARGOTE,PARTIDO LIBERAL COLOMBIANO,51315
Concejo,NARIÑO,ALBAN (SAN JOSE),LUIS ARTEMIO TORRES ,PARTIDO ALIANZA VERDE,51369
Concejo,NARIÑO,ALBAN (SAN JOSE),LUIS GERARDO MONCAYO ORTIZ,PARTIDO CENTRO DEMOCRATICO,51328
Concejo,NARIÑO,ALBAN (SAN JOSE),MANUEL ANTONIO GUERRERO ERASO,PARTIDO CENTRO DEMOCRATICO,51324
Concejo,NARIÑO,ALBAN (SAN JOSE),MANUEL JESUS NARVAEZ MONCAYO,PARTIDO DE REIVINDICACIÓN ÉTNICA -PRE-,51342
Concejo,NARIÑO,ALBAN (SAN JOSE),MARIA GILMA SALCEDO ,PARTIDO DE REIVINDICACIÓN ÉTNICA -PRE-,51344
Concejo,NARIÑO,ALBAN (SAN JOSE),MARIO DAVID ORTIZ CAIZA,PARTIDO LIBERAL COLOMBIANO,51319
Concejo,NARIÑO,ALBAN (SAN JOSE),MARTHA LUCIA CERON DELGADO,PARTIDO SOCIAL DE UNIDAD NACIONAL PARTIDO DE LA U,51379
Concejo,NARIÑO,ALBAN (SAN JOSE),MAURILIO  GOMEZ ORTIZ,PARTIDO CENTRO DEMOCRATICO,51330
Concejo,NARIÑO,ALBAN (SAN JOSE),MAURO  ORDOÑEZ ALVEAR,PARTIDO CONSERVADOR COLOMBIANO,51351
Concejo,NARIÑO,ALBAN (SAN JOSE),MEDARDO  MORALES CHAVES,PARTIDO CONSERVADOR COLOMBIANO,51355
Concejo,NARIÑO,ALBAN (SAN JOSE),MELVA IDALIA BELALCAZAR BRAVO,PARTIDO CENTRO DEMOCRATICO,51322
Concejo,NARIÑO,ALBAN (SAN JOSE),MIGUEL ANGEL ALVARADO ,PARTIDO CENTRO DEMOCRATICO,51327
Concejo,NARIÑO,ALBAN (SAN JOSE),MILTON EVAR ORDOÑEZ BOTINA,PARTIDO SOCIAL DE UNIDAD NACIONAL PARTIDO DE LA U,51386
Concejo,NARIÑO,ALBAN (SAN JOSE),OSCAR ALBERTO CHAVEZ CHAVEZ,PARTIDO CAMBIO RADICAL,51366
Concejo,NARIÑO,ALBAN (SAN JOSE),OSCAR ILDEFONSO DIAZ DEL CASTILLO BENAVIDES,PARTIDO COLOMBIA RENACIENTE,51338
Concejo,NARIÑO,ALBAN (SAN JOSE),OSCAR MARINO GUTIERREZ CERON,PARTIDO COLOMBIA RENACIENTE,51341
Concejo,NARIÑO,ALBAN (SAN JOSE),PABLO URIBE TORRES ERASO,PARTIDO ALIANZA VERDE,51371
Concejo,NARIÑO,ALBAN (SAN JOSE),ROSA MARIA FATIMA DIAZ CORDOBA,PARTIDO COLOMBIA RENACIENTE,51339
Concejo,NARIÑO,ALBAN (SAN JOSE),SANDRA MILENA PALACIOS GUERRERO,PARTIDO CAMBIO RADICAL,51360
Concejo,NARIÑO,ALBAN (SAN JOSE),SEGUNDO JOSE IGNACIO ORDOÑEZ BURBANO,PARTIDO CONSERVADOR COLOMBIANO,51350
Concejo,NARIÑO,ALBAN (SAN JOSE),SINDY CAROLINA TULCAN DIAZ,PARTIDO SOCIAL DE UNIDAD NACIONAL PARTIDO DE LA U,51382
Concejo,NARIÑO,ALBAN (SAN JOSE),SULITH MARCELA GOMEZ RENDON,PARTIDO COLOMBIA RENACIENTE,51337
Concejo,NARIÑO,ALBAN (SAN JOSE),VICTOR OSWALDO GOMEZ SALCEDO,PARTIDO CONSERVADOR COLOMBIANO,51357
Concejo,NARIÑO,ALBAN (SAN JOSE),WOBEIMAR DARIO ORDOÑEZ PAYAN,PARTIDO ALIANZA VERDE,51375
Concejo,NARIÑO,ALBAN (SAN JOSE),YEIMY KAROLINA ACOSTA MOLINA,PARTIDO CAMBIO RADICAL,51365
Concejo,NARIÑO,ALBAN (SAN JOSE),YENIFER MARCELA ORDOÑEZ JIMENEZ,PARTIDO SOCIAL DE UNIDAD NACIONAL PARTIDO DE LA U,51381
Concejo,NARIÑO,ALBAN (SAN JOSE),YENY FERNANDA ALVARADO MORALES,PARTIDO LIBERAL COLOMBIANO,51314
Concejo,NARIÑO,ALBAN (SAN JOSE),YOHANA MARISOL ENRIQUEZ SALCEDO,PARTIDO ALIANZA VERDE,51372
Concejo,NARIÑO,ALBAN (SAN JOSE),YUDY ALEXANDRA ROSERO TORO,PARTIDO CONSERVADOR COLOMBIANO,51352
Concejo,NARIÑO,ALBAN (SAN JOSE),YULY DORIS ORDONEZ TULCAN,PARTIDO CENTRO DEMOCRATICO,51323
