corp,dpto,mpio,name,party,wp_no
Concejo,NARIÑO,MAGUI (PAYAN),ALBA MAYI ORDOÑEZ PALACIOS,PARTIDO LIBERAL COLOMBIANO,52671
Concejo,NARIÑO,MAGUI (PAYAN),ALBA ODDULIA TENORIO QUIÑONES,PARTIDO LIBERAL COLOMBIANO,52675
Concejo,NARIÑO,MAGUI (PAYAN),ALICIA CRUZ ANTONIA ANGULO TENORIO,PARTIDO CONSERVADOR COLOMBIANO,52684
Concejo,NARIÑO,MAGUI (PAYAN),ANA MILENA LARAS QUIÑONES,PARTIDO CONSERVADOR COLOMBIANO,52679
Concejo,NARIÑO,MAGUI (PAYAN),ANA YANSI QUIÑONES ,PARTIDO ALIANZA SOCIAL INDEPENDIENTE - ASI,52714
Concejo,NARIÑO,MAGUI (PAYAN),ANDRES WILFRIDO MARINEZ ,PARTIDO LIBERAL COLOMBIANO,52677
Concejo,NARIÑO,MAGUI (PAYAN),AURA ELISA QUIÑONES QUIÑONES,PARTIDO LIBERAL COLOMBIANO,52672
Concejo,NARIÑO,MAGUI (PAYAN),BERTHA SORAIDA CAICEDO TENORIO,PARTIDO CONSERVADOR COLOMBIANO,52685
Concejo,NARIÑO,MAGUI (PAYAN),CARMELO ESTEBAN VARGAS FABRA,PARTIDO POLO DEMOCRATICO ALTERNATIVO,52724
Concejo,NARIÑO,MAGUI (PAYAN),CECILIA TEODORA TENORIO QUIÑONES,PARTIDO POLO DEMOCRATICO ALTERNATIVO,52725
Concejo,NARIÑO,MAGUI (PAYAN),CLAUDIA PATRICIA TIRADO CARREÑO,PARTIDO ALIANZA VERDE,52696
Concejo,NARIÑO,MAGUI (PAYAN),CLAUDIA ROCIO LEON VALENCIA,PARTIDO POLO DEMOCRATICO ALTERNATIVO,52720
Concejo,NARIÑO,MAGUI (PAYAN),CORINA QUITERIA QUIÑONES BATALLA,PARTIDO ALIANZA VERDE,52703
Concejo,NARIÑO,MAGUI (PAYAN),CRISTIAN ALADINO ORDOÑEZ ANGULO,PARTIDO ALIANZA SOCIAL INDEPENDIENTE - ASI,52712
Concejo,NARIÑO,MAGUI (PAYAN),DAMACENO  GODOY ,PARTIDO CAMBIO RADICAL,52691
Concejo,NARIÑO,MAGUI (PAYAN),DIANA CAROLINA TENORIO QUIÑONES,PARTIDO CAMBIO RADICAL,52692
Concejo,NARIÑO,MAGUI (PAYAN),DIANA FABIOLA ANGULO CABEZAS,PARTIDO ALIANZA SOCIAL INDEPENDIENTE - ASI,52705
Concejo,NARIÑO,MAGUI (PAYAN),DIEGO ARMANDO MEJIA HURTADO,PARTIDO LIBERAL COLOMBIANO,52669
Concejo,NARIÑO,MAGUI (PAYAN),EDGAR LEONIDAS PRADO QUIÑONES,PARTIDO LIBERAL COLOMBIANO,52670
Concejo,NARIÑO,MAGUI (PAYAN),EDGAR PARMENIDES QUIÑONES QUIÑONES,PARTIDO LIBERAL COLOMBIANO,52676
Concejo,NARIÑO,MAGUI (PAYAN),EDILIO FEDERICO MARQUINEZ ANGULO,PARTIDO CONSERVADOR COLOMBIANO,52682
Concejo,NARIÑO,MAGUI (PAYAN),EDINSON ARISTIDES CAICEDO CARVAJAL,PARTIDO LIBERAL COLOMBIANO,52674
Concejo,NARIÑO,MAGUI (PAYAN),EDWIN DAVID QUIÑONES MARINEZ,PARTIDO LIBERAL COLOMBIANO,52673
Concejo,NARIÑO,MAGUI (PAYAN),ERNE DAVID QUIÑONES ITURRE,PARTIDO ALIANZA VERDE,52701
Concejo,NARIÑO,MAGUI (PAYAN),ERNESTO  ANGULO FAJARDO,PARTIDO POLO DEMOCRATICO ALTERNATIVO,52716
Concejo,NARIÑO,MAGUI (PAYAN),FELIX EVANGELISTA MESIAS TENORIO,PARTIDO CONSERVADOR COLOMBIANO,52681
Concejo,NARIÑO,MAGUI (PAYAN),FLORIS MENARCO HURTADO ORDOÑEZ,PARTIDO ALIANZA VERDE,52697
Concejo,NARIÑO,MAGUI (PAYAN),FRANCISCO ALEJANDRO CASTRO ANGULO,PARTIDO POLO DEMOCRATICO ALTERNATIVO,52718
Concejo,NARIÑO,MAGUI (PAYAN),FREDI FROILAN QUIÑONES QUIÑONES,PARTIDO CAMBIO RADICAL,52690
Concejo,NARIÑO,MAGUI (PAYAN),FREDIS EDINSON QUIÑONES CABEZAS,PARTIDO ALIANZA VERDE,52702
Concejo,NARIÑO,MAGUI (PAYAN),FREDY HERNANDO QUIÑONES QUIÑONES,PARTIDO ALIANZA SOCIAL INDEPENDIENTE - ASI,52710
Concejo,NARIÑO,MAGUI (PAYAN),GUMERSINDO BARTOLO MARINEZ LOPEZ,PARTIDO ALIANZA SOCIAL INDEPENDIENTE - ASI,52709
Concejo,NARIÑO,MAGUI (PAYAN),HENRY BOANERGES ANGULO QUIÑONES,PARTIDO COLOMBIA JUSTA LIBRES,52678
Concejo,NARIÑO,MAGUI (PAYAN),HERMINIA LEONOR VIVEROS ANGULO,PARTIDO ALIANZA VERDE,52695
Concejo,NARIÑO,MAGUI (PAYAN),HERSON ORBEY MARQUEZ QUIÑONES,PARTIDO POLO DEMOCRATICO ALTERNATIVO,52723
Concejo,NARIÑO,MAGUI (PAYAN),JENNIFER  SINISTERRA ARIZALA,PARTIDO CONSERVADOR COLOMBIANO,52680
Concejo,NARIÑO,MAGUI (PAYAN),JUAN GUILLERMO MORALES TORRES,PARTIDO ALIANZA VERDE,52704
Concejo,NARIÑO,MAGUI (PAYAN),JUAN JAIRO RAMOS ARIZALA,PARTIDO CONSERVADOR COLOMBIANO,52686
Concejo,NARIÑO,MAGUI (PAYAN),JULIO LEONAR VALVERDE ,PARTIDO CAMBIO RADICAL,52693
Concejo,NARIÑO,MAGUI (PAYAN),JUSTA MARIA HURTADO QUIÑONES,PARTIDO ALIANZA SOCIAL INDEPENDIENTE - ASI,52711
Concejo,NARIÑO,MAGUI (PAYAN),LEDY ALBERTO TORRES ANGULO,PARTIDO POLO DEMOCRATICO ALTERNATIVO,52722
Concejo,NARIÑO,MAGUI (PAYAN),LEONARDO ABRAHAM QUIÑONES ANGULO,PARTIDO CONSERVADOR COLOMBIANO,52688
Concejo,NARIÑO,MAGUI (PAYAN),LUCIO  ARBOLEDA MONTANO,PARTIDO ALIANZA SOCIAL INDEPENDIENTE - ASI,52713
Concejo,NARIÑO,MAGUI (PAYAN),MARIA GRACIELA QUIÑONES SEVILLANO,PARTIDO CAMBIO RADICAL,52694
Concejo,NARIÑO,MAGUI (PAYAN),MARIA SALOME ESTUPINAN ANGULO,PARTIDO ALIANZA VERDE,52698
Concejo,NARIÑO,MAGUI (PAYAN),MARIELA YICET HURTADO DAJOMES,PARTIDO POLO DEMOCRATICO ALTERNATIVO,52717
Concejo,NARIÑO,MAGUI (PAYAN),MARIO EVARISTO TEJADA SINISTERRA,PARTIDO POLO DEMOCRATICO ALTERNATIVO,52715
Concejo,NARIÑO,MAGUI (PAYAN),NILO ALIPIO QUIÑONES MARQUINEZ,PARTIDO ALIANZA VERDE,52700
Concejo,NARIÑO,MAGUI (PAYAN),OTTO RAMIRO QUIÑONES MARINEZ,PARTIDO CAMBIO RADICAL,52689
Concejo,NARIÑO,MAGUI (PAYAN),PEDRO AZAEL TENORIO QUIÑONES,PARTIDO ALIANZA SOCIAL INDEPENDIENTE - ASI,52706
Concejo,NARIÑO,MAGUI (PAYAN),RODRIGO ERMINSON ANGULO TENORIO,PARTIDO ALIANZA SOCIAL INDEPENDIENTE - ASI,52707
Concejo,NARIÑO,MAGUI (PAYAN),SANDRA YAQUELINE MONTENEGRO MARQUINEZ,PARTIDO POLO DEMOCRATICO ALTERNATIVO,52721
Concejo,NARIÑO,MAGUI (PAYAN),SANTIAGO MISAEL SEVILLANO TENORIO,PARTIDO CONSERVADOR COLOMBIANO,52683
Concejo,NARIÑO,MAGUI (PAYAN),SANTOS DOMINGO ANGULO TENORIO,PARTIDO CONSERVADOR COLOMBIANO,52687
Concejo,NARIÑO,MAGUI (PAYAN),TERENCIO DAGOBERTO QUIÑONES QUIÑONES,PARTIDO POLO DEMOCRATICO ALTERNATIVO,52719
Concejo,NARIÑO,MAGUI (PAYAN),VICTOR MANUEL CORDOBA HURTADO,PARTIDO ALIANZA VERDE,52699
Concejo,NARIÑO,MAGUI (PAYAN),WASINTON MARINO ANGULO QUIÑONES,PARTIDO ALIANZA SOCIAL INDEPENDIENTE - ASI,52708
