corp,dpto,mpio,name,party,wp_no
Concejo,CUNDINAMARCA,LA VEGA,ALBA LILIANA RODRIGUEZ MORENO,PARTIDO LIBERAL COLOMBIANO,31944
Concejo,CUNDINAMARCA,LA VEGA,ALEXANDRA  PEREZ BOHORQUEZ,PARTIDO POLITICO MIRA Y PARTIDO CONSERVADOR COLOMBIANO,32037
Concejo,CUNDINAMARCA,LA VEGA,ALEXIS  NEIVA SANCHEZ,PARTIDO SOCIAL DE UNIDAD NACIONAL PARTIDO DE LA U,32018
Concejo,CUNDINAMARCA,LA VEGA,ALICIA  ACOSTA JIMENEZ,PARTIDO COLOMBIA RENACIENTE,31965
Concejo,CUNDINAMARCA,LA VEGA,ALVARO  TORRES BRAVO,PARTIDO POLITICO MIRA Y PARTIDO CONSERVADOR COLOMBIANO,32038
Concejo,CUNDINAMARCA,LA VEGA,ANA ELIZABETH VEGA HERNANDEZ,PARTIDO ALIANZA VERDE,32001
Concejo,CUNDINAMARCA,LA VEGA,ANDRES FELIPE HERNANDEZ ORDOÑEZ,PARTIDO CAMBIO RADICAL,31986
Concejo,CUNDINAMARCA,LA VEGA,BLANCA LUZ GONZALEZ ,PARTIDO POLITICO MIRA Y PARTIDO CONSERVADOR COLOMBIANO,32033
Concejo,CUNDINAMARCA,LA VEGA,CAMILO ANDRES COLMENARES LOPEZ,PARTIDO ALIANZA VERDE,31998
Concejo,CUNDINAMARCA,LA VEGA,CAMILO ANDRES DELGADO JIMENEZ,PARTIDO POLITICO MIRA Y PARTIDO CONSERVADOR COLOMBIANO,32032
Concejo,CUNDINAMARCA,LA VEGA,CARLOS FERNEY OLARTE RAMIREZ,PARTIDO COLOMBIA JUSTA LIBRES,31962
Concejo,CUNDINAMARCA,LA VEGA,CARLOS JULIO CAMARGO CALVO,PARTIDO ALIANZA SOCIAL INDEPENDIENTE - ASI,32012
Concejo,CUNDINAMARCA,LA VEGA,CARLOS ORLANDO GUTIERREZ GONZALEZ,PARTIDO POLITICO MIRA Y PARTIDO CONSERVADOR COLOMBIANO,32034
Concejo,CUNDINAMARCA,LA VEGA,CLARA LEONOR RUBIANO MORENO,PARTIDO ALIANZA VERDE,32000
Concejo,CUNDINAMARCA,LA VEGA,CLAUDIA MARCELA GOMEZ BORRERO,PARTIDO ALIANZA SOCIAL INDEPENDIENTE - ASI,32016
Concejo,CUNDINAMARCA,LA VEGA,CLAUDIA YOHANA POLANCO RUIZ,PARTIDO ADA,31979
Concejo,CUNDINAMARCA,LA VEGA,DIANA ACENETH LIZARAZO ACOSTA,PARTIDO LIBERAL COLOMBIANO,31946
Concejo,CUNDINAMARCA,LA VEGA,DIEGO ANDRES GAITAN GONZALEZ,PARTIDO CENTRO DEMOCRATICO,31956
Concejo,CUNDINAMARCA,LA VEGA,DIEGO ANDRES PIRABAN LOPEZ,PARTIDO CENTRO DEMOCRATICO,31960
Concejo,CUNDINAMARCA,LA VEGA,DILMER ANDRES ALDANA ALDANA,PARTIDO SOCIAL DE UNIDAD NACIONAL PARTIDO DE LA U,32017
Concejo,CUNDINAMARCA,LA VEGA,DORA NELSY GUANA FANDIÑO,PARTIDO SOCIAL DE UNIDAD NACIONAL PARTIDO DE LA U,32027
Concejo,CUNDINAMARCA,LA VEGA,EDUIN JAVIER GUEVARA CALDERON,PARTIDO SOCIAL DE UNIDAD NACIONAL PARTIDO DE LA U,32024
Concejo,CUNDINAMARCA,LA VEGA,EDWARD HERNAN BORDA ARIAS,PARTIDO SOCIAL DE UNIDAD NACIONAL PARTIDO DE LA U,32022
Concejo,CUNDINAMARCA,LA VEGA,EGNA JINETH GONZALEZ CASTIBLANCO,PARTIDO POLITICO MIRA Y PARTIDO CONSERVADOR COLOMBIANO,32028
Concejo,CUNDINAMARCA,LA VEGA,ELVIS FERNEY RODRIGUEZ HERNANDEZ,PARTIDO ADA,31976
Concejo,CUNDINAMARCA,LA VEGA,ERIC DUVAN BARBOSA AMAYA,PARTIDO COLOMBIA RENACIENTE,31967
Concejo,CUNDINAMARCA,LA VEGA,FLORALBA LUCIA CONEJO CONEJO,PARTIDO ALIANZA SOCIAL INDEPENDIENTE - ASI,32009
Concejo,CUNDINAMARCA,LA VEGA,FRANCISCO  HOLGUIN FONSECA,PARTIDO LIBERAL COLOMBIANO,31943
Concejo,CUNDINAMARCA,LA VEGA,FULVIA ACENETH ACOSTA HERNANDEZ,PARTIDO LIBERAL COLOMBIANO,31951
Concejo,CUNDINAMARCA,LA VEGA,GERMAN RICARDO VARELA PEÑA,PARTIDO POLITICO MIRA Y PARTIDO CONSERVADOR COLOMBIANO,32031
Concejo,CUNDINAMARCA,LA VEGA,GLADIS  GOMEZ RODRIGUEZ,PARTIDO ALIANZA VERDE,31999
Concejo,CUNDINAMARCA,LA VEGA,GLORIA DIZNARDA MENDEZ GONZALEZ,PARTIDO ALIANZA VERDE,32002
Concejo,CUNDINAMARCA,LA VEGA,GLORIA ESPERANZA CASTAÑEDA ARANGO,PARTIDO ALIANZA SOCIAL INDEPENDIENTE - ASI,32008
Concejo,CUNDINAMARCA,LA VEGA,HECTOR ORLANDO MARTINEZ ,PARTIDO LIBERAL COLOMBIANO,31948
Concejo,CUNDINAMARCA,LA VEGA,HEIDY DANIELA COLORADO ACOSTA,PARTIDO COLOMBIA RENACIENTE,31966
Concejo,CUNDINAMARCA,LA VEGA,INGRID  MOSCOSO HERNANDEZ,PARTIDO CAMBIO RADICAL,31992
Concejo,CUNDINAMARCA,LA VEGA,JAIME  ORTIZ CASALLAS,PARTIDO CENTRO DEMOCRATICO,31959
Concejo,CUNDINAMARCA,LA VEGA,JAIME ANDRES LOPEZ ARDILA,PARTIDO SOCIAL DE UNIDAD NACIONAL PARTIDO DE LA U,32026
Concejo,CUNDINAMARCA,LA VEGA,JAIME YECID FARFAN BUSTOS,PARTIDO SOCIAL DE UNIDAD NACIONAL PARTIDO DE LA U,32023
Concejo,CUNDINAMARCA,LA VEGA,JAVIER ALBERTO AYALA LOZANO,PARTIDO CAMBIO RADICAL,31993
Concejo,CUNDINAMARCA,LA VEGA,JAVIER ALONSO MATIZ GUERRERO,PARTIDO LIBERAL COLOMBIANO,31941
Concejo,CUNDINAMARCA,LA VEGA,JOHN ENRIQUE BETANCOURT OSPINA,PARTIDO COLOMBIA RENACIENTE,31968
Concejo,CUNDINAMARCA,LA VEGA,JORGE  ULLOA ORDOÑEZ,PARTIDO LIBERAL COLOMBIANO,31949
Concejo,CUNDINAMARCA,LA VEGA,JORGE EDILBERTO SANABRIA MATIZ,PARTIDO LIBERAL COLOMBIANO,31950
Concejo,CUNDINAMARCA,LA VEGA,JORGE ENRIQUE LEON RAMIREZ,PARTIDO ALIANZA SOCIAL INDEPENDIENTE - ASI,32013
Concejo,CUNDINAMARCA,LA VEGA,JORGE HUMBERTO OVALLE JIMENEZ,PARTIDO ADA,31978
Concejo,CUNDINAMARCA,LA VEGA,JOSE ALEXANDER CELIS JIMENEZ,PARTIDO CAMBIO RADICAL,31985
Concejo,CUNDINAMARCA,LA VEGA,JOSE ALEXANDER RODRIGUEZ BEJARANO,PARTIDO LIBERAL COLOMBIANO,31947
Concejo,CUNDINAMARCA,LA VEGA,JOSE ARISTIDES RAMIREZ MORENO,PARTIDO POLITICO MIRA Y PARTIDO CONSERVADOR COLOMBIANO,32029
Concejo,CUNDINAMARCA,LA VEGA,JOSE HUMBERTO CORTES SUAREZ,PARTIDO ALIANZA VERDE,32004
Concejo,CUNDINAMARCA,LA VEGA,JOSE LUIS PINZON ROMERO,PARTIDO CAMBIO RADICAL,31988
Concejo,CUNDINAMARCA,LA VEGA,JOSE NARCIZO MORENO MELO,PARTIDO LIBERAL COLOMBIANO,31945
Concejo,CUNDINAMARCA,LA VEGA,JOSE OCTALIO MELO PEDRAZA,PARTIDO COLOMBIA RENACIENTE,31974
Concejo,CUNDINAMARCA,LA VEGA,JUAN CAMILO MARTINEZ PARDO,PARTIDO ALIANZA SOCIAL INDEPENDIENTE - ASI,32015
Concejo,CUNDINAMARCA,LA VEGA,JUAN CARLOS ZAMBRANO CUERVO,PARTIDO ALIANZA VERDE,31996
Concejo,CUNDINAMARCA,LA VEGA,JUAN GABRIEL PORTE LINARES,PARTIDO CAMBIO RADICAL,31995
Concejo,CUNDINAMARCA,LA VEGA,JULIAN ARMANDO CHIMBI SANCHEZ,PARTIDO ADA,31980
Concejo,CUNDINAMARCA,LA VEGA,LAURA JULIANA DIAZ SANCHEZ,PARTIDO CAMBIO RADICAL,31987
Concejo,CUNDINAMARCA,LA VEGA,LAURA MICHEL GORDILLO ROA,PARTIDO COLOMBIA JUSTA LIBRES,31963
Concejo,CUNDINAMARCA,LA VEGA,LEOVICELDO  RUIZ VELOZA,PARTIDO COLOMBIA RENACIENTE,31972
Concejo,CUNDINAMARCA,LA VEGA,LILIANA ESMERALDA MOLINA CUBILLOS,PARTIDO ALIANZA VERDE,31997
Concejo,CUNDINAMARCA,LA VEGA,LINEY DEL CARMEN OTERO REGINO,PARTIDO LIBERAL COLOMBIANO,31942
Concejo,CUNDINAMARCA,LA VEGA,LORENA FERNANDA DEL CASTILLO RODRIGUEZ RODRIGUEZ,PARTIDO CAMBIO RADICAL,31994
Concejo,CUNDINAMARCA,LA VEGA,LUIS ALFONSO GONZALEZ ,PARTIDO SOCIAL DE UNIDAD NACIONAL PARTIDO DE LA U,32025
Concejo,CUNDINAMARCA,LA VEGA,LUIS ERNESTO PARRA GOMEZ,PARTIDO POLITICO MIRA Y PARTIDO CONSERVADOR COLOMBIANO,32030
Concejo,CUNDINAMARCA,LA VEGA,LUISA FERNANDA DIAZ RODRIGUEZ,PARTIDO ADA,31984
Concejo,CUNDINAMARCA,LA VEGA,LUZ ESPERANZA LUGO SOLORZANO,PARTIDO COLOMBIA RENACIENTE,31970
Concejo,CUNDINAMARCA,LA VEGA,MARIA CRISTINA LEAL ,PARTIDO CAMBIO RADICAL,31989
Concejo,CUNDINAMARCA,LA VEGA,MARIA CRISTINA MARTINEZ MARTINEZ,PARTIDO POLITICO MIRA Y PARTIDO CONSERVADOR COLOMBIANO,32035
Concejo,CUNDINAMARCA,LA VEGA,MARIA DEL CARMEN ALDANA DE SERRATO,PARTIDO SOCIAL DE UNIDAD NACIONAL PARTIDO DE LA U,32020
Concejo,CUNDINAMARCA,LA VEGA,MARIA DEL CARMEN SANCHEZ GAMA,PARTIDO ADA,31977
Concejo,CUNDINAMARCA,LA VEGA,MARIA ERLI SEGURA RODRIGUEZ,PARTIDO ALIANZA VERDE,32005
Concejo,CUNDINAMARCA,LA VEGA,MARIA RUTH CALDERON MOLANO,PARTIDO ADA,31983
Concejo,CUNDINAMARCA,LA VEGA,MARIA VICTORIA MARTINEZ CASTAÑEDA,PARTIDO COLOMBIA JUSTA LIBRES,31964
Concejo,CUNDINAMARCA,LA VEGA,MARIA YOLANDA CALDERON DE RODRIGUEZ,PARTIDO ADA,31982
Concejo,CUNDINAMARCA,LA VEGA,MARTHA ISABEL RESTREPO LONDOÑO,PARTIDO COLOMBIA RENACIENTE,31971
Concejo,CUNDINAMARCA,LA VEGA,MIRIAM ESTHER URANGO TAPIAS,PARTIDO SOCIAL DE UNIDAD NACIONAL PARTIDO DE LA U,32021
Concejo,CUNDINAMARCA,LA VEGA,MOISES IGNACIO VELASQUEZ CAMACHO,PARTIDO ALIANZA SOCIAL INDEPENDIENTE - ASI,32010
Concejo,CUNDINAMARCA,LA VEGA,NELCY  ZULUAGA CUPAQUE,PARTIDO CENTRO DEMOCRATICO,31961
Concejo,CUNDINAMARCA,LA VEGA,NEYRIFER JAZMIN MAHECHA JIMENEZ,PARTIDO ALIANZA SOCIAL INDEPENDIENTE - ASI,32007
Concejo,CUNDINAMARCA,LA VEGA,OSCAR ALFONSO LOPEZ GONZALEZ,PARTIDO CENTRO DEMOCRATICO,31957
Concejo,CUNDINAMARCA,LA VEGA,OSCAR JULIAN ORJUELA NAVARRETE,PARTIDO ALIANZA SOCIAL INDEPENDIENTE - ASI,32006
Concejo,CUNDINAMARCA,LA VEGA,PEDRO  HERNANDEZ RODRIGUEZ,PARTIDO ADA,31981
Concejo,CUNDINAMARCA,LA VEGA,PEDRO ANTONIO BOHORQUEZ CELIS,PARTIDO ALIANZA VERDE,32003
Concejo,CUNDINAMARCA,LA VEGA,SONIA JEANNETTE OVALLE JIMENEZ,PARTIDO SOCIAL DE UNIDAD NACIONAL PARTIDO DE LA U,32019
Concejo,CUNDINAMARCA,LA VEGA,UBADEL  CONTRERAS ESQUIVEL,PARTIDO CAMBIO RADICAL,31990
Concejo,CUNDINAMARCA,LA VEGA,VICTOR HUGO GOMEZ LARA,PARTIDO COLOMBIA RENACIENTE,31975
Concejo,CUNDINAMARCA,LA VEGA,VICTOR HUGO LEON LEON,PARTIDO COLOMBIA RENACIENTE,31973
Concejo,CUNDINAMARCA,LA VEGA,VICTOR MANUEL HINCAPIE GUALTEROS,PARTIDO CAMBIO RADICAL,31991
Concejo,CUNDINAMARCA,LA VEGA,WILIAM RICARDO ACERO QUINTERO,PARTIDO CENTRO DEMOCRATICO,31952
Concejo,CUNDINAMARCA,LA VEGA,WILLIAM FERNANDO LOPEZ MORALES,PARTIDO CENTRO DEMOCRATICO,31958
Concejo,CUNDINAMARCA,LA VEGA,WILMAN FERNEY MANJARRES ORJUELA,PARTIDO POLITICO MIRA Y PARTIDO CONSERVADOR COLOMBIANO,32036
Concejo,CUNDINAMARCA,LA VEGA,WILSON ALEXANDER MORENO CAMARGO,PARTIDO ALIANZA SOCIAL INDEPENDIENTE - ASI,32014
Concejo,CUNDINAMARCA,LA VEGA,WUENDY ESMERALDA BERMUDEZ HERRERA,PARTIDO COLOMBIA RENACIENTE,31969
Concejo,CUNDINAMARCA,LA VEGA,YECITH ENRIQUE GIL GONZALEZ,PARTIDO ALIANZA SOCIAL INDEPENDIENTE - ASI,32011
Concejo,CUNDINAMARCA,LA VEGA,YEIMER ANDRES CORTES ACERO,PARTIDO CENTRO DEMOCRATICO,31955
Concejo,CUNDINAMARCA,LA VEGA,YENNY AMANDA AVILA LADINO,PARTIDO CENTRO DEMOCRATICO,31954
Concejo,CUNDINAMARCA,LA VEGA,YENNY ISABEL ACOSTA CONTRERAS,PARTIDO CENTRO DEMOCRATICO,31953
