corp,dpto,mpio,name,party,wp_no
Concejo,SANTANDER,FLORIDABLANCA,ADRIANA PATRICIA GARNICA RAMIREZ,PARTIDO LIBERAL COLOMBIANO,64909
Concejo,SANTANDER,FLORIDABLANCA,AGUSTIN  GIL MORALES,MOVIMIENTO ALTERNATIVO INDIGENA Y SOCIAL - MAIS,64942
Concejo,SANTANDER,FLORIDABLANCA,AHILSA MAYERLLY MEDINA OLARTE,PARTIDO SOCIAL DE UNIDAD NACIONAL PARTIDO DE LA U,65126
Concejo,SANTANDER,FLORIDABLANCA,ALBERTO  MORENO PRADA,PARTIDO ADA,64994
Concejo,SANTANDER,FLORIDABLANCA,ALEXANDER  QUINTERO CORREDOR,PARTIDO CONSERVADOR COLOMBIANO,65027
Concejo,SANTANDER,FLORIDABLANCA,ALFREDO  TARAZONA MATAMOROS,PARTIDO CAMBIO RADICAL,65033
Concejo,SANTANDER,FLORIDABLANCA,ALIDA  TORRES LAMUS,LIGA DE GOBERNANTES ANTICORRUPCION,65152
Concejo,SANTANDER,FLORIDABLANCA,ALONSO NORBERTO CHAVES ROBAYO,PARTIDO LIBERAL COLOMBIANO,64915
Concejo,SANTANDER,FLORIDABLANCA,ALVARO  BAUTISTA ,DECENTES FLORIDABLANCA,65217
Concejo,SANTANDER,FLORIDABLANCA,AMALIA MAREIBA GOMEZ REYES,PARTIDO CONSERVADOR COLOMBIANO,65029
Concejo,SANTANDER,FLORIDABLANCA,AMPARO  DELGADO AYALA,MOVIMIENTO AUTORIDADES INDIGENAS DE COLOMBIA - AICO,65080
Concejo,SANTANDER,FLORIDABLANCA,AMPARO  ROMERO RIVERA,SIN CAMPO NO HAY CIUDAD,65188
Concejo,SANTANDER,FLORIDABLANCA,ANA BELEN PABON ROZO,SIN CAMPO NO HAY CIUDAD,65192
Concejo,SANTANDER,FLORIDABLANCA,ANA MARIA ORTEGA PEREZ,PARTIDO LIBERAL COLOMBIANO,64914
Concejo,SANTANDER,FLORIDABLANCA,ANDREA  JOYA CABRERA,PARTIDO DE REIVINDICACIÓN ÉTNICA -PRE-,65011
Concejo,SANTANDER,FLORIDABLANCA,ANDRES ALBERTO SILVA GUTIERREZ,MOVIMIENTO AUTORIDADES INDIGENAS DE COLOMBIA - AICO,65089
Concejo,SANTANDER,FLORIDABLANCA,ANDRES NORBERTO ARDILA PEREZ,PARTIDO SOCIAL DE UNIDAD NACIONAL PARTIDO DE LA U,65111
Concejo,SANTANDER,FLORIDABLANCA,ANGEL DARIO PATARROYO ESTUPIÑAN,DECENTES FLORIDABLANCA,65213
Concejo,SANTANDER,FLORIDABLANCA,ANGELA PATRICIA ALFONSO ALFONSO,PARTIDO ALIANZA SOCIAL INDEPENDIENTE - ASI,65095
Concejo,SANTANDER,FLORIDABLANCA,ANYURY  CARRILLO URIBE,PARTIDO ADA,64980
Concejo,SANTANDER,FLORIDABLANCA,ARMANDO  LOPEZ MEZA,PARTIDO COLOMBIA RENACIENTE,64975
Concejo,SANTANDER,FLORIDABLANCA,AURELIO  CAPACHO CASTELLANOS,DECENTES FLORIDABLANCA,65216
Concejo,SANTANDER,FLORIDABLANCA,BERNARDO  VILLABONA ORTIZ,PARTIDO LIBERAL COLOMBIANO,64912
Concejo,SANTANDER,FLORIDABLANCA,BLANCA AZUCENA BARRIOS VALENCIA,MOVIMIENTO ALTERNATIVO INDIGENA Y SOCIAL - MAIS,64941
Concejo,SANTANDER,FLORIDABLANCA,BLANCA LIBIA CARO QUINTERO,PARTIDO POLITICO MIRA,65108
Concejo,SANTANDER,FLORIDABLANCA,CARLOS  RAMIREZ BERMUDEZ,PARTIDO COLOMBIA RENACIENTE,64978
Concejo,SANTANDER,FLORIDABLANCA,CARLOS AUGUSTO NOVA ORDUZ,PARTIDO POLO DEMOCRATICO ALTERNATIVO,65142
Concejo,SANTANDER,FLORIDABLANCA,CARLOS EDUARDO URIBE PEREZ,PARTIDO COLOMBIA RENACIENTE,64970
Concejo,SANTANDER,FLORIDABLANCA,CARLOS ERNESTO REYES MONSALVE,PARTIDO LIBERAL COLOMBIANO,64907
Concejo,SANTANDER,FLORIDABLANCA,CARLOS JULIO CASTAÑEDA CARDENAS,PARTIDO ALIANZA SOCIAL INDEPENDIENTE - ASI,65091
Concejo,SANTANDER,FLORIDABLANCA,CARLOS JULIO GOMEZ BARRERA,PARTIDO COLOMBIA RENACIENTE,64966
Concejo,SANTANDER,FLORIDABLANCA,CARMEN MELISSA FORERO AVILA,PARTIDO ALIANZA SOCIAL INDEPENDIENTE - ASI,65097
Concejo,SANTANDER,FLORIDABLANCA,CARMEN ROSA PALOMINO GARAVITO,PARTIDO POLO DEMOCRATICO ALTERNATIVO,65135
Concejo,SANTANDER,FLORIDABLANCA,CAROLINA  CASTILLO MENDOZA,SIN CAMPO NO HAY CIUDAD,65200
Concejo,SANTANDER,FLORIDABLANCA,CAROLINA  ORTIZ SANTAMARIA,LIGA DE GOBERNANTES ANTICORRUPCION,65164
Concejo,SANTANDER,FLORIDABLANCA,CECILIA  CAMACHO BARON,COMUNALES POR FLORIDABLANCA,65180
Concejo,SANTANDER,FLORIDABLANCA,CESAR ALONSO MELGAREJO MENDEZ,SIN CAMPO NO HAY CIUDAD,65195
Concejo,SANTANDER,FLORIDABLANCA,CESAR FERNANDO NAVARRO PEREZ,PARTIDO CONSERVADOR COLOMBIANO,65030
Concejo,SANTANDER,FLORIDABLANCA,CHRISTIAN ANDRES SUAREZ CRUZ,DECENTES FLORIDABLANCA,65222
Concejo,SANTANDER,FLORIDABLANCA,CLARA ESTHELA VERA VILLAMIZAR,MOVIMIENTO ALTERNATIVO INDIGENA Y SOCIAL - MAIS,64949
Concejo,SANTANDER,FLORIDABLANCA,CLAUDIA ESTHER BLANCO OCHOA,PARTIDO POLO DEMOCRATICO ALTERNATIVO,65138
Concejo,SANTANDER,FLORIDABLANCA,CLAUDIA LILIANA SIERRA BARRERA,PARTIDO ALIANZA SOCIAL INDEPENDIENTE - ASI,65105
Concejo,SANTANDER,FLORIDABLANCA,CLAUDIA PATRICIA RANGEL BENAVIDES,PARTIDO POLO DEMOCRATICO ALTERNATIVO,65137
Concejo,SANTANDER,FLORIDABLANCA,CLAY WILSON LARROTA MUÑOZ,PARTIDO DE REIVINDICACIÓN ÉTNICA -PRE-,65013
Concejo,SANTANDER,FLORIDABLANCA,CLEMENTE  CASTELLANOS FLOREZ,PARTIDO CAMBIO RADICAL,65038
Concejo,SANTANDER,FLORIDABLANCA,CRISTIAN JAVIER DUARTE ,MOVIMIENTO AUTORIDADES INDIGENAS DE COLOMBIA - AICO,65083
Concejo,SANTANDER,FLORIDABLANCA,CRISTIAN MAURICIO JIMENEZ DELGADO,PARTIDO CONSERVADOR COLOMBIANO,65024
Concejo,SANTANDER,FLORIDABLANCA,CYNTHIA VIVIANA MARTINEZ CORNEJO,PARTIDO CAMBIO RADICAL,65046
Concejo,SANTANDER,FLORIDABLANCA,DANIEL  ACUÑA DAVID,PARTIDO POLO DEMOCRATICO ALTERNATIVO,65146
Concejo,SANTANDER,FLORIDABLANCA,DAYAN PATRICIA FONTECHA ACEVEDO,PARTIDO SOCIAL DE UNIDAD NACIONAL PARTIDO DE LA U,65113
Concejo,SANTANDER,FLORIDABLANCA,DIANA ALEXANDRA FUENTES NIEVES,PARTIDO COLOMBIA RENACIENTE,64974
Concejo,SANTANDER,FLORIDABLANCA,DIANA JENNICE QUIÑONEZ RANGEL,PARTIDO ALIANZA VERDE,65066
Concejo,SANTANDER,FLORIDABLANCA,DIEGO ALEXANDER SALCEDO CRUZ,PARTIDO SOCIAL DE UNIDAD NACIONAL PARTIDO DE LA U,65128
Concejo,SANTANDER,FLORIDABLANCA,DIEGO SEBASTIAN HERNANDEZ VILLAMIZAR,PARTIDO DE REIVINDICACIÓN ÉTNICA -PRE-,65002
Concejo,SANTANDER,FLORIDABLANCA,EDER ALEXIS FLOREZ ORTEGA,PARTIDO CENTRO DEMOCRATICO,64926
Concejo,SANTANDER,FLORIDABLANCA,EDGAR  BARON SUAREZ,MOVIMIENTO ALTERNATIVO INDIGENA Y SOCIAL - MAIS,64950
Concejo,SANTANDER,FLORIDABLANCA,EDGAR  SANCHEZ MORALES,PARTIDO ADA,64992
Concejo,SANTANDER,FLORIDABLANCA,EDGAR AUGUSTO VARGAS GOMEZ,PARTIDO CAMBIO RADICAL,65035
Concejo,SANTANDER,FLORIDABLANCA,EDGAR ENRIQUE GOMEZ SILVA,PARTIDO ALIANZA VERDE,65052
Concejo,SANTANDER,FLORIDABLANCA,EDINSON KLEYMAN BELTRAN JEREZ,PARTIDO CAMBIO RADICAL,65042
Concejo,SANTANDER,FLORIDABLANCA,EDUIN OMAR PINZON CORREA,PARTIDO SOCIAL DE UNIDAD NACIONAL PARTIDO DE LA U,65114
Concejo,SANTANDER,FLORIDABLANCA,EDWIN REYNEL VARGAS PATIÑO,PARTIDO CONSERVADOR COLOMBIANO,65031
Concejo,SANTANDER,FLORIDABLANCA,ELBERT  VARGAS CUBIDES,PARTIDO ADA,64989
Concejo,SANTANDER,FLORIDABLANCA,EMILSE  MORENO GUIZA,SIN CAMPO NO HAY CIUDAD,65197
Concejo,SANTANDER,FLORIDABLANCA,ERIKA JOHANNA RODRIGUEZ DURAN,PARTIDO CENTRO DEMOCRATICO,64920
Concejo,SANTANDER,FLORIDABLANCA,ERIKA VIVIANA MEJIA GUERRERO,COMUNALES POR FLORIDABLANCA,65179
Concejo,SANTANDER,FLORIDABLANCA,ESMITH YOLIMA VILLALBA GRANADOS,PARTIDO COLOMBIA RENACIENTE,64967
Concejo,SANTANDER,FLORIDABLANCA,EVA JACKELINE RUEDA VILLARRAGA,MOVIMIENTO AUTORIDADES INDIGENAS DE COLOMBIA - AICO,65075
Concejo,SANTANDER,FLORIDABLANCA,EVELIO  ALAPE CONDE,PARTIDO COLOMBIA JUSTA LIBRES,64955
Concejo,SANTANDER,FLORIDABLANCA,EXCELINO  AREVALO CUADROS,PARTIDO ADA,64983
Concejo,SANTANDER,FLORIDABLANCA,FABIAN DAVID SUAREZ SANCHEZ,PARTIDO DE REIVINDICACIÓN ÉTNICA -PRE-,65016
Concejo,SANTANDER,FLORIDABLANCA,FABIAN HERNAN QUINTERO QUINTERO,DECENTES FLORIDABLANCA,65212
Concejo,SANTANDER,FLORIDABLANCA,FABIO EDUARDO PEÑA GALVIS,PARTIDO CENTRO DEMOCRATICO,64927
Concejo,SANTANDER,FLORIDABLANCA,FEDERICO  FAJARDO PANTOJA,COMUNALES POR FLORIDABLANCA,65171
Concejo,SANTANDER,FLORIDABLANCA,FELIPE ALEXANDER VARGAS GUIO,PARTIDO COLOMBIA JUSTA LIBRES,64953
Concejo,SANTANDER,FLORIDABLANCA,FERNANDO  ARIZA OLACHICA,MOVIMIENTO AUTORIDADES INDIGENAS DE COLOMBIA - AICO,65078
Concejo,SANTANDER,FLORIDABLANCA,FERNANDO FABIO ORTIZ FLOREZ,PARTIDO POLO DEMOCRATICO ALTERNATIVO,65140
Concejo,SANTANDER,FLORIDABLANCA,FLORIDAN  TOLOZA LIEVANO,PARTIDO COLOMBIA RENACIENTE,64964
Concejo,SANTANDER,FLORIDABLANCA,FRANCISCO DE JESUS AYALA PAEZ,DECENTES FLORIDABLANCA,65226
Concejo,SANTANDER,FLORIDABLANCA,FRANCO ARMANDO GUERRERO ALBAN,PARTIDO POLO DEMOCRATICO ALTERNATIVO,65141
Concejo,SANTANDER,FLORIDABLANCA,FREDDY  AVILA ,PARTIDO SOCIAL DE UNIDAD NACIONAL PARTIDO DE LA U,65122
Concejo,SANTANDER,FLORIDABLANCA,GABRIEL ALEXANDER VALENCIA URIBE,SIN CAMPO NO HAY CIUDAD,65189
Concejo,SANTANDER,FLORIDABLANCA,GERMAN  DURAN USEDA,MOVIMIENTO ALTERNATIVO INDIGENA Y SOCIAL - MAIS,64945
Concejo,SANTANDER,FLORIDABLANCA,GERMAN  FLOREZ JIMENEZ,DECENTES FLORIDABLANCA,65224
Concejo,SANTANDER,FLORIDABLANCA,GILMA YOLANDA VALBUENA PALLARES,DECENTES FLORIDABLANCA,65211
Concejo,SANTANDER,FLORIDABLANCA,GLADYS  VERA SUAREZ,PARTIDO CENTRO DEMOCRATICO,64924
Concejo,SANTANDER,FLORIDABLANCA,GLORIA  LEON DE RODRIGUEZ,PARTIDO COLOMBIA RENACIENTE,64969
Concejo,SANTANDER,FLORIDABLANCA,GLORIA ANDREA CABALLERO GUARIN,PARTIDO DE REIVINDICACIÓN ÉTNICA -PRE-,65009
Concejo,SANTANDER,FLORIDABLANCA,GLORIA YANETH LINARES ,PARTIDO CENTRO DEMOCRATICO,64929
Concejo,SANTANDER,FLORIDABLANCA,GONZALO  SILVA VIVIESCAS,MOVIMIENTO AUTORIDADES INDIGENAS DE COLOMBIA - AICO,65076
Concejo,SANTANDER,FLORIDABLANCA,GRACIELA  SANABRIA TARAZONA,DECENTES FLORIDABLANCA,65221
Concejo,SANTANDER,FLORIDABLANCA,GUIDO ROMAN CALDERON ARDILA,PARTIDO CAMBIO RADICAL,65049
Concejo,SANTANDER,FLORIDABLANCA,GUILLERMO  GONZALEZ PALOMINO,PARTIDO LIBERAL COLOMBIANO,64913
Concejo,SANTANDER,FLORIDABLANCA,GUSTAVO  MORENO MONROY,PARTIDO ALIANZA VERDE,65057
Concejo,SANTANDER,FLORIDABLANCA,HAROLD MAURICIO RODRIGUEZ GUEVARA,PARTIDO CAMBIO RADICAL,65036
Concejo,SANTANDER,FLORIDABLANCA,HAROLDO ANTONIO LINERO PEREZ,LIGA DE GOBERNANTES ANTICORRUPCION,65153
Concejo,SANTANDER,FLORIDABLANCA,HECTOR  BAREÑO MATEUS,PARTIDO CONSERVADOR COLOMBIANO,65032
Concejo,SANTANDER,FLORIDABLANCA,HECTOR  PINZON QUIROGA,SIN CAMPO NO HAY CIUDAD,65186
Concejo,SANTANDER,FLORIDABLANCA,HECTOR JAVIER ORTIZ RAMIREZ,PARTIDO CENTRO DEMOCRATICO,64919
Concejo,SANTANDER,FLORIDABLANCA,HEDELBERTO  MENDOZA MIEL,SIN CAMPO NO HAY CIUDAD,65191
Concejo,SANTANDER,FLORIDABLANCA,HEIDY TATIANA VALENCIA RUIZ,PARTIDO POLO DEMOCRATICO ALTERNATIVO,65139
Concejo,SANTANDER,FLORIDABLANCA,HELIO  TORRES TOLOZA,PARTIDO ADA,64986
Concejo,SANTANDER,FLORIDABLANCA,HENRY ALFONSO DIAZ HERNANDEZ,PARTIDO CENTRO DEMOCRATICO,64933
Concejo,SANTANDER,FLORIDABLANCA,HERIBERTO  SANDOVAL SUAREZ,PARTIDO DE REIVINDICACIÓN ÉTNICA -PRE-,65001
Concejo,SANTANDER,FLORIDABLANCA,HERMINDA  SUAREZ BARAJAS,PARTIDO ADA,64993
Concejo,SANTANDER,FLORIDABLANCA,HERNAN  URIBE GARCIA,COMUNALES POR FLORIDABLANCA,65181
Concejo,SANTANDER,FLORIDABLANCA,HERNANDO  HERNANDEZ CARRILLO,PARTIDO DE REIVINDICACIÓN ÉTNICA -PRE-,65000
Concejo,SANTANDER,FLORIDABLANCA,HOWARD LOEB CRUZ REY,LIGA DE GOBERNANTES ANTICORRUPCION,65151
Concejo,SANTANDER,FLORIDABLANCA,ISIDRO  ASELAS SIERRA,MOVIMIENTO ALTERNATIVO INDIGENA Y SOCIAL - MAIS,64937
Concejo,SANTANDER,FLORIDABLANCA,JAIME  CARREÑO APONTE,PARTIDO ALIANZA VERDE,65056
Concejo,SANTANDER,FLORIDABLANCA,JAIME  SANCHEZ CARREÑO,PARTIDO SOCIAL DE UNIDAD NACIONAL PARTIDO DE LA U,65129
Concejo,SANTANDER,FLORIDABLANCA,JAIME ALEXANDER CARRILLO TARAZONA,MOVIMIENTO AUTORIDADES INDIGENAS DE COLOMBIA - AICO,65081
Concejo,SANTANDER,FLORIDABLANCA,JAIME AUGUSTO BOHORQUEZ CENTENO,PARTIDO POLITICO MIRA,65110
Concejo,SANTANDER,FLORIDABLANCA,JAIRO  RUIZ MARTINEZ,PARTIDO ADA,64979
Concejo,SANTANDER,FLORIDABLANCA,JAIRO  SOLANO GOMEZ,PARTIDO CENTRO DEMOCRATICO,64925
Concejo,SANTANDER,FLORIDABLANCA,JAIRO ALEXANDER LUNA PINTO,LIGA DE GOBERNANTES ANTICORRUPCION,65150
Concejo,SANTANDER,FLORIDABLANCA,JAIRO EDUARDO GUTIERREZ ,MOVIMIENTO ALTERNATIVO INDIGENA Y SOCIAL - MAIS,64938
Concejo,SANTANDER,FLORIDABLANCA,JANNETH CAROLINA ACOSTA TELLEZ,LIGA DE GOBERNANTES ANTICORRUPCION,65157
Concejo,SANTANDER,FLORIDABLANCA,JAVIER  GOMEZ DIAZ,PARTIDO ADA,64982
Concejo,SANTANDER,FLORIDABLANCA,JAVIER ORLANDO BOHORQUEZ CABALLERO,PARTIDO ALIANZA SOCIAL INDEPENDIENTE - ASI,65093
Concejo,SANTANDER,FLORIDABLANCA,JAZMIN ROCIO JIMENEZ JAIMES,PARTIDO ADA,64988
Concejo,SANTANDER,FLORIDABLANCA,JEFTE  MERCADO RIVERA,SIN CAMPO NO HAY CIUDAD,65196
Concejo,SANTANDER,FLORIDABLANCA,JESUS EDUARDO CAMPOS GOMEZ,DECENTES FLORIDABLANCA,65219
Concejo,SANTANDER,FLORIDABLANCA,JESUS ERNESTO URIBE MENESES,PARTIDO DE REIVINDICACIÓN ÉTNICA -PRE-,65006
Concejo,SANTANDER,FLORIDABLANCA,JHAN CARLOS RUIZ SIERRA,MOVIMIENTO AUTORIDADES INDIGENAS DE COLOMBIA - AICO,65077
Concejo,SANTANDER,FLORIDABLANCA,JHONS HADER RENGIFO CONDE,PARTIDO CAMBIO RADICAL,65051
Concejo,SANTANDER,FLORIDABLANCA,JIRSON  AGUILLON RAMIREZ,MOVIMIENTO ALTERNATIVO INDIGENA Y SOCIAL - MAIS,64940
Concejo,SANTANDER,FLORIDABLANCA,JOHAO ALEXANDER ALFONSO GOMEZ,PARTIDO ALIANZA VERDE,65065
Concejo,SANTANDER,FLORIDABLANCA,JOHN FREDY HERNANDEZ BAEZ,PARTIDO ALIANZA SOCIAL INDEPENDIENTE - ASI,65102
Concejo,SANTANDER,FLORIDABLANCA,JOHN MAURICIO GONZALEZ VILLAMIZAR,PARTIDO ADA,64981
Concejo,SANTANDER,FLORIDABLANCA,JORGE  BADILLO RUSSO,PARTIDO LIBERAL COLOMBIANO,64904
Concejo,SANTANDER,FLORIDABLANCA,JORGE  DURAN ANGARITA,PARTIDO POLO DEMOCRATICO ALTERNATIVO,65131
Concejo,SANTANDER,FLORIDABLANCA,JORGE ALBERTO PINZON MEDINA,MOVIMIENTO ALTERNATIVO INDIGENA Y SOCIAL - MAIS,64934
Concejo,SANTANDER,FLORIDABLANCA,JORGE ALIRIO SEQUEDA ORTIZ,PARTIDO ADA,64987
Concejo,SANTANDER,FLORIDABLANCA,JORGE ANDRES SANDOVAL CAICEDO,PARTIDO POLO DEMOCRATICO ALTERNATIVO,65132
Concejo,SANTANDER,FLORIDABLANCA,JORGE GUSTAVO ULLOA VILLAMIZAR,PARTIDO COLOMBIA RENACIENTE,64972
Concejo,SANTANDER,FLORIDABLANCA,JORGE IVAN SANCHEZ ARIAS,PARTIDO POLO DEMOCRATICO ALTERNATIVO,65130
Concejo,SANTANDER,FLORIDABLANCA,JORGE LUIS ROMERO RESTREPO,PARTIDO COLOMBIA RENACIENTE,64977
Concejo,SANTANDER,FLORIDABLANCA,JOSE ALEXANDER ESPARZA MARTINEZ,PARTIDO CONSERVADOR COLOMBIANO,65018
Concejo,SANTANDER,FLORIDABLANCA,JOSE ALFREDO GELVEZ GELVEZ,MOVIMIENTO AUTORIDADES INDIGENAS DE COLOMBIA - AICO,65087
Concejo,SANTANDER,FLORIDABLANCA,JOSE ALFREDO PARRA OLIVEROS,PARTIDO ALIANZA SOCIAL INDEPENDIENTE - ASI,65103
Concejo,SANTANDER,FLORIDABLANCA,JOSE DE JESUS VILLANUEVA MARTINEZ,COMUNALES POR FLORIDABLANCA,65174
Concejo,SANTANDER,FLORIDABLANCA,JOSE DOLORES HERNANDEZ CARVAJAL,PARTIDO POLO DEMOCRATICO ALTERNATIVO,65133
Concejo,SANTANDER,FLORIDABLANCA,JOSE FERNANDO SANCHEZ CARVAJAL,PARTIDO CAMBIO RADICAL,65043
Concejo,SANTANDER,FLORIDABLANCA,JOSE HENRY GRUESO ROMERO,PARTIDO COLOMBIA RENACIENTE,64962
Concejo,SANTANDER,FLORIDABLANCA,JOSE JOAQUIN TIGA SANCHEZ,COMUNALES POR FLORIDABLANCA,65177
Concejo,SANTANDER,FLORIDABLANCA,JOSE LUIS MEJIA SALAZAR,PARTIDO ALIANZA SOCIAL INDEPENDIENTE - ASI,65094
Concejo,SANTANDER,FLORIDABLANCA,JOSE LUIS ORTEGA TRIANA,DECENTES FLORIDABLANCA,65220
Concejo,SANTANDER,FLORIDABLANCA,JOSE NICANOR CARVAJAL GOMEZ,SIN CAMPO NO HAY CIUDAD,65199
Concejo,SANTANDER,FLORIDABLANCA,JOSE NICANOR VERA PEDRAZA,PARTIDO LIBERAL COLOMBIANO,64903
Concejo,SANTANDER,FLORIDABLANCA,JOSEMANUEL JUNIOR SEQUEDA ORTIZ,PARTIDO ALIANZA SOCIAL INDEPENDIENTE - ASI,65096
Concejo,SANTANDER,FLORIDABLANCA,JOTA MARIO ZAPATA RICO,PARTIDO CENTRO DEMOCRATICO,64922
Concejo,SANTANDER,FLORIDABLANCA,JUAN ANGEL TRIANA HERNANDEZ,PARTIDO CENTRO DEMOCRATICO,64916
Concejo,SANTANDER,FLORIDABLANCA,JUAN CARLOS RAMIREZ ABRIL,PARTIDO DE REIVINDICACIÓN ÉTNICA -PRE-,65015
Concejo,SANTANDER,FLORIDABLANCA,JUAN CARLOS RODRIGUEZ ,MOVIMIENTO ALTERNATIVO INDIGENA Y SOCIAL - MAIS,64951
Concejo,SANTANDER,FLORIDABLANCA,JUAN CARLOS ROJAS ANAYA,PARTIDO ALIANZA SOCIAL INDEPENDIENTE - ASI,65099
Concejo,SANTANDER,FLORIDABLANCA,JUAN DIEGO VARGAS ROJAS,PARTIDO ALIANZA VERDE,65058
Concejo,SANTANDER,FLORIDABLANCA,JUAN FRANCISCO VALBUENA ESPARZA,PARTIDO POLO DEMOCRATICO ALTERNATIVO,65144
Concejo,SANTANDER,FLORIDABLANCA,JUAN SEBASTIAN ARCHILA GUALDRON,PARTIDO CENTRO DEMOCRATICO,64918
Concejo,SANTANDER,FLORIDABLANCA,JULIO CESAR AFANADOR ,PARTIDO POLO DEMOCRATICO ALTERNATIVO,65147
Concejo,SANTANDER,FLORIDABLANCA,KAREN ALICIA SERRANO FUENTES,PARTIDO CAMBIO RADICAL,65047
Concejo,SANTANDER,FLORIDABLANCA,KAREN LILIANA SERRANO TORRES,PARTIDO LIBERAL COLOMBIANO,64908
Concejo,SANTANDER,FLORIDABLANCA,KAREN LORENA SANCHEZ QUINTERO,PARTIDO ALIANZA VERDE,65055
Concejo,SANTANDER,FLORIDABLANCA,KAREN YURLEY CAMACHO JAIMES,DECENTES FLORIDABLANCA,65214
Concejo,SANTANDER,FLORIDABLANCA,LAURA JULIANA GARCIA RIVERA,MOVIMIENTO AUTORIDADES INDIGENAS DE COLOMBIA - AICO,65084
Concejo,SANTANDER,FLORIDABLANCA,LAURA JULIANA MENESES PIMENTEL,PARTIDO CENTRO DEMOCRATICO,64923
Concejo,SANTANDER,FLORIDABLANCA,LAURA MARCELA DIAZ PILONIETA,PARTIDO CAMBIO RADICAL,65041
Concejo,SANTANDER,FLORIDABLANCA,LAURA ROCIO MOLANO PEDRAZA,PARTIDO CAMBIO RADICAL,65044
Concejo,SANTANDER,FLORIDABLANCA,LAURA XIMENA JAIMES HERNANDEZ,PARTIDO ALIANZA SOCIAL INDEPENDIENTE - ASI,65107
Concejo,SANTANDER,FLORIDABLANCA,LEIDY PAOLA PEREZ GARAVITO,COMUNALES POR FLORIDABLANCA,65172
Concejo,SANTANDER,FLORIDABLANCA,LEONARDO  CASTELLANOS RODRIGUEZ,SIN CAMPO NO HAY CIUDAD,65184
Concejo,SANTANDER,FLORIDABLANCA,LIBIA CRISTINA GOMEZ LUNA,PARTIDO ADA,64995
Concejo,SANTANDER,FLORIDABLANCA,LILIANA  MENDOZA RODRIGUEZ,PARTIDO LIBERAL COLOMBIANO,64902
Concejo,SANTANDER,FLORIDABLANCA,LINA MARIA ARENALES DIAZ,LIGA DE GOBERNANTES ANTICORRUPCION,65156
Concejo,SANTANDER,FLORIDABLANCA,LINA PAOLA PARRA CASTELLANOS,PARTIDO ADA,64996
Concejo,SANTANDER,FLORIDABLANCA,LINDA PATRICIA PALENCIA PESTANA,LIGA DE GOBERNANTES ANTICORRUPCION,65161
Concejo,SANTANDER,FLORIDABLANCA,LUCILA  CASTRO LEON,PARTIDO COLOMBIA RENACIENTE,64965
Concejo,SANTANDER,FLORIDABLANCA,LUDWING ANDRES PRADA BUENO,PARTIDO LIBERAL COLOMBIANO,64905
Concejo,SANTANDER,FLORIDABLANCA,LUDWING ARNULFO RIOS CABALLERO,PARTIDO DE REIVINDICACIÓN ÉTNICA -PRE-,65010
Concejo,SANTANDER,FLORIDABLANCA,LUDY  PRADA CASANOVA,PARTIDO CENTRO DEMOCRATICO,64928
Concejo,SANTANDER,FLORIDABLANCA,LUIS ALBERTO CASTELLANOS SUAREZ,PARTIDO ALIANZA SOCIAL INDEPENDIENTE - ASI,65101
Concejo,SANTANDER,FLORIDABLANCA,LUIS ALBERTO GARCES FERNANDEZ,PARTIDO SOCIAL DE UNIDAD NACIONAL PARTIDO DE LA U,65112
Concejo,SANTANDER,FLORIDABLANCA,LUIS ALBERTO PEÑA PEÑA,PARTIDO CAMBIO RADICAL,65050
Concejo,SANTANDER,FLORIDABLANCA,LUIS ALFONSO PADILLA PARRA,PARTIDO ADA,64991
Concejo,SANTANDER,FLORIDABLANCA,LUIS ANTONIO LAMUS PARDO,MOVIMIENTO ALTERNATIVO INDIGENA Y SOCIAL - MAIS,64936
Concejo,SANTANDER,FLORIDABLANCA,LUIS CARLOS MARIN BASTO,PARTIDO DE REIVINDICACIÓN ÉTNICA -PRE-,65012
Concejo,SANTANDER,FLORIDABLANCA,LUIS EDUARDO GALINDO SAAVEDRA,DECENTES FLORIDABLANCA,65218
Concejo,SANTANDER,FLORIDABLANCA,LUIS EDUARDO GONZALEZ ,PARTIDO SOCIAL DE UNIDAD NACIONAL PARTIDO DE LA U,65125
Concejo,SANTANDER,FLORIDABLANCA,LUIS EDUARDO JAIMES OLARTE,MOVIMIENTO ALTERNATIVO INDIGENA Y SOCIAL - MAIS,64939
Concejo,SANTANDER,FLORIDABLANCA,LUIS FELIPE CABALLERO SANCHEZ,PARTIDO ALIANZA SOCIAL INDEPENDIENTE - ASI,65090
Concejo,SANTANDER,FLORIDABLANCA,LUIS FERNANDO LEON GOMEZ,PARTIDO ADA,64984
Concejo,SANTANDER,FLORIDABLANCA,LUIS FERNANDO RAMIREZ SUESCUN,PARTIDO ALIANZA VERDE,65061
Concejo,SANTANDER,FLORIDABLANCA,LUIS FRANCISCO MERCHAN BASTO,DECENTES FLORIDABLANCA,65223
Concejo,SANTANDER,FLORIDABLANCA,LUIS MAURICIO URIBE SALAZAR,COMUNALES POR FLORIDABLANCA,65166
Concejo,SANTANDER,FLORIDABLANCA,LUIS OBDULIO RUIZ MATEUS,COMUNALES POR FLORIDABLANCA,65182
Concejo,SANTANDER,FLORIDABLANCA,LUIS SENEN SILVA PORTILLA,MOVIMIENTO ALTERNATIVO INDIGENA Y SOCIAL - MAIS,64947
Concejo,SANTANDER,FLORIDABLANCA,LUSWING ENRIQUE MERCHAN HERRERA,PARTIDO COLOMBIA RENACIENTE,64961
Concejo,SANTANDER,FLORIDABLANCA,LUZ AMANDA GRANADOS GARCIA,PARTIDO DE REIVINDICACIÓN ÉTNICA -PRE-,64999
Concejo,SANTANDER,FLORIDABLANCA,LUZ DANUR PINZON VARGAS,PARTIDO SOCIAL DE UNIDAD NACIONAL PARTIDO DE LA U,65120
Concejo,SANTANDER,FLORIDABLANCA,LUZ DARY MORALES CAMACHO,MOVIMIENTO ALTERNATIVO INDIGENA Y SOCIAL - MAIS,64952
Concejo,SANTANDER,FLORIDABLANCA,LUZ ERIKA BERMUDEZ ,MOVIMIENTO AUTORIDADES INDIGENAS DE COLOMBIA - AICO,65074
Concejo,SANTANDER,FLORIDABLANCA,LUZ MARY DURAN CACERES,MOVIMIENTO ALTERNATIVO INDIGENA Y SOCIAL - MAIS,64948
Concejo,SANTANDER,FLORIDABLANCA,MAIRA CAMILA DAVILA ZABALA,LIGA DE GOBERNANTES ANTICORRUPCION,65154
Concejo,SANTANDER,FLORIDABLANCA,MANUEL FERNANDO RIAÑO ROJAS,MOVIMIENTO AUTORIDADES INDIGENAS DE COLOMBIA - AICO,65088
Concejo,SANTANDER,FLORIDABLANCA,MARCO ANTONIO RIVERA MIRANDA,PARTIDO DE REIVINDICACIÓN ÉTNICA -PRE-,65004
Concejo,SANTANDER,FLORIDABLANCA,MARCO ANTONIO VELASQUEZ ,PARTIDO CAMBIO RADICAL,65040
Concejo,SANTANDER,FLORIDABLANCA,MARCOS  OLARTE RAMIREZ,PARTIDO CENTRO DEMOCRATICO,64917
Concejo,SANTANDER,FLORIDABLANCA,MARGARITA  MARTINEZ ZAMBRANO,PARTIDO ALIANZA VERDE,65064
Concejo,SANTANDER,FLORIDABLANCA,MARIA AMPARO GOMEZ CASTELLANOS,MOVIMIENTO AUTORIDADES INDIGENAS DE COLOMBIA - AICO,65079
Concejo,SANTANDER,FLORIDABLANCA,MARIA ANGELICA REYES ORTIZ,COMUNALES POR FLORIDABLANCA,65173
Concejo,SANTANDER,FLORIDABLANCA,MARIA CONSUELO GALVIS CALDERON,PARTIDO CONSERVADOR COLOMBIANO,65025
Concejo,SANTANDER,FLORIDABLANCA,MARIA FRANCY BELTRAN ARDILA,PARTIDO CAMBIO RADICAL,65037
Concejo,SANTANDER,FLORIDABLANCA,MARIA ISABEL GARCIA DUARTE,PARTIDO POLITICO MIRA,65109
Concejo,SANTANDER,FLORIDABLANCA,MARIA JOSE PEÑA RAMIREZ,SIN CAMPO NO HAY CIUDAD,65183
Concejo,SANTANDER,FLORIDABLANCA,MARIA LUZ ENIRE MINA OBANDO,PARTIDO ALIANZA SOCIAL INDEPENDIENTE - ASI,65106
Concejo,SANTANDER,FLORIDABLANCA,MARIO JAVIER MANTILLA TORRES,PARTIDO COLOMBIA RENACIENTE,64976
Concejo,SANTANDER,FLORIDABLANCA,MARISELA  MUÑOZ TRIANA,PARTIDO SOCIAL DE UNIDAD NACIONAL PARTIDO DE LA U,65119
Concejo,SANTANDER,FLORIDABLANCA,MARITZA  ALGARIN PIEDRAHITA,COMUNALES POR FLORIDABLANCA,65168
Concejo,SANTANDER,FLORIDABLANCA,MARLENE  RINCON PRADA,PARTIDO SOCIAL DE UNIDAD NACIONAL PARTIDO DE LA U,65123
Concejo,SANTANDER,FLORIDABLANCA,MARLITT GINETH JIMENEZ TAVERA,PARTIDO LIBERAL COLOMBIANO,64906
Concejo,SANTANDER,FLORIDABLANCA,MARLON ALFREDO CASTRO PAMPLONA,PARTIDO CAMBIO RADICAL,65048
Concejo,SANTANDER,FLORIDABLANCA,MARLON JAIR ROMERO JEREZ,PARTIDO ADA,64985
Concejo,SANTANDER,FLORIDABLANCA,MARTHA LUCIA PINZON ESTEBAN,PARTIDO ALIANZA VERDE,65063
Concejo,SANTANDER,FLORIDABLANCA,MARTIN  CONTRERAS LOPEZ,PARTIDO CENTRO DEMOCRATICO,64921
Concejo,SANTANDER,FLORIDABLANCA,MARTIN  DUARTE PEREIRA,SIN CAMPO NO HAY CIUDAD,65187
Concejo,SANTANDER,FLORIDABLANCA,MARY LUZ LOPEZ MANTILLA,MOVIMIENTO AUTORIDADES INDIGENAS DE COLOMBIA - AICO,65085
Concejo,SANTANDER,FLORIDABLANCA,MATEO  ROJAS GUTIERREZ,PARTIDO DE REIVINDICACIÓN ÉTNICA -PRE-,65003
Concejo,SANTANDER,FLORIDABLANCA,MAURICIO  SOLANO GARCIA,PARTIDO SOCIAL DE UNIDAD NACIONAL PARTIDO DE LA U,65115
Concejo,SANTANDER,FLORIDABLANCA,MAYRA ALEJANDRA PICO RICO,SIN CAMPO NO HAY CIUDAD,65194
Concejo,SANTANDER,FLORIDABLANCA,MERMUI ISUI PEREZ RUEDA,PARTIDO ALIANZA SOCIAL INDEPENDIENTE - ASI,117938
Concejo,SANTANDER,FLORIDABLANCA,MIGUEL MAURICIO SARMIENTO DURAN,MOVIMIENTO AUTORIDADES INDIGENAS DE COLOMBIA - AICO,65072
Concejo,SANTANDER,FLORIDABLANCA,MILADY  TOVAR CABARIQUE,LIGA DE GOBERNANTES ANTICORRUPCION,65148
Concejo,SANTANDER,FLORIDABLANCA,MOISES  MOYANO CORREDOR,PARTIDO DE REIVINDICACIÓN ÉTNICA -PRE-,65008
Concejo,SANTANDER,FLORIDABLANCA,MONICA ANDREA BAUTISTA RODRIGUEZ,PARTIDO SOCIAL DE UNIDAD NACIONAL PARTIDO DE LA U,65116
Concejo,SANTANDER,FLORIDABLANCA,NANCY ROCIO RIVERO SANCHEZ,MOVIMIENTO ALTERNATIVO INDIGENA Y SOCIAL - MAIS,64946
Concejo,SANTANDER,FLORIDABLANCA,NAYIB  PEÑA VEGA,MOVIMIENTO ALTERNATIVO INDIGENA Y SOCIAL - MAIS,64943
Concejo,SANTANDER,FLORIDABLANCA,NEIRA GLADYS ROSERO NIÑO,LIGA DE GOBERNANTES ANTICORRUPCION,65162
Concejo,SANTANDER,FLORIDABLANCA,NESTOR ALEXANDER BOHORQUEZ MEZA,PARTIDO CONSERVADOR COLOMBIANO,65017
Concejo,SANTANDER,FLORIDABLANCA,NESTOR FERNANDO PARRA ACEROS,MOVIMIENTO ALTERNATIVO INDIGENA Y SOCIAL - MAIS,64935
Concejo,SANTANDER,FLORIDABLANCA,NICOL DAYANNA NARANJO BARAJAS,PARTIDO LIBERAL COLOMBIANO,64911
Concejo,SANTANDER,FLORIDABLANCA,NORLEYVE  FRANCO AYALA,PARTIDO CONSERVADOR COLOMBIANO,65023
Concejo,SANTANDER,FLORIDABLANCA,NUBIA  PRADO ARIZA,COMUNALES POR FLORIDABLANCA,65165
Concejo,SANTANDER,FLORIDABLANCA,OLGA JIMENA MATERON PRADA,PARTIDO POLO DEMOCRATICO ALTERNATIVO,65136
Concejo,SANTANDER,FLORIDABLANCA,OLIVER HERNANDO LOPEZ AMADO,LIGA DE GOBERNANTES ANTICORRUPCION,65155
Concejo,SANTANDER,FLORIDABLANCA,OMAR  GONZALEZ MARTINEZ,COMUNALES POR FLORIDABLANCA,65175
Concejo,SANTANDER,FLORIDABLANCA,OMAR  HERNANDEZ HERNANDEZ,PARTIDO COLOMBIA RENACIENTE,64971
Concejo,SANTANDER,FLORIDABLANCA,OMAR  MANRIQUE SUAREZ,MOVIMIENTO AUTORIDADES INDIGENAS DE COLOMBIA - AICO,65086
Concejo,SANTANDER,FLORIDABLANCA,OMAR  SALAMANCA MORENO,PARTIDO CONSERVADOR COLOMBIANO,65021
Concejo,SANTANDER,FLORIDABLANCA,OMAR EUCLIDES RUEDA DIAZ,PARTIDO ALIANZA VERDE,65054
Concejo,SANTANDER,FLORIDABLANCA,ORLANDO  LANDAZABAL GELVEZ,SIN CAMPO NO HAY CIUDAD,65185
Concejo,SANTANDER,FLORIDABLANCA,ORLANDO  PINEDA PEÑA,COMUNALES POR FLORIDABLANCA,65167
Concejo,SANTANDER,FLORIDABLANCA,OSCAR FABIAN CORREA MORENO,PARTIDO ALIANZA SOCIAL INDEPENDIENTE - ASI,65098
Concejo,SANTANDER,FLORIDABLANCA,OSCAR FELIPE OLAVE QUINTERO,MOVIMIENTO AUTORIDADES INDIGENAS DE COLOMBIA - AICO,65082
Concejo,SANTANDER,FLORIDABLANCA,OSCAR JAVIER RODRIGUEZ AMAYA,PARTIDO COLOMBIA RENACIENTE,64963
Concejo,SANTANDER,FLORIDABLANCA,OSCAR LEONARDO ROMERO MANRIQUE,PARTIDO SOCIAL DE UNIDAD NACIONAL PARTIDO DE LA U,65124
Concejo,SANTANDER,FLORIDABLANCA,PABLO ANDRES PINEDA CAPACHO,PARTIDO ALIANZA VERDE,65053
Concejo,SANTANDER,FLORIDABLANCA,PABLO ANTONIO DIAZ BECERRA,COMUNALES POR FLORIDABLANCA,65169
Concejo,SANTANDER,FLORIDABLANCA,PAOLA CAMILA URIBE VALBUENA,PARTIDO COLOMBIA JUSTA LIBRES,64956
Concejo,SANTANDER,FLORIDABLANCA,PEDRO ALONSO GALVIS PINILLA,PARTIDO SOCIAL DE UNIDAD NACIONAL PARTIDO DE LA U,65117
Concejo,SANTANDER,FLORIDABLANCA,PEDRO BERNARD SARQUES PLATA,PARTIDO ALIANZA VERDE,65069
Concejo,SANTANDER,FLORIDABLANCA,POLICARPA  ROJAS ,MOVIMIENTO ALTERNATIVO INDIGENA Y SOCIAL - MAIS,64944
Concejo,SANTANDER,FLORIDABLANCA,RAFAEL LEE ROMERO BARRIOS,PARTIDO CENTRO DEMOCRATICO,64932
Concejo,SANTANDER,FLORIDABLANCA,RAUL  BELTRAN BADILLO,PARTIDO ALIANZA VERDE,65070
Concejo,SANTANDER,FLORIDABLANCA,RAUL  SUAREZ QUINTERO,MOVIMIENTO AUTORIDADES INDIGENAS DE COLOMBIA - AICO,65071
Concejo,SANTANDER,FLORIDABLANCA,REINALDO  RIAÑO PEDRAZA,PARTIDO POLO DEMOCRATICO ALTERNATIVO,65145
Concejo,SANTANDER,FLORIDABLANCA,RICARDO  ARIAS CALDERON,PARTIDO ALIANZA VERDE,65067
