corp,dpto,mpio,name,party,wp_no
Concejo,ANTIOQUIA,YONDO CASABE,ALBA LILIA RIAÑO PARRA,PARTIDO CENTRO DEMOCRATICO,17479
Concejo,ANTIOQUIA,YONDO CASABE,ALBERTO  FLOREZ BALLESTEROS,PARTIDO COLOMBIA JUSTA LIBRES,17493
Concejo,ANTIOQUIA,YONDO CASABE,ALEX HERNAN MUÑOZ SANCHEZ,MOVIMIENTO AUTORIDADES INDIGENAS DE COLOMBIA - AICO,17563
Concejo,ANTIOQUIA,YONDO CASABE,ALFONSO  CASTELLANOS CASTAÑO,PARTIDO DE REIVINDICACIÓN ÉTNICA -PRE-,17521
Concejo,ANTIOQUIA,YONDO CASABE,ALICIA DE JESUS ARDILA DE DUARTE,PROGRESO PARA YONDO,17588
Concejo,ANTIOQUIA,YONDO CASABE,ALVARO JAVIER ACONCHA NIETO,PARTIDO CAMBIO RADICAL,17541
Concejo,ANTIOQUIA,YONDO CASABE,ANA MERCEDES ESTRADA DIAZ,PARTIDO CONSERVADOR COLOMBIANO,17529
Concejo,ANTIOQUIA,YONDO CASABE,ANTONIO JOSE BAQUERO NISPERUZA,PARTIDO CENTRO DEMOCRATICO,17478
Concejo,ANTIOQUIA,YONDO CASABE,ARNULFO  RODRIGUEZ JIMENEZ,PARTIDO LIBERAL COLOMBIANO,17471
Concejo,ANTIOQUIA,YONDO CASABE,AVILIO  HERNANDEZ HERNANDEZ,PARTIDO SOCIAL DE UNIDAD NACIONAL PARTIDO DE LA U,17584
Concejo,ANTIOQUIA,YONDO CASABE,BEATRIZ ELENA ATENCIA VALDERRAMA,PARTIDO ADA,17514
Concejo,ANTIOQUIA,YONDO CASABE,BENIS ALBERTO MENDEZ PALENCIA,PARTIDO COLOMBIA RENACIENTE,17502
Concejo,ANTIOQUIA,YONDO CASABE,BRAYAN ALBERTO RODRIGUEZ MOSQUERA,MOVIMIENTO ALTERNATIVO INDIGENA Y SOCIAL - MAIS,17490
Concejo,ANTIOQUIA,YONDO CASABE,BRYAM ROBERTO MENDEZ QUIÑONES,MOVIMIENTO ALTERNATIVO INDIGENA Y SOCIAL - MAIS,17491
Concejo,ANTIOQUIA,YONDO CASABE,CECILIA  CHACON JAIMES,PARTIDO DE REIVINDICACIÓN ÉTNICA -PRE-,17519
Concejo,ANTIOQUIA,YONDO CASABE,CLAUDIA PATRICIA ARRIETA TRILLOS,PARTIDO ALIANZA SOCIAL INDEPENDIENTE - ASI,17570
Concejo,ANTIOQUIA,YONDO CASABE,CLAUDIA PATRICIA MEDINA MOREIRA,PARTIDO COLOMBIA RENACIENTE,17501
Concejo,ANTIOQUIA,YONDO CASABE,CLAUDIA SHAKIRA RUBIANO MENDIETA,PARTIDO ALIANZA VERDE,17551
Concejo,ANTIOQUIA,YONDO CASABE,CRISTIAN CAMILO MESA GUERRA,MOVIMIENTO ALTERNATIVO INDIGENA Y SOCIAL - MAIS,17489
Concejo,ANTIOQUIA,YONDO CASABE,DARIO ANTONIO JIMENEZ RIOS,MOVIMIENTO AUTORIDADES INDIGENAS DE COLOMBIA - AICO,17558
Concejo,ANTIOQUIA,YONDO CASABE,DAWINZON JHOSET MOLINA CABUEÑAS,MOVIMIENTO ALTERNATIVO INDIGENA Y SOCIAL - MAIS,17487
Concejo,ANTIOQUIA,YONDO CASABE,DIANA YASMIN GUZMAN GOMEZ,PARTIDO CENTRO DEMOCRATICO,17481
Concejo,ANTIOQUIA,YONDO CASABE,DORA JANETH ARENAS HERRERA,PARTIDO SOCIAL DE UNIDAD NACIONAL PARTIDO DE LA U,17580
Concejo,ANTIOQUIA,YONDO CASABE,DOVIER  OSORIO MARTINEZ,PARTIDO ALIANZA VERDE,17548
Concejo,ANTIOQUIA,YONDO CASABE,EDGAR ENRIQUE MORALES JIMENEZ,PARTIDO ADA,17512
Concejo,ANTIOQUIA,YONDO CASABE,EDINSON JOSE GUZMAN OSORIO,PARTIDO ALIANZA VERDE,17552
Concejo,ANTIOQUIA,YONDO CASABE,EDUARDO ANTONIO MELGAREJO MERCADO,PARTIDO ALIANZA VERDE,17550
Concejo,ANTIOQUIA,YONDO CASABE,ELEUTERIO  LERMA DIAZ,PARTIDO SOCIAL DE UNIDAD NACIONAL PARTIDO DE LA U,17576
Concejo,ANTIOQUIA,YONDO CASABE,ELISEO  BARRAGAN ,PARTIDO COLOMBIA RENACIENTE,17498
Concejo,ANTIOQUIA,YONDO CASABE,ELIZABETH  RINCON DOMINGUEZ,PARTIDO LIBERAL COLOMBIANO,17470
Concejo,ANTIOQUIA,YONDO CASABE,EMILCE  VARGAS RAMIREZ,PARTIDO COLOMBIA RENACIENTE,17505
Concejo,ANTIOQUIA,YONDO CASABE,EVER  DIAZ GALVIS,PARTIDO CONSERVADOR COLOMBIANO,17534
Concejo,ANTIOQUIA,YONDO CASABE,FATIMA  MARTINEZ MEJIA,PARTIDO COLOMBIA JUSTA LIBRES,17495
Concejo,ANTIOQUIA,YONDO CASABE,FIDELINA NORAYMA DUQUE ROBLES,PARTIDO COLOMBIA RENACIENTE,17496
Concejo,ANTIOQUIA,YONDO CASABE,FRINETH  PAEZ MACEA,PARTIDO ADA,17509
Concejo,ANTIOQUIA,YONDO CASABE,GLORIA MARIA DUARTES ESCOBAR,PARTIDO SOCIAL DE UNIDAD NACIONAL PARTIDO DE LA U,17582
Concejo,ANTIOQUIA,YONDO CASABE,HECTOR ENRIQUE GARCIA ,MOVIMIENTO AUTORIDADES INDIGENAS DE COLOMBIA - AICO,17565
Concejo,ANTIOQUIA,YONDO CASABE,HECTOR ENRIQUE TORRADO BANDERA,PARTIDO LIBERAL COLOMBIANO,17472
Concejo,ANTIOQUIA,YONDO CASABE,HENRY  JIMENEZ ,PARTIDO CENTRO DEMOCRATICO,17485
Concejo,ANTIOQUIA,YONDO CASABE,HIDALDO RAFAEL ZABALA ACUÑA,PARTIDO CAMBIO RADICAL,17538
Concejo,ANTIOQUIA,YONDO CASABE,ILDA MARIA ROJAS RODRIGUEZ,PARTIDO COLOMBIA RENACIENTE,17506
Concejo,ANTIOQUIA,YONDO CASABE,ISAIAS  CABARIQUE MORALES,PARTIDO ALIANZA VERDE,17549
Concejo,ANTIOQUIA,YONDO CASABE,IVAN ARAMIS MARTINEZ ARRIETA,PARTIDO LIBERAL COLOMBIANO,17473
Concejo,ANTIOQUIA,YONDO CASABE,IVAN DARIO FLOREZ ARROYO,PARTIDO DE REIVINDICACIÓN ÉTNICA -PRE-,17520
Concejo,ANTIOQUIA,YONDO CASABE,JAHIR LENIN MARTINEZ LOPEZ,PARTIDO ADA,17508
Concejo,ANTIOQUIA,YONDO CASABE,JAIBER  MORENO FANDIÑO,PARTIDO ALIANZA SOCIAL INDEPENDIENTE - ASI,17568
Concejo,ANTIOQUIA,YONDO CASABE,JAIR ENRIQUE LLOREDA CORDOBA,PARTIDO COLOMBIA RENACIENTE,17504
Concejo,ANTIOQUIA,YONDO CASABE,JAIRO ANTONIO CHIMA JIMENEZ,PARTIDO ALIANZA VERDE,17547
Concejo,ANTIOQUIA,YONDO CASABE,JANETH  MENA MARTINEZ,PARTIDO CENTRO DEMOCRATICO,17484
Concejo,ANTIOQUIA,YONDO CASABE,JAVIER ALONSO PEÑA TIBACUY,PARTIDO COLOMBIA RENACIENTE,17503
Concejo,ANTIOQUIA,YONDO CASABE,JENNIFER PAOLA PILONIETA MARIN,PARTIDO LIBERAL COLOMBIANO,17474
Concejo,ANTIOQUIA,YONDO CASABE,JESUS ALEXANDER VEGA MENESES,PARTIDO SOCIAL DE UNIDAD NACIONAL PARTIDO DE LA U,17577
Concejo,ANTIOQUIA,YONDO CASABE,JESUS ANDRES GARCIA RIOS,PARTIDO LIBERAL COLOMBIANO,17467
Concejo,ANTIOQUIA,YONDO CASABE,JHON FABIO REYES GALVIS,PARTIDO LIBERAL COLOMBIANO,17466
Concejo,ANTIOQUIA,YONDO CASABE,JHON FREDY CONTRERAS DIAZ,PARTIDO ALIANZA SOCIAL INDEPENDIENTE - ASI,17571
Concejo,ANTIOQUIA,YONDO CASABE,JHON FREDY DUQUE ALZATE,PARTIDO ADA,17515
Concejo,ANTIOQUIA,YONDO CASABE,JOSE ALIRIO GUERRERO MORENO,PARTIDO SOCIAL DE UNIDAD NACIONAL PARTIDO DE LA U,17583
Concejo,ANTIOQUIA,YONDO CASABE,JOSE ENRIQUE BADILLO PIÑERES,PARTIDO COLOMBIA JUSTA LIBRES,17494
Concejo,ANTIOQUIA,YONDO CASABE,JOSE LUIS JIMENEZ RIOS,PARTIDO SOCIAL DE UNIDAD NACIONAL PARTIDO DE LA U,17578
Concejo,ANTIOQUIA,YONDO CASABE,JOSE MIGUEL GUZMAN RIVERA,PARTIDO CENTRO DEMOCRATICO,17483
Concejo,ANTIOQUIA,YONDO CASABE,JOSE NIL CARDONA ,PARTIDO CAMBIO RADICAL,17540
Concejo,ANTIOQUIA,YONDO CASABE,JUAN CARLOS LEON PLATA,PARTIDO COLOMBIA RENACIENTE,17499
Concejo,ANTIOQUIA,YONDO CASABE,JULI ANDREA RIAÑO SARMIENTO,PARTIDO ADA,17516
Concejo,ANTIOQUIA,YONDO CASABE,KARINA  REYES VALBUENA,PARTIDO ALIANZA VERDE,17553
Concejo,ANTIOQUIA,YONDO CASABE,LEIDY JOHANA OROZCO INFANTE,PARTIDO ALIANZA VERDE,17554
Concejo,ANTIOQUIA,YONDO CASABE,LEYDYS JOHANA MUÑOZ CADAVID,PARTIDO LIBERAL COLOMBIANO,17475
Concejo,ANTIOQUIA,YONDO CASABE,LIBORIO  ORTEGA CANTILLO,PARTIDO SOCIAL DE UNIDAD NACIONAL PARTIDO DE LA U,17579
Concejo,ANTIOQUIA,YONDO CASABE,LIGIA MARCELA PAEZ ,PARTIDO ALIANZA SOCIAL INDEPENDIENTE - ASI,17572
Concejo,ANTIOQUIA,YONDO CASABE,LILI YURANY BRAN PARRA,PARTIDO CONSERVADOR COLOMBIANO,17531
Concejo,ANTIOQUIA,YONDO CASABE,LINEY LINELLYS SERPA VILLAMIL,PARTIDO ALIANZA VERDE,17556
Concejo,ANTIOQUIA,YONDO CASABE,LISETH PAOLA BETANCUR MIRANDA,PARTIDO DE REIVINDICACIÓN ÉTNICA -PRE-,17524
Concejo,ANTIOQUIA,YONDO CASABE,LUCY ELENA RODRIGUEZ ROJAS,PARTIDO CAMBIO RADICAL,17537
Concejo,ANTIOQUIA,YONDO CASABE,LUIS ALBERTO ATENCIA SALCEDO,MOVIMIENTO AUTORIDADES INDIGENAS DE COLOMBIA - AICO,17562
Concejo,ANTIOQUIA,YONDO CASABE,LUIS ALBERTO RODRIGUEZ CASTRO,MOVIMIENTO AUTORIDADES INDIGENAS DE COLOMBIA - AICO,17564
Concejo,ANTIOQUIA,YONDO CASABE,LUIS ANGEL SUAREZ NIETO,PARTIDO ALIANZA SOCIAL INDEPENDIENTE - ASI,17573
Concejo,ANTIOQUIA,YONDO CASABE,LUIS ARMANDO ESPITIA HERNANDEZ,PARTIDO CONSERVADOR COLOMBIANO,17530
Concejo,ANTIOQUIA,YONDO CASABE,LUIS ERNESTO CUEVAS GOYENECHE,PARTIDO ADA,17511
Concejo,ANTIOQUIA,YONDO CASABE,LUISA FERNANDA NAVARRO MORATTO,PARTIDO ADA,17510
Concejo,ANTIOQUIA,YONDO CASABE,LUZ AMPARO GALVIS CARDENAS,PARTIDO DE REIVINDICACIÓN ÉTNICA -PRE-,17523
Concejo,ANTIOQUIA,YONDO CASABE,LUZ DALVIS SEIJA CARPIO,PARTIDO ALIANZA SOCIAL INDEPENDIENTE - ASI,17575
Concejo,ANTIOQUIA,YONDO CASABE,LUZ STELLA RINCON LONDOÑO,PARTIDO DE REIVINDICACIÓN ÉTNICA -PRE-,17526
Concejo,ANTIOQUIA,YONDO CASABE,MANUEL JACINTO HERAZO MEZA,PARTIDO SOCIAL DE UNIDAD NACIONAL PARTIDO DE LA U,17581
Concejo,ANTIOQUIA,YONDO CASABE,MARCELINO  MACHACADO VANEGAS,MOVIMIENTO AUTORIDADES INDIGENAS DE COLOMBIA - AICO,17561
Concejo,ANTIOQUIA,YONDO CASABE,MARIA INES MORALES HERNANDEZ,MOVIMIENTO ALTERNATIVO INDIGENA Y SOCIAL - MAIS,17488
Concejo,ANTIOQUIA,YONDO CASABE,MARIA TATIANA NIETO OSPINA,PARTIDO ALIANZA VERDE,17557
Concejo,ANTIOQUIA,YONDO CASABE,MARTHA LUCIA ROJAS ,MOVIMIENTO AUTORIDADES INDIGENAS DE COLOMBIA - AICO,17560
Concejo,ANTIOQUIA,YONDO CASABE,MARTHA RUTH SEGURA URIBE,PARTIDO CAMBIO RADICAL,17542
Concejo,ANTIOQUIA,YONDO CASABE,MELANY ANDREA HERNANDEZ PERDOMO,PARTIDO SOCIAL DE UNIDAD NACIONAL PARTIDO DE LA U,17585
Concejo,ANTIOQUIA,YONDO CASABE,MERCEDES LUCIA PEÑA CANO,MOVIMIENTO ALTERNATIVO INDIGENA Y SOCIAL - MAIS,17492
Concejo,ANTIOQUIA,YONDO CASABE,MERIS ALEJANDRA GALVIS PEÑA,PARTIDO CAMBIO RADICAL,17539
Concejo,ANTIOQUIA,YONDO CASABE,MIGUEL  CIFUENTES ARDILA,PROGRESO PARA YONDO,17586
Concejo,ANTIOQUIA,YONDO CASABE,NANCY  RIOS CHACON,PARTIDO CAMBIO RADICAL,17543
Concejo,ANTIOQUIA,YONDO CASABE,NELSON  ANTOLINEZ AGUDELO,PARTIDO CAMBIO RADICAL,17546
Concejo,ANTIOQUIA,YONDO CASABE,NORA LICETH GALLEGO PULGARIN,PARTIDO ALIANZA VERDE,17555
Concejo,ANTIOQUIA,YONDO CASABE,NULIALBA  ZAPATA GRANADA,PARTIDO COLOMBIA RENACIENTE,17497
Concejo,ANTIOQUIA,YONDO CASABE,OLGA LUCIA MENCO CORDERO,MOVIMIENTO AUTORIDADES INDIGENAS DE COLOMBIA - AICO,17566
Concejo,ANTIOQUIA,YONDO CASABE,OSCAR ALFREDO BOHORQUEZ CENTENO,PARTIDO ADA,17513
Concejo,ANTIOQUIA,YONDO CASABE,OVIEDO  RIVERA LOPEZ,PARTIDO CENTRO DEMOCRATICO,17486
Concejo,ANTIOQUIA,YONDO CASABE,PEDRO ELIAS IBAÑEZ ROMERO,PARTIDO CENTRO DEMOCRATICO,17477
Concejo,ANTIOQUIA,YONDO CASABE,RAFAEL HERNAN OSPINO MARMOL,PARTIDO CONSERVADOR COLOMBIANO,17535
Concejo,ANTIOQUIA,YONDO CASABE,RAMON  GAÑAN HERRERA,PARTIDO LIBERAL COLOMBIANO,17469
Concejo,ANTIOQUIA,YONDO CASABE,RAUL ELIAS ALVAREZ SANTOS,PARTIDO CENTRO DEMOCRATICO,17480
Concejo,ANTIOQUIA,YONDO CASABE,REINEL  REYES ROMERO,MOVIMIENTO AUTORIDADES INDIGENAS DE COLOMBIA - AICO,17567
Concejo,ANTIOQUIA,YONDO CASABE,RICARDO ALBERTO ESTRADA GIRALDO,PARTIDO CENTRO DEMOCRATICO,17482
Concejo,ANTIOQUIA,YONDO CASABE,RODRIGO ANDRES ARRIETA CUADROS,PARTIDO DE REIVINDICACIÓN ÉTNICA -PRE-,17518
Concejo,ANTIOQUIA,YONDO CASABE,RODRIGO ARQUIVE HERRERA VELEZ,PARTIDO DE REIVINDICACIÓN ÉTNICA -PRE-,17522
Concejo,ANTIOQUIA,YONDO CASABE,ROIMER  FONSECA DIAZ,PARTIDO ADA,17507
Concejo,ANTIOQUIA,YONDO CASABE,ROSENDA MARIA ORTEGA CASTAÑEDA,PARTIDO CONSERVADOR COLOMBIANO,17532
Concejo,ANTIOQUIA,YONDO CASABE,RUSVEL ENRIQUE DURANGO HENAO,PARTIDO ALIANZA SOCIAL INDEPENDIENTE - ASI,17569
Concejo,ANTIOQUIA,YONDO CASABE,SANDRA MILENA ROMERO PAMPLONA,PARTIDO LIBERAL COLOMBIANO,17476
Concejo,ANTIOQUIA,YONDO CASABE,SAYUB ANTONIO BADILLO VILLEGAS,PROGRESO PARA YONDO,17587
Concejo,ANTIOQUIA,YONDO CASABE,SERAFIN  CRESPO PEÑA,PARTIDO ALIANZA SOCIAL INDEPENDIENTE - ASI,17574
Concejo,ANTIOQUIA,YONDO CASABE,SERGIO ANDRES CABARIQUE RODRIGUEZ,PARTIDO CONSERVADOR COLOMBIANO,17527
Concejo,ANTIOQUIA,YONDO CASABE,SERGIO ANDRES TORRES VANEGAS,PARTIDO DE REIVINDICACIÓN ÉTNICA -PRE-,17525
Concejo,ANTIOQUIA,YONDO CASABE,SILFREDO ANTONIO CARDENAS VILLEGAS,PARTIDO COLOMBIA RENACIENTE,17500
Concejo,ANTIOQUIA,YONDO CASABE,SULIS PATRICIA GOMEZ PEDROZO,PARTIDO ADA,17517
Concejo,ANTIOQUIA,YONDO CASABE,TEOBALDO  MARTINEZ GUZMAN,PARTIDO CONSERVADOR COLOMBIANO,17533
Concejo,ANTIOQUIA,YONDO CASABE,URBANO JOSE VILLA RAMIREZ,PARTIDO CAMBIO RADICAL,17545
Concejo,ANTIOQUIA,YONDO CASABE,WILMAN  GAMARRA AGUILAR,PARTIDO LIBERAL COLOMBIANO,17468
Concejo,ANTIOQUIA,YONDO CASABE,WILMAR  SIMANCA GUERRERO,PARTIDO CAMBIO RADICAL,17536
Concejo,ANTIOQUIA,YONDO CASABE,WLADIMIR  SANABRIA ,PARTIDO CONSERVADOR COLOMBIANO,17528
Concejo,ANTIOQUIA,YONDO CASABE,YASMIN  ALVEAR CAMARGO,MOVIMIENTO AUTORIDADES INDIGENAS DE COLOMBIA - AICO,17559
Concejo,ANTIOQUIA,YONDO CASABE,YOLANDA  SEJIA RODRIGUEZ,PARTIDO CAMBIO RADICAL,17544
