corp,dpto,mpio,name,party,wp_no
Concejo,MAGDALENA,CONCORDIA,ADALBERTO  MUÑOZ MUÑOZ,PARTIDO SOCIAL DE UNIDAD NACIONAL PARTIDO DE LA U,46590
Concejo,MAGDALENA,CONCORDIA,ALBERTO JOSE GOMEZ FERNANDEZ,PARTIDO CONSERVADOR COLOMBIANO,46572
Concejo,MAGDALENA,CONCORDIA,ALBERTO LUIS PEDROZA VILLA,COLOMBIA HUMANA - UNIÓN PATRIÓTICA,46553
Concejo,MAGDALENA,CONCORDIA,ALBERTO RAFAEL VILLA HERRERA,PARTIDO CONSERVADOR COLOMBIANO,46577
Concejo,MAGDALENA,CONCORDIA,ALFONSO ENRIQUE DE LA CRUZ MUÑOZ,PARTIDO CONSERVADOR COLOMBIANO,46575
Concejo,MAGDALENA,CONCORDIA,CARLOS MANUEL PADILLA MORENO,PARTIDO DE REIVINDICACIÓN ÉTNICA -PRE-,46565
Concejo,MAGDALENA,CONCORDIA,DAKAR JUNIOR SALAS AVENDAÑO,COLOMBIA HUMANA - UNIÓN PATRIÓTICA,46561
Concejo,MAGDALENA,CONCORDIA,DIANNY CAROLINA JIMENEZ ROJANO,PARTIDO SOCIAL DE UNIDAD NACIONAL PARTIDO DE LA U,46594
Concejo,MAGDALENA,CONCORDIA,DOLFI MANUEL ESCALANTE CONTRERAS,PARTIDO LIBERAL COLOMBIANO,46548
Concejo,MAGDALENA,CONCORDIA,EDINSON  OJEDA CASTAÑEDA,PARTIDO LIBERAL COLOMBIANO,46547
Concejo,MAGDALENA,CONCORDIA,EDWIN RAFAEL COLON ESCORCIA,PARTIDO CONSERVADOR COLOMBIANO,46576
Concejo,MAGDALENA,CONCORDIA,ELADIO  CAMACHO MEZA,PARTIDO CONSERVADOR COLOMBIANO,46574
Concejo,MAGDALENA,CONCORDIA,ELIANA ANGELICA FONTALVO JIMENEZ,PARTIDO CAMBIO RADICAL,46580
Concejo,MAGDALENA,CONCORDIA,EULALIO  DE LA HOZ MOVILLA,PARTIDO SOCIAL DE UNIDAD NACIONAL PARTIDO DE LA U,46596
Concejo,MAGDALENA,CONCORDIA,GABRIEL ANTONIO BARRIOS MARTINEZ,PARTIDO CONSERVADOR COLOMBIANO,46571
Concejo,MAGDALENA,CONCORDIA,HAROLD JOSE VILLA CASTRO,PARTIDO CAMBIO RADICAL,46584
Concejo,MAGDALENA,CONCORDIA,HEIDER JOSE RODRIGUEZ ORTEGA,COLOMBIA HUMANA - UNIÓN PATRIÓTICA,46560
Concejo,MAGDALENA,CONCORDIA,IVAN ELIAS CAMACHO TAMARA,COLOMBIA HUMANA - UNIÓN PATRIÓTICA,46557
Concejo,MAGDALENA,CONCORDIA,JERSSON JOSE OROZCO SALAS,COLOMBIA HUMANA - UNIÓN PATRIÓTICA,46555
Concejo,MAGDALENA,CONCORDIA,JHON FREDY VALENCIA CASTRO,COLOMBIA HUMANA - UNIÓN PATRIÓTICA,46562
Concejo,MAGDALENA,CONCORDIA,JOHANNECY ROCIO RANGEL FONSECA,PARTIDO DE REIVINDICACIÓN ÉTNICA -PRE-,46564
Concejo,MAGDALENA,CONCORDIA,JOSE REMIGIO MUÑOZ MUÑOZ,PARTIDO LIBERAL COLOMBIANO,46545
Concejo,MAGDALENA,CONCORDIA,JOSE SAMUEL SOTO OSPINO,PARTIDO CAMBIO RADICAL,46586
Concejo,MAGDALENA,CONCORDIA,JUAN ANGEL MUÑOZ MENDEZ,PARTIDO LIBERAL COLOMBIANO,46546
Concejo,MAGDALENA,CONCORDIA,LILIA  MARTINEZ RAVELO,COLOMBIA HUMANA - UNIÓN PATRIÓTICA,46554
Concejo,MAGDALENA,CONCORDIA,LILIANA ESTHER BARCINILLA POLO,PARTIDO LIBERAL COLOMBIANO,46552
Concejo,MAGDALENA,CONCORDIA,LIZ VANEZA TORREGROZA POLO,PARTIDO CAMBIO RADICAL,46581
Concejo,MAGDALENA,CONCORDIA,LUZ ELENA GONZALEZ CARRILLO,PARTIDO CONSERVADOR COLOMBIANO,46573
Concejo,MAGDALENA,CONCORDIA,LUZ MARINA ALVAREZ CABALLERO,PARTIDO CAMBIO RADICAL,46582
Concejo,MAGDALENA,CONCORDIA,MANUEL ANTONIO ALVAREZ DE LA HOZ,PARTIDO SOCIAL DE UNIDAD NACIONAL PARTIDO DE LA U,46593
Concejo,MAGDALENA,CONCORDIA,MARYSOLEIDIS  CASTRO ALVARINO,COLOMBIA HUMANA - UNIÓN PATRIÓTICA,46558
Concejo,MAGDALENA,CONCORDIA,MELIDA ISABEL VELEZ JIMENEZ,PARTIDO LIBERAL COLOMBIANO,46550
Concejo,MAGDALENA,CONCORDIA,MILTON ANTONIO PANTOJA BARRIOS,PARTIDO CAMBIO RADICAL,46588
Concejo,MAGDALENA,CONCORDIA,MISAEL JOSE DE AGUAS VASQUEZ,PARTIDO LIBERAL COLOMBIANO,46551
Concejo,MAGDALENA,CONCORDIA,OMERIS LUZ COLON MUÑOZ,PARTIDO DE REIVINDICACIÓN ÉTNICA -PRE-,46566
Concejo,MAGDALENA,CONCORDIA,OSCAR MANUEL DE LEON MUÑOZ,PARTIDO DE REIVINDICACIÓN ÉTNICA -PRE-,46563
Concejo,MAGDALENA,CONCORDIA,PEDRO RAFAEL BARRIOS BARRIOS,PARTIDO CAMBIO RADICAL,46583
Concejo,MAGDALENA,CONCORDIA,ROBINSON SAMUEL SALAS CARRILLO,PARTIDO DE REIVINDICACIÓN ÉTNICA -PRE-,46567
Concejo,MAGDALENA,CONCORDIA,ROIMER JOSE CASTRO RODRIGUEZ,COLOMBIA HUMANA - UNIÓN PATRIÓTICA,46556
Concejo,MAGDALENA,CONCORDIA,STHEFANYS PAOLA CAMPO SERRANO,PARTIDO CAMBIO RADICAL,46587
Concejo,MAGDALENA,CONCORDIA,TORIBIO RAFAEL DE AGUA MUÑOZ,PARTIDO DE REIVINDICACIÓN ÉTNICA -PRE-,46569
Concejo,MAGDALENA,CONCORDIA,VICTOR ALFONSO MUÑOZ COLON,PARTIDO CAMBIO RADICAL,46585
Concejo,MAGDALENA,CONCORDIA,VICTOR JOSE DIAZ HERNANDEZ,PARTIDO DE REIVINDICACIÓN ÉTNICA -PRE-,46570
Concejo,MAGDALENA,CONCORDIA,VIVIANA JUDITH RODRIGUEZ CERPA,PARTIDO CONSERVADOR COLOMBIANO,46579
Concejo,MAGDALENA,CONCORDIA,WENDY LORENA POLO SALAS,PARTIDO SOCIAL DE UNIDAD NACIONAL PARTIDO DE LA U,46589
Concejo,MAGDALENA,CONCORDIA,YAR FABIO SALAS POLO,PARTIDO SOCIAL DE UNIDAD NACIONAL PARTIDO DE LA U,46591
Concejo,MAGDALENA,CONCORDIA,YELEN YINELA OROZCO ARROYO,PARTIDO CONSERVADOR COLOMBIANO,46578
Concejo,MAGDALENA,CONCORDIA,YESICA MARIA FONTALVO ROJANO,PARTIDO SOCIAL DE UNIDAD NACIONAL PARTIDO DE LA U,46595
Concejo,MAGDALENA,CONCORDIA,YULIETH ROCIO VARON VILLA,PARTIDO SOCIAL DE UNIDAD NACIONAL PARTIDO DE LA U,46592
Concejo,MAGDALENA,CONCORDIA,YULIETH TATIANA COLON ROJANO,COLOMBIA HUMANA - UNIÓN PATRIÓTICA,46559
Concejo,MAGDALENA,CONCORDIA,YUNETH MARIA FLOREZ RAMOS,PARTIDO LIBERAL COLOMBIANO,46549
Concejo,MAGDALENA,CONCORDIA,ZUHEY DEL CARMEN SHILER SALAS,PARTIDO DE REIVINDICACIÓN ÉTNICA -PRE-,46568
