corp,dpto,mpio,name,party,wp_no
Concejo,AMAZONAS,LETICIA,ALEJANDRO CAMILO OLARTE MORA,PARTIDO ALIANZA SOCIAL INDEPENDIENTE - ASI,92938
Concejo,AMAZONAS,LETICIA,ALIRIO  TORRES MARTINEZ,PARTIDO POLO DEMOCRATICO ALTERNATIVO,92970
Concejo,AMAZONAS,LETICIA,ALVARO  MUÑOZ PINTO,PARTIDO POLITICO MIRA,92950
Concejo,AMAZONAS,LETICIA,ALVARO DE JESUS ALVAREZ OSORIO,PARTIDO CONSERVADOR COLOMBIANO,92905
Concejo,AMAZONAS,LETICIA,ANA GILDA ANGULO ALVES,PARTIDO POLO DEMOCRATICO ALTERNATIVO,92977
Concejo,AMAZONAS,LETICIA,ANGEL GUILLERMO PEREZ MOZOMBITE,PARTIDO CAMBIO RADICAL,92922
Concejo,AMAZONAS,LETICIA,ANGIE SMITH TAPAYURI PEÑA,PARTIDO CENTRO DEMOCRATICO,92862
Concejo,AMAZONAS,LETICIA,ANTONIO  BOLIVAR SALVADOR,PARTIDO LIBERAL COLOMBIANO,92845
Concejo,AMAZONAS,LETICIA,ANTONIO  ISIDIO BALLESILLA,PARTIDO CAMBIO RADICAL,92914
Concejo,AMAZONAS,LETICIA,ARCENIO  GARCIA NUÑEZ,PARTIDO SOCIAL DE UNIDAD NACIONAL PARTIDO DE LA U,92957
Concejo,AMAZONAS,LETICIA,BAUDILIO  ANDRES RAMOS,MOVIMIENTO ALTERNATIVO INDIGENA Y SOCIAL - MAIS,92874
Concejo,AMAZONAS,LETICIA,BERTHA  PINEDA BERNAL,PARTIDO COLOMBIA RENACIENTE,92890
Concejo,AMAZONAS,LETICIA,BLANCA NIEVES MURAYARI AMIAS,PARTIDO SOCIAL DE UNIDAD NACIONAL PARTIDO DE LA U,92958
Concejo,AMAZONAS,LETICIA,BRAYAN CAMILO SUAREZ CAMAYO,MOVIMIENTO ALTERNATIVO INDIGENA Y SOCIAL - MAIS,92880
Concejo,AMAZONAS,LETICIA,BRAYAN HERNAN HUANIRI CHUÑA,PARTIDO SOCIAL DE UNIDAD NACIONAL PARTIDO DE LA U,92965
Concejo,AMAZONAS,LETICIA,BRYAN AUGUSTO WILCHES SUAREZ,PARTIDO LIBERAL COLOMBIANO,92849
Concejo,AMAZONAS,LETICIA,CARLOS  BACA RIVERA,PARTIDO SOCIAL DE UNIDAD NACIONAL PARTIDO DE LA U,92959
Concejo,AMAZONAS,LETICIA,CARLOS EDUARDO GARNICA PEREZ,PARTIDO POLO DEMOCRATICO ALTERNATIVO,92974
Concejo,AMAZONAS,LETICIA,CARLOS EDUARDO GOEZ DE LOS RIOS,PARTIDO CONSERVADOR COLOMBIANO,92900
Concejo,AMAZONAS,LETICIA,CARMEN PATRICIA MAYO ,PARTIDO COLOMBIA JUSTA LIBRES,92885
Concejo,AMAZONAS,LETICIA,CELSO ALEXANDER FAJARDO ESPEJO,PARTIDO CONSERVADOR COLOMBIANO,92904
Concejo,AMAZONAS,LETICIA,CESAR EDUARDO BONILLA ,PARTIDO COLOMBIA RENACIENTE,92892
Concejo,AMAZONAS,LETICIA,CIELO IDIANI BAUTISTA VASQUEZ,PARTIDO CONSERVADOR COLOMBIANO,92903
Concejo,AMAZONAS,LETICIA,CINDY PRESSLEY HERNANDEZ GARCIA,PARTIDO COLOMBIA RENACIENTE,92897
Concejo,AMAZONAS,LETICIA,CIRO NEL RUIZ ,PARTIDO CENTRO DEMOCRATICO,92859
Concejo,AMAZONAS,LETICIA,CLAUDIA PATRICIA CHARPENTIER PEREZ,PARTIDO CAMBIO RADICAL,92923
Concejo,AMAZONAS,LETICIA,DIANA  VARGAS ,PARTIDO CAMBIO RADICAL,92921
Concejo,AMAZONAS,LETICIA,DIANIRA  AREVALO ASPAJO,PARTIDO CONSERVADOR COLOMBIANO,92908
Concejo,AMAZONAS,LETICIA,DICKSON  OLIVEROS IRIARTE,PARTIDO LIBERAL COLOMBIANO,92847
Concejo,AMAZONAS,LETICIA,EDGAR ALFONSO DONCEL GARZON,PARTIDO ALIANZA SOCIAL INDEPENDIENTE - ASI,92944
Concejo,AMAZONAS,LETICIA,EDGAR GUILLERMO JORDAN PEREZ,PARTIDO CONSERVADOR COLOMBIANO,92907
Concejo,AMAZONAS,LETICIA,EDITH  SOTO CHOTA,PARTIDO SOCIAL DE UNIDAD NACIONAL PARTIDO DE LA U,92961
Concejo,AMAZONAS,LETICIA,EDUARDO  YARA SALAS,PARTIDO COLOMBIA RENACIENTE,92891
Concejo,AMAZONAS,LETICIA,EDUARDO HIDLEY PACHECO NUÑEZ,PARTIDO COLOMBIA JUSTA LIBRES,92882
Concejo,AMAZONAS,LETICIA,EKLIN  PEREZ ALMEIDA,PARTIDO POLO DEMOCRATICO ALTERNATIVO,92975
Concejo,AMAZONAS,LETICIA,ELIUD  LEIVA PEREA,PARTIDO ALIANZA SOCIAL INDEPENDIENTE - ASI,92947
Concejo,AMAZONAS,LETICIA,EMA  MESIAS ,PARTIDO ALIANZA VERDE,92927
Concejo,AMAZONAS,LETICIA,ENECIO MARTIN DIONISIO RAMOS,MOVIMIENTO ALTERNATIVO INDIGENA Y SOCIAL - MAIS,92875
Concejo,AMAZONAS,LETICIA,ENRIQUE  AHUANARI HUAINACARI,PARTIDO CENTRO DEMOCRATICO,92867
Concejo,AMAZONAS,LETICIA,FABIO ENRIQUE PARRA PINTO,PARTIDO ALIANZA SOCIAL INDEPENDIENTE - ASI,92939
Concejo,AMAZONAS,LETICIA,FERNANDO  PANDURO MORALES,MOVIMIENTO ALTERNATIVO INDIGENA Y SOCIAL - MAIS,92879
Concejo,AMAZONAS,LETICIA,FIDEL  PAREDES SOLIS,PARTIDO POLO DEMOCRATICO ALTERNATIVO,92972
Concejo,AMAZONAS,LETICIA,FLAVIO  CURICO ARCANGEL,PARTIDO CENTRO DEMOCRATICO,92856
Concejo,AMAZONAS,LETICIA,FLOR  ROA BONILLA,PARTIDO POLITICO MIRA,92952
Concejo,AMAZONAS,LETICIA,FRANCISCO  SALAS VILLAR,PARTIDO CENTRO DEMOCRATICO,92861
Concejo,AMAZONAS,LETICIA,FRANKY LUIS CARBALLO BARRETO,PARTIDO ALIANZA SOCIAL INDEPENDIENTE - ASI,92942
Concejo,AMAZONAS,LETICIA,GEENNA ALEJANDRINA RIOS GARZON,PARTIDO CENTRO DEMOCRATICO,92865
Concejo,AMAZONAS,LETICIA,GELMO  PEÑA PEREZ,PARTIDO ALIANZA SOCIAL INDEPENDIENTE - ASI,92949
Concejo,AMAZONAS,LETICIA,GLORIA INES BAUZ GONZALEZ,PARTIDO CAMBIO RADICAL,92918
Concejo,AMAZONAS,LETICIA,GLORIA JANETH AHUANARI MARAPARA,MOVIMIENTO ALTERNATIVO INDIGENA Y SOCIAL - MAIS,92869
Concejo,AMAZONAS,LETICIA,GLORIA LUZ RENDON CASTRO,PARTIDO CAMBIO RADICAL,92912
Concejo,AMAZONAS,LETICIA,HECTOR ALEJANDRO DONCEL PINTO,PARTIDO ALIANZA VERDE,92934
Concejo,AMAZONAS,LETICIA,HEDILBERTO  CABEZAS GUEVARA,PARTIDO ALIANZA VERDE,92926
Concejo,AMAZONAS,LETICIA,HENRY  BARBOSA ALVES,PARTIDO ALIANZA SOCIAL INDEPENDIENTE - ASI,92940
Concejo,AMAZONAS,LETICIA,HENRY  NEGEDEKA GIFICHIU,PARTIDO ALIANZA VERDE,92935
Concejo,AMAZONAS,LETICIA,HENRY SEGUNDO MORENO SARMIENTO,PARTIDO CAMBIO RADICAL,92917
Concejo,AMAZONAS,LETICIA,HERNANDO  HUANIRI CHUÑA,PARTIDO COLOMBIA RENACIENTE,92893
Concejo,AMAZONAS,LETICIA,HOMERO DE JESUS BENJUMEA CACHIQUE,PARTIDO ALIANZA VERDE,92925
Concejo,AMAZONAS,LETICIA,IDELFONSO RAMON GONZALEZ PATERNINA,PARTIDO SOCIAL DE UNIDAD NACIONAL PARTIDO DE LA U,92956
Concejo,AMAZONAS,LETICIA,IGOR LINKIN RAMOS GOMEZ,PARTIDO SOCIAL DE UNIDAD NACIONAL PARTIDO DE LA U,92960
Concejo,AMAZONAS,LETICIA,IVAN ANTONIO ARROYO CARABALLO,PARTIDO CONSERVADOR COLOMBIANO,92901
Concejo,AMAZONAS,LETICIA,JAIME  GOMEZ CRUZ,PARTIDO CENTRO DEMOCRATICO,92868
Concejo,AMAZONAS,LETICIA,JAIME ENRIQUE MORANO CUERO,PARTIDO CENTRO DEMOCRATICO,92863
Concejo,AMAZONAS,LETICIA,JAIR ELIAS CORDERO CATACHUNGA,MOVIMIENTO ALTERNATIVO INDIGENA Y SOCIAL - MAIS,92870
Concejo,AMAZONAS,LETICIA,JEFERSON  PIZAN ARAUJO,PARTIDO CONSERVADOR COLOMBIANO,92902
Concejo,AMAZONAS,LETICIA,JEISSON ANDRES LASSO BAUTISTA,PARTIDO COLOMBIA RENACIENTE,92887
Concejo,AMAZONAS,LETICIA,JESUS  GREGORIO JOAQUIN,MOVIMIENTO ALTERNATIVO INDIGENA Y SOCIAL - MAIS,92878
Concejo,AMAZONAS,LETICIA,JHAN CARLOS PRADO BERMUDEZ,MOVIMIENTO ALTERNATIVO INDIGENA Y SOCIAL - MAIS,92872
Concejo,AMAZONAS,LETICIA,JHON ARVEY MARTINEZ ALMEIDA,PARTIDO ALIANZA SOCIAL INDEPENDIENTE - ASI,92937
Concejo,AMAZONAS,LETICIA,JORGE ELI MEJIA LEIVA,PARTIDO CONSERVADOR COLOMBIANO,92906
Concejo,AMAZONAS,LETICIA,JORGE JHONNY ASAYAC ARCENTALES,PARTIDO CAMBIO RADICAL,92915
Concejo,AMAZONAS,LETICIA,JOSE  MONTENEGRO FERREIRA,PARTIDO LIBERAL COLOMBIANO,92844
Concejo,AMAZONAS,LETICIA,JOSE ALBERTO DUQUE LOPEZ,PARTIDO COLOMBIA RENACIENTE,92895
Concejo,AMAZONAS,LETICIA,JOSE JAVIER NAVARRO PINTO,MOVIMIENTO ALTERNATIVO INDIGENA Y SOCIAL - MAIS,92877
Concejo,AMAZONAS,LETICIA,JOSE RODRIGO GAMBA MORENO,PARTIDO LIBERAL COLOMBIANO,92843
Concejo,AMAZONAS,LETICIA,JUAN  VERA ACUÑA,PARTIDO ALIANZA VERDE,92936
Concejo,AMAZONAS,LETICIA,JUAN CARLOS MARTINEZ MORENO,PARTIDO POLO DEMOCRATICO ALTERNATIVO,92973
Concejo,AMAZONAS,LETICIA,LEDER ESTALIN PINEDA DE LOS ANGELES,PARTIDO ALIANZA VERDE,92924
Concejo,AMAZONAS,LETICIA,LEONARDO GIOVANNI VARGAS SANCHEZ,PARTIDO ALIANZA VERDE,92933
Concejo,AMAZONAS,LETICIA,LILIANA PILAR LOZANO WIHILER,PARTIDO POLO DEMOCRATICO ALTERNATIVO,92969
Concejo,AMAZONAS,LETICIA,LUGI FERNANDO CARDONA SIAS,PARTIDO COLOMBIA JUSTA LIBRES,92884
Concejo,AMAZONAS,LETICIA,LUIS AURELIO FALCON PEREZ,PARTIDO SOCIAL DE UNIDAD NACIONAL PARTIDO DE LA U,92963
Concejo,AMAZONAS,LETICIA,LUIS CAMILO PUENTES PETRO,PARTIDO LIBERAL COLOMBIANO,92850
Concejo,AMAZONAS,LETICIA,LUIS EVELIO CABEZAS TAPUYIMA,PARTIDO LIBERAL COLOMBIANO,92855
Concejo,AMAZONAS,LETICIA,LUISA EDITH ORDOÑEZ CARBALHO,PARTIDO POLO DEMOCRATICO ALTERNATIVO,92968
Concejo,AMAZONAS,LETICIA,MABEL CECILIA CASAS GONZALEZ,PARTIDO ALIANZA SOCIAL INDEPENDIENTE - ASI,92948
Concejo,AMAZONAS,LETICIA,MADELEINE  BENJUMEA VARGAS,PARTIDO COLOMBIA JUSTA LIBRES,92883
Concejo,AMAZONAS,LETICIA,MAGALI  MOZOMBITE SANGAMA,PARTIDO COLOMBIA RENACIENTE,92894
Concejo,AMAZONAS,LETICIA,MAIRA  DUQUE PINTO,MOVIMIENTO ALTERNATIVO INDIGENA Y SOCIAL - MAIS,92871
Concejo,AMAZONAS,LETICIA,MARCO AURELIO URIBE RAMOS,PARTIDO LIBERAL COLOMBIANO,92851
Concejo,AMAZONAS,LETICIA,MARIA DE JESUS OROZCO REATEGUI,PARTIDO POLO DEMOCRATICO ALTERNATIVO,92976
Concejo,AMAZONAS,LETICIA,MARIA DE LOURDES PANDURO RODRIGUEZ,PARTIDO LIBERAL COLOMBIANO,92848
Concejo,AMAZONAS,LETICIA,MARIA DEL CARMEN DA SILVA ,PARTIDO SOCIAL DE UNIDAD NACIONAL PARTIDO DE LA U,92966
Concejo,AMAZONAS,LETICIA,MARIA ELENA ROJAS MORALES,PARTIDO LIBERAL COLOMBIANO,92846
Concejo,AMAZONAS,LETICIA,MARIA ELENA ZAPATA AGUIRRE,PARTIDO ALIANZA SOCIAL INDEPENDIENTE - ASI,92946
Concejo,AMAZONAS,LETICIA,MARIA MERCEDES PASOS MIRAÑA,PARTIDO POLITICO MIRA,92953
Concejo,AMAZONAS,LETICIA,MARIA NELLY BECERRA CARVALHO,PARTIDO SOCIAL DE UNIDAD NACIONAL PARTIDO DE LA U,92954
Concejo,AMAZONAS,LETICIA,MARITZA  OROZCO PAIMA,PARTIDO CONSERVADOR COLOMBIANO,92899
Concejo,AMAZONAS,LETICIA,MARTHA EDITH CEBALLOS ,PARTIDO ALIANZA VERDE,92929
Concejo,AMAZONAS,LETICIA,MARY LUZ CARECA PARENTE,PARTIDO CENTRO DEMOCRATICO,92857
Concejo,AMAZONAS,LETICIA,MATIAS ALEXANDER SABOGAL CASTRO,PARTIDO ALIANZA VERDE,92930
Concejo,AMAZONAS,LETICIA,MAURICIO MARCEL RODRIGUEZ OLIVEROS,PARTIDO CONSERVADOR COLOMBIANO,92910
Concejo,AMAZONAS,LETICIA,MAYRA YURY PARRA GUACA,PARTIDO ALIANZA VERDE,92932
Concejo,AMAZONAS,LETICIA,MERY MAREÑA IPUCHIMA MARTINEZ,MOVIMIENTO ALTERNATIVO INDIGENA Y SOCIAL - MAIS,92876
Concejo,AMAZONAS,LETICIA,MIGUEL  AHUANARI HIPUCHIMA,PARTIDO POLO DEMOCRATICO ALTERNATIVO,92971
Concejo,AMAZONAS,LETICIA,MIGUEL  HUANIRI PEREIRA,PARTIDO LIBERAL COLOMBIANO,92853
Concejo,AMAZONAS,LETICIA,MIGUEL ANTONIO RODRIGUEZ HERNANDEZ,PARTIDO CONSERVADOR COLOMBIANO,92911
Concejo,AMAZONAS,LETICIA,MIRNA AMPARO DELGADO MERCADO,PARTIDO COLOMBIA RENACIENTE,92886
Concejo,AMAZONAS,LETICIA,MONICA  HENAO ARCE,PARTIDO CAMBIO RADICAL,92913
Concejo,AMAZONAS,LETICIA,NATIVIDAD  ROJAS PEÑA,PARTIDO ALIANZA SOCIAL INDEPENDIENTE - ASI,92941
Concejo,AMAZONAS,LETICIA,NEY CARLOS BENTO GONZALEZ,PARTIDO ALIANZA VERDE,92931
Concejo,AMAZONAS,LETICIA,NEYFE AMPARO CACHIQUE IRIARTE,PARTIDO CONSERVADOR COLOMBIANO,92909
Concejo,AMAZONAS,LETICIA,NIBIA PAOLA ROJAS LEON,PARTIDO CENTRO DEMOCRATICO,92866
Concejo,AMAZONAS,LETICIA,ORLANDO  MENESES DIAZ,PARTIDO POLO DEMOCRATICO ALTERNATIVO,92967
Concejo,AMAZONAS,LETICIA,OSCAR HUMBERTO GARZON MARTINEZ,PARTIDO COLOMBIA RENACIENTE,92889
Concejo,AMAZONAS,LETICIA,OSCAR VIRGILIO MURAYARI HUANIRI,PARTIDO CENTRO DEMOCRATICO,92858
Concejo,AMAZONAS,LETICIA,OSWALDO ERASMO AVILA RAMIREZ,PARTIDO SOCIAL DE UNIDAD NACIONAL PARTIDO DE LA U,92955
Concejo,AMAZONAS,LETICIA,OVED  DAVILA ROQUE,PARTIDO CAMBIO RADICAL,92919
Concejo,AMAZONAS,LETICIA,PABLO  FORERO FERNANDEZ,PARTIDO SOCIAL DE UNIDAD NACIONAL PARTIDO DE LA U,92964
Concejo,AMAZONAS,LETICIA,PAULINO  MARIÑO RUIZ,PARTIDO CAMBIO RADICAL,92916
Concejo,AMAZONAS,LETICIA,PERSI  CERRON SILVA,PARTIDO COLOMBIA RENACIENTE,92888
Concejo,AMAZONAS,LETICIA,RAIMUNDO FRANCISCO NOGUERA DO SANTOS,PARTIDO CENTRO DEMOCRATICO,92864
Concejo,AMAZONAS,LETICIA,ROCIO DEL CARMEN FILO PINEDO,PARTIDO LIBERAL COLOMBIANO,92852
Concejo,AMAZONAS,LETICIA,RODOLFO ALONSO PEREZ ASTUDILLO,PARTIDO ALIANZA SOCIAL INDEPENDIENTE - ASI,92945
Concejo,AMAZONAS,LETICIA,ROMUALDO  GUTIERREZ VILLA,MOVIMIENTO ALTERNATIVO INDIGENA Y SOCIAL - MAIS,92881
Concejo,AMAZONAS,LETICIA,ROSA STELLA GAONA LARA,PARTIDO COLOMBIA RENACIENTE,92896
Concejo,AMAZONAS,LETICIA,RUTH  LORENZO FERNANDEZ,MOVIMIENTO ALTERNATIVO INDIGENA Y SOCIAL - MAIS,92873
Concejo,AMAZONAS,LETICIA,SIMON MAURICIO CUELLAR PADILLA,PARTIDO SOCIAL DE UNIDAD NACIONAL PARTIDO DE LA U,92962
Concejo,AMAZONAS,LETICIA,VICTOR ANDRES RAMIREZ ARBELAEZ,PARTIDO CENTRO DEMOCRATICO,92860
Concejo,AMAZONAS,LETICIA,WENDY ELIZABETH ROJAS FERNANDEZ,PARTIDO ALIANZA SOCIAL INDEPENDIENTE - ASI,92943
Concejo,AMAZONAS,LETICIA,YENY  JORDAN PARENTE,PARTIDO CAMBIO RADICAL,92920
Concejo,AMAZONAS,LETICIA,YESIKA  LARRAÑAGA ,PARTIDO ALIANZA VERDE,92928
Concejo,AMAZONAS,LETICIA,YOHANY  SALAZAR LOPEZ,PARTIDO POLITICO MIRA,92951
Concejo,AMAZONAS,LETICIA,ZORAIDA  MORAN DEL AGUILA,PARTIDO LIBERAL COLOMBIANO,92854
