corp,dpto,mpio,name,party,wp_no
Concejo,SANTANDER,FLORIDABLANCA,RICARDO  COLLANTE GOMEZ,PARTIDO CAMBIO RADICAL,65045
Concejo,SANTANDER,FLORIDABLANCA,RICARDO  RAMIREZ GONZALEZ,PARTIDO POLO DEMOCRATICO ALTERNATIVO,65143
Concejo,SANTANDER,FLORIDABLANCA,ROBERTO ALFONSO MARTINEZ FLOREZ,PARTIDO COLOMBIA JUSTA LIBRES,64957
Concejo,SANTANDER,FLORIDABLANCA,ROBINSON SIMON ORDOÑEZ JAIMES,PARTIDO CENTRO DEMOCRATICO,64931
Concejo,SANTANDER,FLORIDABLANCA,RODRIGO  RIVERA SUAREZ,PARTIDO ALIANZA VERDE,65062
Concejo,SANTANDER,FLORIDABLANCA,RODRIGO EZEQUIEL LACOUTURE ORTIZ,PARTIDO COLOMBIA JUSTA LIBRES,64954
Concejo,SANTANDER,FLORIDABLANCA,ROSMIRA  CAMACHO BLANCO,LIGA DE GOBERNANTES ANTICORRUPCION,65163
Concejo,SANTANDER,FLORIDABLANCA,ROSSVAN JOHAN CARVAJAL PINEDA,PARTIDO CONSERVADOR COLOMBIANO,65020
Concejo,SANTANDER,FLORIDABLANCA,SALVADOR  MOLINA SAAVEDRA,PARTIDO ALIANZA SOCIAL INDEPENDIENTE - ASI,65100
Concejo,SANTANDER,FLORIDABLANCA,SANDRA MILENA IGLESIAS ACEVEDO,LIGA DE GOBERNANTES ANTICORRUPCION,65158
Concejo,SANTANDER,FLORIDABLANCA,SANDRA MILENA OLIVEROS VARGAS,PARTIDO DE REIVINDICACIÓN ÉTNICA -PRE-,65007
Concejo,SANTANDER,FLORIDABLANCA,SANDRA MILENA QUINTERO SANCHEZ,PARTIDO ALIANZA VERDE,65059
Concejo,SANTANDER,FLORIDABLANCA,SANDRA PATRICIA ROLON ORTIZ,LIGA DE GOBERNANTES ANTICORRUPCION,65149
Concejo,SANTANDER,FLORIDABLANCA,SANDRA PATRICIA VILLARREAL CORTEZ,PARTIDO COLOMBIA RENACIENTE,64973
Concejo,SANTANDER,FLORIDABLANCA,SARIS  CHACON CARDENAS,DECENTES FLORIDABLANCA,65215
Concejo,SANTANDER,FLORIDABLANCA,SERGIO  ACUÑA BALLESTEROS,LIGA DE GOBERNANTES ANTICORRUPCION,65159
Concejo,SANTANDER,FLORIDABLANCA,SERGIO  SANTOS RUIZ,COMUNALES POR FLORIDABLANCA,65170
Concejo,SANTANDER,FLORIDABLANCA,SERGIO AUGUSTO CABALLERO PEREZ,PARTIDO CONSERVADOR COLOMBIANO,65028
Concejo,SANTANDER,FLORIDABLANCA,SERGIO IVAN DUEÑEZ PEÑA,PARTIDO CAMBIO RADICAL,65034
Concejo,SANTANDER,FLORIDABLANCA,SILVIO  QUIROGA MATEUS,SIN CAMPO NO HAY CIUDAD,65198
Concejo,SANTANDER,FLORIDABLANCA,SOCORRO  JAIMES VARGAS,SIN CAMPO NO HAY CIUDAD,65190
Concejo,SANTANDER,FLORIDABLANCA,TERESA  MOLINA FERNANDEZ,PARTIDO ALIANZA VERDE,65068
Concejo,SANTANDER,FLORIDABLANCA,VALERIA  GUTIERREZ PINZON,DECENTES FLORIDABLANCA,65225
Concejo,SANTANDER,FLORIDABLANCA,VICTOR HUGO JIMENEZ FERREIRA,SIN CAMPO NO HAY CIUDAD,65193
Concejo,SANTANDER,FLORIDABLANCA,VICTOR MANUEL ESPINOSA TOBAR,PARTIDO ALIANZA VERDE,65060
Concejo,SANTANDER,FLORIDABLANCA,VIVIANA  AMADOR SIERRA,PARTIDO DE REIVINDICACIÓN ÉTNICA -PRE-,65005
Concejo,SANTANDER,FLORIDABLANCA,VLADIMIR ALBERTO SEQUERA RODRIGUEZ,PARTIDO ADA,64990
Concejo,SANTANDER,FLORIDABLANCA,WALTER DAVID DURAN PRADA,PARTIDO SOCIAL DE UNIDAD NACIONAL PARTIDO DE LA U,65121
Concejo,SANTANDER,FLORIDABLANCA,WENDY TATIANA VANEGAS CHAVERRA,COMUNALES POR FLORIDABLANCA,65178
Concejo,SANTANDER,FLORIDABLANCA,WENDY YULIANA GARNICA HERNANDEZ,PARTIDO CAMBIO RADICAL,65039
Concejo,SANTANDER,FLORIDABLANCA,WILLIAM ALONSO BAUTISTA ,PARTIDO DE REIVINDICACIÓN ÉTNICA -PRE-,65014
Concejo,SANTANDER,FLORIDABLANCA,WILSON  AGUIRRE QUINTERO,COMUNALES POR FLORIDABLANCA,65176
Concejo,SANTANDER,FLORIDABLANCA,WILSON  ARDILA PARRA,MOVIMIENTO AUTORIDADES INDIGENAS DE COLOMBIA - AICO,65073
Concejo,SANTANDER,FLORIDABLANCA,WILSON  TRISTANCHO MEJIA,PARTIDO SOCIAL DE UNIDAD NACIONAL PARTIDO DE LA U,65127
Concejo,SANTANDER,FLORIDABLANCA,WILSON ANTONIO RINCON PINEDA,PARTIDO SOCIAL DE UNIDAD NACIONAL PARTIDO DE LA U,65118
Concejo,SANTANDER,FLORIDABLANCA,WILSON JAVIER PAEZ MARIN,PARTIDO COLOMBIA RENACIENTE,64968
Concejo,SANTANDER,FLORIDABLANCA,WILSON JOAN CEPEDA MORA,PARTIDO ALIANZA SOCIAL INDEPENDIENTE - ASI,65104
Concejo,SANTANDER,FLORIDABLANCA,YAMILE  OROZCO FLOREZ,PARTIDO COLOMBIA JUSTA LIBRES,64959
Concejo,SANTANDER,FLORIDABLANCA,YAQUELINE  MARTINEZ VILLAMIZAR,PARTIDO ALIANZA SOCIAL INDEPENDIENTE - ASI,65092
Concejo,SANTANDER,FLORIDABLANCA,YENNY PATRICIA ULLOA VILLAMIZAR,PARTIDO CENTRO DEMOCRATICO,64930
Concejo,SANTANDER,FLORIDABLANCA,YESENIA FERNANDA CHACON ARENAS,PARTIDO CONSERVADOR COLOMBIANO,65022
Concejo,SANTANDER,FLORIDABLANCA,YISETH TATIANA PINZON CASTRO,PARTIDO CONSERVADOR COLOMBIANO,65026
Concejo,SANTANDER,FLORIDABLANCA,YOLANDA  AYALA RAMIREZ,PARTIDO LIBERAL COLOMBIANO,64910
Concejo,SANTANDER,FLORIDABLANCA,YOLANDA  CASTRILLON ARDILA,PARTIDO POLO DEMOCRATICO ALTERNATIVO,65134
Concejo,SANTANDER,FLORIDABLANCA,YORK FREDERICK ARDILA GUERRERO,LIGA DE GOBERNANTES ANTICORRUPCION,65160
Concejo,SANTANDER,FLORIDABLANCA,ZULEY VANESSA TORRES REY,PARTIDO DE REIVINDICACIÓN ÉTNICA -PRE-,64998
Concejo,SANTANDER,FLORIDABLANCA,ZULLY MINERVA DUARTE RODRIGUEZ,PARTIDO COLOMBIA RENACIENTE,64960
Concejo,SANTANDER,FLORIDABLANCA,ZULMY YONEYDY QUIROGA PARDO,PARTIDO ADA,64997
