corp,dpto,mpio,name,party,wp_no
Concejo,META,PUERTO LOPEZ,ADALBERTO  VELASCO DAZA,PARTIDO CAMBIO RADICAL,91038
Concejo,META,PUERTO LOPEZ,AGUSTIN  BARBOSA LOPEZ,PARTIDO LIBERAL COLOMBIANO,90954
Concejo,META,PUERTO LOPEZ,ALBEIRO  MORENO JARAMILLO,PARTIDO ADA,91012
Concejo,META,PUERTO LOPEZ,ALBERTO  MONROY HERNANDEZ,PARTIDO CONSERVADOR COLOMBIANO,91021
Concejo,META,PUERTO LOPEZ,ALEXANDER  GOMEZ CASALLAS,PARTIDO LIBERAL COLOMBIANO,90955
Concejo,META,PUERTO LOPEZ,ANA ELSY URREA ,PARTIDO ADA,91014
Concejo,META,PUERTO LOPEZ,ANCIZAR  GUZMAN TORRES,PARTIDO CENTRO DEMOCRATICO,90969
Concejo,META,PUERTO LOPEZ,ANDERSON  BUSTOS BECERRA,MOVIMIENTO RENOVACION MUNICIPAL,91089
Concejo,META,PUERTO LOPEZ,ANGELA ROSA OROZCO SUAREZ,PARTIDO COLOMBIA JUSTA LIBRES,90995
Concejo,META,PUERTO LOPEZ,ANGELA SOLANYI AVILA CESPEDES,MOVIMIENTO RENOVACION MUNICIPAL,91090
Concejo,META,PUERTO LOPEZ,ANGELICA MARIA SANCHEZ ROMERO,PARTIDO CAMBIO RADICAL,91043
Concejo,META,PUERTO LOPEZ,APOLINAR  BELTRAN VILLAZON,COALICION ALTERNATIVA POR PUERTO LOPEZ,91110
Concejo,META,PUERTO LOPEZ,AUDELINA  JASPE ,COALICION ALTERNATIVA POR PUERTO LOPEZ,91114
Concejo,META,PUERTO LOPEZ,AUDY VIVIANA PARRA TOLEDO,PARTIDO LIBERAL COLOMBIANO,90952
Concejo,META,PUERTO LOPEZ,BERNARDO  PEÑA TORRES,COALICION PARTIDO DE LA U - PARTIDO MIRA,91097
Concejo,META,PUERTO LOPEZ,BLANCA LUCIA RODRIGUEZ RAMIREZ,PARTIDO CAMBIO RADICAL,91046
Concejo,META,PUERTO LOPEZ,BRAYAN ALEJANDRO GUTIERREZ ARANGO,PARTIDO ALIANZA VERDE,91058
Concejo,META,PUERTO LOPEZ,CARLOS ALBERTO VILLEGAS OSPINA,PARTIDO CENTRO DEMOCRATICO,90965
Concejo,META,PUERTO LOPEZ,CARLOS ANDRES TURRIAGO ROJAS,PARTIDO ALIANZA VERDE,91048
Concejo,META,PUERTO LOPEZ,CARLOS ERNESTO MOGOLLON MARTINEZ,PARTIDO CENTRO DEMOCRATICO,90964
Concejo,META,PUERTO LOPEZ,CARLOS HERNANDO URREGO JAIME,PARTIDO CAMBIO RADICAL,91034
Concejo,META,PUERTO LOPEZ,CARLOS ORLANDO HEREDIA LEAL,PARTIDO CAMBIO RADICAL,91044
Concejo,META,PUERTO LOPEZ,CECILIA MAGALY GARCIA LAVERDE,MOVIMIENTO RENOVACION MUNICIPAL,91088
Concejo,META,PUERTO LOPEZ,CELEDONIO  MACIAS BONILLA,MOVIMIENTO AUTORIDADES INDIGENAS DE COLOMBIA - AICO,91071
Concejo,META,PUERTO LOPEZ,CESAR AUGUSTO ARANDIA ,PARTIDO CONSERVADOR COLOMBIANO,91029
Concejo,META,PUERTO LOPEZ,CLAUDIA CAROLINA URREGO PATIÑO,PARTIDO CONSERVADOR COLOMBIANO,91030
Concejo,META,PUERTO LOPEZ,CLAUDIA LORENA PARRA TORO,PARTIDO CAMBIO RADICAL,91037
Concejo,META,PUERTO LOPEZ,CLAUDIA YOLIMA RESTREPO CRUZ,PARTIDO LIBERAL COLOMBIANO,90961
Concejo,META,PUERTO LOPEZ,CONSUELO  GUZMAN ALBADAN,MOVIMIENTO AUTORIDADES INDIGENAS DE COLOMBIA - AICO,91063
Concejo,META,PUERTO LOPEZ,CRISTIAN CAMILO RONDON ACERO,PARTIDO ALIANZA SOCIAL INDEPENDIENTE - ASI,91076
Concejo,META,PUERTO LOPEZ,DAIN ANTONIO HERAQUE NOGUERA,PARTIDO COLOMBIA RENACIENTE,91009
Concejo,META,PUERTO LOPEZ,DAMARIS  URREGO ,MOVIMIENTO AUTORIDADES INDIGENAS DE COLOMBIA - AICO,91068
Concejo,META,PUERTO LOPEZ,DANIEL EDUARDO ROBLEDO GUTIERREZ,MOVIMIENTO RENOVACION MUNICIPAL,91094
Concejo,META,PUERTO LOPEZ,DANILO JESUS GONGORA CAICEDO,MOVIMIENTO RENOVACION MUNICIPAL,91093
Concejo,META,PUERTO LOPEZ,DEINY LORENA SANCHEZ MARTINEZ,PARTIDO ALIANZA SOCIAL INDEPENDIENTE - ASI,91083
Concejo,META,PUERTO LOPEZ,DELVIN ALONSO RAMIREZ MORALES,PARTIDO LIBERAL COLOMBIANO,90951
Concejo,META,PUERTO LOPEZ,DEYNE YORLEY SARMIENTO GUTIERREZ,MOVIMIENTO RENOVACION MUNICIPAL,91087
Concejo,META,PUERTO LOPEZ,DIANA CAROLINA ZUÑIGA GARCES,PARTIDO LIBERAL COLOMBIANO,90957
Concejo,META,PUERTO LOPEZ,DIANA MARCELA PINZON BOHORQUEZ,COALICION ALTERNATIVA POR PUERTO LOPEZ,91115
Concejo,META,PUERTO LOPEZ,DIEGO CAMILO CARREÑO ROMERO,MOVIMIENTO ALTERNATIVO INDIGENA Y SOCIAL - MAIS,90983
Concejo,META,PUERTO LOPEZ,DORIAN DIDIER DUQUE SUAREZ,PARTIDO CONSERVADOR COLOMBIANO,91025
Concejo,META,PUERTO LOPEZ,EDDIE ALEJANDRO VERDOOREN BORDA,PARTIDO COLOMBIA RENACIENTE,90998
Concejo,META,PUERTO LOPEZ,EDID JOHANA GARZON HERNANDEZ,PARTIDO ALIANZA VERDE,91052
Concejo,META,PUERTO LOPEZ,EDILBERTO  GUZMAN RODRIGUEZ,PARTIDO CAMBIO RADICAL,91040
Concejo,META,PUERTO LOPEZ,EDILSON  ARENAS LEON,PARTIDO LIBERAL COLOMBIANO,90960
Concejo,META,PUERTO LOPEZ,EDILSON  DIAZ AGUDELO,MOVIMIENTO ALTERNATIVO INDIGENA Y SOCIAL - MAIS,90977
Concejo,META,PUERTO LOPEZ,EDNA PATRICIA ESGUERRA RUIZ,PARTIDO ADA,91011
Concejo,META,PUERTO LOPEZ,EDUARD ANDERSSON STIVEN DIAZ GAMEZ,PARTIDO CENTRO DEMOCRATICO,90970
Concejo,META,PUERTO LOPEZ,EDVER  TOLOSA RAMIREZ,PARTIDO CONSERVADOR COLOMBIANO,91033
Concejo,META,PUERTO LOPEZ,ELIZABETH SALIS MURILLO GARCIA,MOVIMIENTO ALTERNATIVO INDIGENA Y SOCIAL - MAIS,90976
Concejo,META,PUERTO LOPEZ,ESTELA  PLAZAS ,MOVIMIENTO AUTORIDADES INDIGENAS DE COLOMBIA - AICO,91072
Concejo,META,PUERTO LOPEZ,ESTHER JULIA LINARES BECERRA,PARTIDO CONSERVADOR COLOMBIANO,91027
Concejo,META,PUERTO LOPEZ,FARIDE  PARDO NARVAEZ,COALICION ALTERNATIVA POR PUERTO LOPEZ,91118
Concejo,META,PUERTO LOPEZ,FAY DEVER DAZA MEDINA,MOVIMIENTO RENOVACION MUNICIPAL,91092
Concejo,META,PUERTO LOPEZ,FRANCISCO JAVIER VELASQUEZ LIZARAZO,PARTIDO CAMBIO RADICAL,91035
Concejo,META,PUERTO LOPEZ,FRANCISCO WILLIAM ROA PERALTA,MOVIMIENTO ALTERNATIVO INDIGENA Y SOCIAL - MAIS,90975
Concejo,META,PUERTO LOPEZ,FREDY GILBERTO RODAS LONDOÑO,PARTIDO ADA,91013
Concejo,META,PUERTO LOPEZ,GABRIEL  MONTILLA RODRIGUEZ,PARTIDO ALIANZA SOCIAL INDEPENDIENTE - ASI,91082
Concejo,META,PUERTO LOPEZ,GERARDO  UNDA TUMAY,PARTIDO COLOMBIA JUSTA LIBRES,90996
Concejo,META,PUERTO LOPEZ,GERMAN  LADINO CARREÑO,PARTIDO ALIANZA SOCIAL INDEPENDIENTE - ASI,91081
Concejo,META,PUERTO LOPEZ,GILBERTO  ROMERO MENDEZ,COALICION PARTIDO DE LA U - PARTIDO MIRA,91102
Concejo,META,PUERTO LOPEZ,GUSTAVO ADOLFO CASTRO OSPINA,PARTIDO COLOMBIA RENACIENTE,91002
Concejo,META,PUERTO LOPEZ,HAROLD DAVID CIFUENTES TANGARIFE,MOVIMIENTO ALTERNATIVO INDIGENA Y SOCIAL - MAIS,90980
Concejo,META,PUERTO LOPEZ,HEIDI VANESSA RAMIREZ ,COALICION ALTERNATIVA POR PUERTO LOPEZ,91121
Concejo,META,PUERTO LOPEZ,HERDER FABIAN BURGOS GARCIA,MOVIMIENTO AUTORIDADES INDIGENAS DE COLOMBIA - AICO,91069
Concejo,META,PUERTO LOPEZ,HERNANDO  CORONEL LUNA,PARTIDO ALIANZA SOCIAL INDEPENDIENTE - ASI,91084
Concejo,META,PUERTO LOPEZ,HILDA LUCILA BELTRAN NIEVES,PARTIDO COLOMBIA RENACIENTE,91006
Concejo,META,PUERTO LOPEZ,INDALECIA  DUARTE REYES,COALICION PARTIDO DE LA U - PARTIDO MIRA,91099
Concejo,META,PUERTO LOPEZ,INES  LONDOÑO MARIN,PARTIDO CENTRO DEMOCRATICO,90968
Concejo,META,PUERTO LOPEZ,ISAIAS  ALVAREZ PALACIOS,PARTIDO ALIANZA VERDE,91055
Concejo,META,PUERTO LOPEZ,ISMAEL ENRIQUE FLOREZ BELEÑO,PARTIDO CENTRO DEMOCRATICO,90967
Concejo,META,PUERTO LOPEZ,JAIME  BURGOS DAZA,PARTIDO CAMBIO RADICAL,91042
Concejo,META,PUERTO LOPEZ,JAIME ANTONIO RANGEL MENDOZA,PARTIDO ALIANZA VERDE,91047
Concejo,META,PUERTO LOPEZ,JAIRO  LONDOÑO GAVIRIA,PARTIDO ADA,91016
Concejo,META,PUERTO LOPEZ,JAIRO  TOVAR GUTIERREZ,MOVIMIENTO AUTORIDADES INDIGENAS DE COLOMBIA - AICO,91066
Concejo,META,PUERTO LOPEZ,JAIRO MANUEL MOGOLLON GONZALEZ,PARTIDO ADA,91015
Concejo,META,PUERTO LOPEZ,JEFERSON  MARTINEZ CARDONA,COALICION PARTIDO DE LA U - PARTIDO MIRA,91105
Concejo,META,PUERTO LOPEZ,JENIFFER KATHERINE MORENO TRIANA,PARTIDO ALIANZA VERDE,91049
Concejo,META,PUERTO LOPEZ,JHON ANDRES OCHOA CUBIDES,COALICION PARTIDO DE LA U - PARTIDO MIRA,91108
Concejo,META,PUERTO LOPEZ,JHON FREDY GUALTEROS ROMERO,PARTIDO COLOMBIA RENACIENTE,91003
Concejo,META,PUERTO LOPEZ,JHON JAIME JIMENEZ GARRO,PARTIDO CONSERVADOR COLOMBIANO,91028
Concejo,META,PUERTO LOPEZ,JHON JAIRO CORDOBA CORDOBA,PARTIDO ALIANZA SOCIAL INDEPENDIENTE - ASI,91080
Concejo,META,PUERTO LOPEZ,JIMY FERNEY DIAZ ,MOVIMIENTO AUTORIDADES INDIGENAS DE COLOMBIA - AICO,91061
Concejo,META,PUERTO LOPEZ,JOHN ROBERT RUSSI LESMES,PARTIDO ALIANZA VERDE,91053
Concejo,META,PUERTO LOPEZ,JORGE ALVEIRO OVIEDO ,PARTIDO COLOMBIA JUSTA LIBRES,90987
Concejo,META,PUERTO LOPEZ,JORGE HERNANDO VARGAS ,MOVIMIENTO AUTORIDADES INDIGENAS DE COLOMBIA - AICO,91062
Concejo,META,PUERTO LOPEZ,JOSE ADAN TOLOZA CUBIDES,PARTIDO ALIANZA SOCIAL INDEPENDIENTE - ASI,91074
Concejo,META,PUERTO LOPEZ,JOSE ADRIANO REYES JIMENEZ,PARTIDO ALIANZA SOCIAL INDEPENDIENTE - ASI,91079
Concejo,META,PUERTO LOPEZ,JOSE ALBERTO DIAZ CASTRO,PARTIDO LIBERAL COLOMBIANO,90956
Concejo,META,PUERTO LOPEZ,JOSE ALBERTO GARZON LOZANO,COALICION ALTERNATIVA POR PUERTO LOPEZ,91112
Concejo,META,PUERTO LOPEZ,JOSE ARCADIO ROJAS OVIEDO,PARTIDO CENTRO DEMOCRATICO,90974
Concejo,META,PUERTO LOPEZ,JOSE ARLEY AGUDELO DEVIA,PARTIDO ALIANZA VERDE,91054
Concejo,META,PUERTO LOPEZ,JOSE DANIEL GONZALEZ CAPERA,PARTIDO COLOMBIA RENACIENTE,91008
Concejo,META,PUERTO LOPEZ,JOSE DOMINGO REQUINIVA CANO,PARTIDO LIBERAL COLOMBIANO,90959
Concejo,META,PUERTO LOPEZ,JOSE GABRIEL QUINTANA CHINGATE,PARTIDO COLOMBIA JUSTA LIBRES,90994
Concejo,META,PUERTO LOPEZ,JOSE JAIR ROZO CORTES,PARTIDO CENTRO DEMOCRATICO,90963
Concejo,META,PUERTO LOPEZ,JOSE MARLIO CASTRO RUIZ,PARTIDO ALIANZA SOCIAL INDEPENDIENTE - ASI,91077
Concejo,META,PUERTO LOPEZ,JOSE OMAR LANCACHO RIAÑO,PARTIDO CONSERVADOR COLOMBIANO,91023
Concejo,META,PUERTO LOPEZ,JOSE RODRIGO GONZALEZ VANEGAS,COALICION ALTERNATIVA POR PUERTO LOPEZ,91111
Concejo,META,PUERTO LOPEZ,JOSE TITO LOAIZA VIÑA,PARTIDO ALIANZA VERDE,91050
Concejo,META,PUERTO LOPEZ,JOSUE ABIMAEL AGUIRRE MORENO,COALICION ALTERNATIVA POR PUERTO LOPEZ,91113
Concejo,META,PUERTO LOPEZ,JUAN CARLOS CORTES RAMIREZ,PARTIDO CAMBIO RADICAL,91045
Concejo,META,PUERTO LOPEZ,JULIO EDUARDO BARRAGAN IBICA,COALICION PARTIDO DE LA U - PARTIDO MIRA,91104
Concejo,META,PUERTO LOPEZ,JULIO JAVIER CALDERON ,PARTIDO CAMBIO RADICAL,91039
Concejo,META,PUERTO LOPEZ,KHENGEE DAVIANA ZIPAQUIRA VARON,PARTIDO CENTRO DEMOCRATICO,90973
Concejo,META,PUERTO LOPEZ,LEIDY JOHANNA AGUDELO AGUDELO,COALICION PARTIDO DE LA U - PARTIDO MIRA,91101
Concejo,META,PUERTO LOPEZ,LEIDY RAQUEL SANCHEZ AVILA,PARTIDO COLOMBIA JUSTA LIBRES,90992
Concejo,META,PUERTO LOPEZ,LUIS ABELARDO QUIMBAYO BERMUDEZ,MOVIMIENTO AUTORIDADES INDIGENAS DE COLOMBIA - AICO,91067
Concejo,META,PUERTO LOPEZ,LUIS ALFREDO RODRIGUEZ MOLINA,PARTIDO COLOMBIA RENACIENTE,90997
Concejo,META,PUERTO LOPEZ,LUIS ALFREDO RUIZ CUMANAICA,MOVIMIENTO AUTORIDADES INDIGENAS DE COLOMBIA - AICO,91060
Concejo,META,PUERTO LOPEZ,LUIS ANGEL RAMIREZ DIAZ,COALICION ALTERNATIVA POR PUERTO LOPEZ,91116
Concejo,META,PUERTO LOPEZ,LUIS ARIEL GUALDRON SANCHEZ,PARTIDO LIBERAL COLOMBIANO,90958
Concejo,META,PUERTO LOPEZ,LUIS FERNEL GUERRERO AGUILAR,PARTIDO COLOMBIA RENACIENTE,90999
Concejo,META,PUERTO LOPEZ,LUZ ADRIANA ADAMEZ FRANCO,COALICION PARTIDO DE LA U - PARTIDO MIRA,91107
Concejo,META,PUERTO LOPEZ,LUZ DARY GONZALEZ VARACALDO,MOVIMIENTO ALTERNATIVO INDIGENA Y SOCIAL - MAIS,90984
Concejo,META,PUERTO LOPEZ,LUZ MENIA DOMINGUEZ PEDRAZA,PARTIDO ALIANZA SOCIAL INDEPENDIENTE - ASI,91085
Concejo,META,PUERTO LOPEZ,LUZ VEIRY ERAQUE NOGUERA,PARTIDO ALIANZA VERDE,91056
Concejo,META,PUERTO LOPEZ,MARCOS  ARREPICHE ,MOVIMIENTO ALTERNATIVO INDIGENA Y SOCIAL - MAIS,90981
Concejo,META,PUERTO LOPEZ,MARIA DEL ROSARIO VILLEGAS OSPINA,PARTIDO CAMBIO RADICAL,91036
Concejo,META,PUERTO LOPEZ,MARIA EVENIDE HOYOS DE TABARES,PARTIDO COLOMBIA RENACIENTE,91000
Concejo,META,PUERTO LOPEZ,MARIA PIEDAD VERA ,MOVIMIENTO RENOVACION MUNICIPAL,91096
Concejo,META,PUERTO LOPEZ,MARIA SOLEDAD ECHEVERRIA SANCHEZ,COALICION PARTIDO DE LA U - PARTIDO MIRA,91106
Concejo,META,PUERTO LOPEZ,MARIA VICTORIA HERNANDEZ VARGAS,PARTIDO COLOMBIA RENACIENTE,91004
Concejo,META,PUERTO LOPEZ,MARIO AUGUSTO GUTIERREZ RAMIREZ,PARTIDO COLOMBIA JUSTA LIBRES,90988
Concejo,META,PUERTO LOPEZ,MARTA ROSA ALVAREZ RAMIREZ,MOVIMIENTO ALTERNATIVO INDIGENA Y SOCIAL - MAIS,90986
Concejo,META,PUERTO LOPEZ,MARTHA CECILIA MORALES SANCHEZ,PARTIDO ALIANZA SOCIAL INDEPENDIENTE - ASI,91075
Concejo,META,PUERTO LOPEZ,MARTHA PATRICIA LOZADA CANO,PARTIDO ADA,91020
Concejo,META,PUERTO LOPEZ,MARY RUTH URREGO HERRERA,PARTIDO CENTRO DEMOCRATICO,90972
Concejo,META,PUERTO LOPEZ,MAURICIO  RIOS TOVAR,PARTIDO LIBERAL COLOMBIANO,90949
Concejo,META,PUERTO LOPEZ,MAYELY  BRAVO PLAZA,PARTIDO COLOMBIA RENACIENTE,91001
Concejo,META,PUERTO LOPEZ,MIGUEL ORLANDO CELEMIN ANGARITA,PARTIDO ALIANZA SOCIAL INDEPENDIENTE - ASI,91078
Concejo,META,PUERTO LOPEZ,MILLER  CARCAMO ESPAÑA,PARTIDO ADA,91017
Concejo,META,PUERTO LOPEZ,MILLER MAURICIO AGUDELO MARTINEZ,COALICION PARTIDO DE LA U - PARTIDO MIRA,91103
Concejo,META,PUERTO LOPEZ,NARDY ISABEL BERNAL MALDONADO,MOVIMIENTO AUTORIDADES INDIGENAS DE COLOMBIA - AICO,91064
Concejo,META,PUERTO LOPEZ,NELSON ERNEY VILLALOBOS VANEGAS,PARTIDO ALIANZA VERDE,91051
Concejo,META,PUERTO LOPEZ,NESTOR ROBIRO SALGADO PLAZAS,MOVIMIENTO ALTERNATIVO INDIGENA Y SOCIAL - MAIS,90978
Concejo,META,PUERTO LOPEZ,NINI JOHANA MARTINEZ TELLEZ,PARTIDO ALIANZA VERDE,91059
Concejo,META,PUERTO LOPEZ,NOELIA  VASQUEZ CARDOSO,PARTIDO LIBERAL COLOMBIANO,90953
Concejo,META,PUERTO LOPEZ,OLGA ESTHER COLON VELASQUEZ,MOVIMIENTO ALTERNATIVO INDIGENA Y SOCIAL - MAIS,90985
Concejo,META,PUERTO LOPEZ,OLIVERIO  MORENO BEJARANO,PARTIDO ALIANZA VERDE,91057
Concejo,META,PUERTO LOPEZ,OMAR FIDEL TUMAY JIMENEZ,PARTIDO COLOMBIA JUSTA LIBRES,90991
Concejo,META,PUERTO LOPEZ,ORLANDO  MORENO ROMERO,PARTIDO CONSERVADOR COLOMBIANO,91026
Concejo,META,PUERTO LOPEZ,OSCAR  PARRADO PARRADO,MOVIMIENTO ALTERNATIVO INDIGENA Y SOCIAL - MAIS,90982
Concejo,META,PUERTO LOPEZ,OSCAR MARCELINO GAITAN CABARTE,MOVIMIENTO AUTORIDADES INDIGENAS DE COLOMBIA - AICO,91065
Concejo,META,PUERTO LOPEZ,PEDRO  MONTAÑO CAMPAZ,PARTIDO ADA,91018
Concejo,META,PUERTO LOPEZ,PEDRO ANTONIO BOBADILLA DAZA,PARTIDO CAMBIO RADICAL,91041
Concejo,META,PUERTO LOPEZ,POMPILIO  RODRIGUEZ NARVAEZ,PARTIDO CONSERVADOR COLOMBIANO,91032
Concejo,META,PUERTO LOPEZ,REINEL  CASTRO PEÑA,COALICION ALTERNATIVA POR PUERTO LOPEZ,91119
Concejo,META,PUERTO LOPEZ,RICKY YORK GANTIVA PASTRANA,COALICION ALTERNATIVA POR PUERTO LOPEZ,91117
Concejo,META,PUERTO LOPEZ,RIGO ANTONIO CHAVEZ CALDERON,MOVIMIENTO RENOVACION MUNICIPAL,91095
Concejo,META,PUERTO LOPEZ,ROBERT JAMILTON LEON ORTIZ,PARTIDO CONSERVADOR COLOMBIANO,91022
Concejo,META,PUERTO LOPEZ,ROBERTO  RUIZ PERDOMO,PARTIDO CENTRO DEMOCRATICO,90962
Concejo,META,PUERTO LOPEZ,RODRIGO  GUTIERREZ GUALTERO,PARTIDO ADA,91019
Concejo,META,PUERTO LOPEZ,ROMELIA  CRUZ CORTES,PARTIDO ALIANZA SOCIAL INDEPENDIENTE - ASI,91073
Concejo,META,PUERTO LOPEZ,ROSA ELENA ANDRADE LAVADO,PARTIDO CONSERVADOR COLOMBIANO,91031
Concejo,META,PUERTO LOPEZ,ROSA ISABEL CRUZ OSORIO,PARTIDO COLOMBIA JUSTA LIBRES,90990
Concejo,META,PUERTO LOPEZ,ROSALINO  REY RAMIREZ,COALICION PARTIDO DE LA U - PARTIDO MIRA,91098
Concejo,META,PUERTO LOPEZ,RUBEN STEFAN HERNANDEZ PEÑA,PARTIDO LIBERAL COLOMBIANO,90950
Concejo,META,PUERTO LOPEZ,SANDRA JANNETH MURIEL SANCHEZ,COALICION ALTERNATIVA POR PUERTO LOPEZ,91120
Concejo,META,PUERTO LOPEZ,SANDRA PATRICIA ALVAREZ LASSO,PARTIDO ADA,91010
Concejo,META,PUERTO LOPEZ,SAUL DE JESUS CARMONA TOBON,COALICION PARTIDO DE LA U - PARTIDO MIRA,91100
Concejo,META,PUERTO LOPEZ,SAUL MARIA CONTENTO CASTRO,PARTIDO COLOMBIA RENACIENTE,91005
Concejo,META,PUERTO LOPEZ,SERGIO  ROMERO OLAYA,PARTIDO CENTRO DEMOCRATICO,90966
Concejo,META,PUERTO LOPEZ,SINDI LORENA GUZMAN PINZON,PARTIDO COLOMBIA JUSTA LIBRES,90989
Concejo,META,PUERTO LOPEZ,SOL ANGELA MURILLO PINTO,PARTIDO COLOMBIA JUSTA LIBRES,90993
Concejo,META,PUERTO LOPEZ,TADEO  BARBOSA DAZA,COALICION PARTIDO DE LA U - PARTIDO MIRA,91109
Concejo,META,PUERTO LOPEZ,ULPIANO  NOVOA CEDIEL,MOVIMIENTO ALTERNATIVO INDIGENA Y SOCIAL - MAIS,90979
Concejo,META,PUERTO LOPEZ,VENTURA  MELO LOZANO,MOVIMIENTO RENOVACION MUNICIPAL,91091
Concejo,META,PUERTO LOPEZ,VICTOR BENJAMIN ROMERO ,PARTIDO COLOMBIA RENACIENTE,91007
Concejo,META,PUERTO LOPEZ,WILSON HERNAN BARRIOS NIETO,MOVIMIENTO RENOVACION MUNICIPAL,91086
Concejo,META,PUERTO LOPEZ,YESENIA VIVIANA DIAZ ,PARTIDO CENTRO DEMOCRATICO,90971
