corp,dpto,mpio,name,party,wp_no
Concejo,BOYACA,GUATEQUE,ALVARO ORLANDO PEREZ GORDILLO,PARTIDO CENTRO DEMOCRATICO,94962
Concejo,BOYACA,GUATEQUE,ANA LUISA ACOSTA PIEDRAHITA,PARTIDO ALIANZA SOCIAL INDEPENDIENTE - ASI,95017
Concejo,BOYACA,GUATEQUE,ANDRES FERNANDO MENDOZA GARZON,PARTIDO ALIANZA SOCIAL INDEPENDIENTE - ASI,95015
Concejo,BOYACA,GUATEQUE,ANGELA MARCELA TORRES PINTO,PARTIDO CAMBIO RADICAL,94995
Concejo,BOYACA,GUATEQUE,ANGELICA JANETH ALFONSO MARROQUIN,MOVIMIENTO ALTERNATIVO INDIGENA Y SOCIAL - MAIS,94972
Concejo,BOYACA,GUATEQUE,BLANCA CECILIA CARRANZA RUIZ,PARTIDO SOCIAL DE UNIDAD NACIONAL PARTIDO DE LA U,95033
Concejo,BOYACA,GUATEQUE,CAMPO ELIAS BERNAL JIMENEZ,MOVIMIENTO ALTERNATIVO INDIGENA Y SOCIAL - MAIS,94975
Concejo,BOYACA,GUATEQUE,CARLOS ANDRES HERNANDEZ ,PARTIDO CAMBIO RADICAL,94997
Concejo,BOYACA,GUATEQUE,CARLOS EDUARDO MARTINEZ DONCEL,PARTIDO LIBERAL COLOMBIANO,94952
Concejo,BOYACA,GUATEQUE,CARLOS FABIAN ALDANA TRIBALDOS,MOVIMIENTO ALTERNATIVO INDIGENA Y SOCIAL - MAIS,94976
Concejo,BOYACA,GUATEQUE,CARLOS FABIAN BOHORQUEZ LEON,PARTIDO SOCIAL DE UNIDAD NACIONAL PARTIDO DE LA U,95029
Concejo,BOYACA,GUATEQUE,CARMENZA  HERMIDA ASTUDILLO,PARTIDO CAMBIO RADICAL,94996
Concejo,BOYACA,GUATEQUE,CLAUDIA  CORREDOR DIAZ,PARTIDO ALIANZA VERDE,95004
Concejo,BOYACA,GUATEQUE,CONCEPCION  ROA LOPEZ,PARTIDO CENTRO DEMOCRATICO,94969
Concejo,BOYACA,GUATEQUE,CRISTIAN ANDRES SANCHEZ ALFONSO,MOVIMIENTO ALTERNATIVO INDIGENA Y SOCIAL - MAIS,94971
Concejo,BOYACA,GUATEQUE,DARIO ARMANDO FANDIÑO MARTINEZ,PARTIDO POLO DEMOCRATICO ALTERNATIVO,95034
Concejo,BOYACA,GUATEQUE,DIANA MILENA BERNAL GUACHETA,MOVIMIENTO ALTERNATIVO INDIGENA Y SOCIAL - MAIS,94980
Concejo,BOYACA,GUATEQUE,EDGAR ORLANDO RODRIGUEZ BERNAL,PARTIDO ALIANZA VERDE,95010
Concejo,BOYACA,GUATEQUE,EDWIN ROLANDO NIETO PINTO,PARTIDO CAMBIO RADICAL,94994
Concejo,BOYACA,GUATEQUE,EMILIANO  PARRA CASTAÑEDA,PARTIDO CENTRO DEMOCRATICO,94961
Concejo,BOYACA,GUATEQUE,ERIKA ALEXANDRA NIETO PRECIADO,PARTIDO LIBERAL COLOMBIANO,94957
Concejo,BOYACA,GUATEQUE,ERNEY GONZALO RAMOS GUATAQUIRA,PARTIDO ALIANZA VERDE,95007
Concejo,BOYACA,GUATEQUE,FABIAN LEONARDO ESQUIVEL RAMIREZ,PARTIDO ALIANZA SOCIAL INDEPENDIENTE - ASI,95013
Concejo,BOYACA,GUATEQUE,FERNEY YECID NIÑO MONTAÑEZ,MOVIMIENTO ALTERNATIVO INDIGENA Y SOCIAL - MAIS,94974
Concejo,BOYACA,GUATEQUE,FLOR NANCY ALVARADO SANCHEZ,PARTIDO SOCIAL DE UNIDAD NACIONAL PARTIDO DE LA U,95027
Concejo,BOYACA,GUATEQUE,GERMAN ARIEL LOAIZA SANCHEZ,PARTIDO SOCIAL DE UNIDAD NACIONAL PARTIDO DE LA U,95032
Concejo,BOYACA,GUATEQUE,GIOVANNY  MONTENEGRO CASTRO,PARTIDO CONSERVADOR COLOMBIANO,94988
Concejo,BOYACA,GUATEQUE,GRACIELA  ROA PIRATEQUE,PARTIDO ALIANZA VERDE,95011
Concejo,BOYACA,GUATEQUE,GUSTAVO ARIEL SARMIENTO RUIZ,PARTIDO LIBERAL COLOMBIANO,94955
Concejo,BOYACA,GUATEQUE,HECTOR ELIAS MORALES MORENO,PARTIDO ALIANZA SOCIAL INDEPENDIENTE - ASI,95020
Concejo,BOYACA,GUATEQUE,HEIDA YINNET ALFONSO CELIS,PARTIDO SOCIAL DE UNIDAD NACIONAL PARTIDO DE LA U,95030
Concejo,BOYACA,GUATEQUE,HOLMAN AURELIO MORALES BALLESTEROS,PARTIDO ALIANZA VERDE,95012
Concejo,BOYACA,GUATEQUE,HUGO HENRY RUIZ VARGAS,PARTIDO ALIANZA VERDE,95003
Concejo,BOYACA,GUATEQUE,IGNACIO ANTONIO SUAREZ SANCHEZ,PARTIDO CONSERVADOR COLOMBIANO,94981
Concejo,BOYACA,GUATEQUE,IVAN DARIO HERNANDEZ MONDRAGON,PARTIDO CENTRO DEMOCRATICO,94965
Concejo,BOYACA,GUATEQUE,IVETH ALEJANDRA CASTAÑEDA VARGAS,PARTIDO ALIANZA VERDE,95008
Concejo,BOYACA,GUATEQUE,JAIME ALIRIO DIAZ MARTIN,MOVIMIENTO ALTERNATIVO INDIGENA Y SOCIAL - MAIS,94978
Concejo,BOYACA,GUATEQUE,JAIRO MIGUEL MUÑOZ BUITRAGO,PARTIDO CENTRO DEMOCRATICO,94967
Concejo,BOYACA,GUATEQUE,JEFFERSON DAMIAN GARZON MARTINEZ,PARTIDO CENTRO DEMOCRATICO,94959
Concejo,BOYACA,GUATEQUE,JERONIMO  PARADA SOLER,PARTIDO SOCIAL DE UNIDAD NACIONAL PARTIDO DE LA U,95026
Concejo,BOYACA,GUATEQUE,JINETH STEFANY ROMERO PERILLA,PARTIDO CONSERVADOR COLOMBIANO,94990
Concejo,BOYACA,GUATEQUE,JOSE ASCENCION MORENO MORENO,PARTIDO CONSERVADOR COLOMBIANO,94986
Concejo,BOYACA,GUATEQUE,JOSE JAIME BOHORQUEZ LOPEZ,PARTIDO CENTRO DEMOCRATICO,94960
Concejo,BOYACA,GUATEQUE,JOSE RAMON CARRANZA DIAZ,PARTIDO LIBERAL COLOMBIANO,94958
Concejo,BOYACA,GUATEQUE,JUAN CRISTOBAL VARGAS ,PARTIDO LIBERAL COLOMBIANO,94953
Concejo,BOYACA,GUATEQUE,JULIANA  GARZON CELIS,PARTIDO CONSERVADOR COLOMBIANO,94982
Concejo,BOYACA,GUATEQUE,JULIO ROBERTO MORENO DAZA,PARTIDO ALIANZA VERDE,95005
Concejo,BOYACA,GUATEQUE,KAREN MERCEDES RUBIANO NIETO,MOVIMIENTO ALTERNATIVO INDIGENA Y SOCIAL - MAIS,94973
Concejo,BOYACA,GUATEQUE,KELY YERALDYN NIÑO CADENA,PARTIDO LIBERAL COLOMBIANO,94954
Concejo,BOYACA,GUATEQUE,LEIDY KARINA SANDOVAL MONDRAGON,PARTIDO LIBERAL COLOMBIANO,94951
Concejo,BOYACA,GUATEQUE,LEONEL ARTURO MONIQUIRA MORA,PARTIDO CONSERVADOR COLOMBIANO,94991
Concejo,BOYACA,GUATEQUE,LILIANA MARCELA RAMIREZ ,PARTIDO ALIANZA SOCIAL INDEPENDIENTE - ASI,95018
Concejo,BOYACA,GUATEQUE,LUIS ALEXANDER ROA ,PARTIDO ALIANZA SOCIAL INDEPENDIENTE - ASI,95019
Concejo,BOYACA,GUATEQUE,LUIS CARLOS MORALES MORENO,PARTIDO LIBERAL COLOMBIANO,94956
Concejo,BOYACA,GUATEQUE,LUZ OBEIDA LEGUIZAMON SANCHEZ,PARTIDO CENTRO DEMOCRATICO,94966
Concejo,BOYACA,GUATEQUE,MARCO EMILIO SOLANO FRANCO,PARTIDO LIBERAL COLOMBIANO,94949
Concejo,BOYACA,GUATEQUE,MARIA CELMIRA FANDIÑO BERMUDEZ,PARTIDO ALIANZA VERDE,95009
Concejo,BOYACA,GUATEQUE,MARIA DE LOS ANGELES AMAYA SOTELO,PARTIDO POLO DEMOCRATICO ALTERNATIVO,95035
Concejo,BOYACA,GUATEQUE,MAURO SEBASTIAN ROA CAMARGO,PARTIDO CAMBIO RADICAL,95000
Concejo,BOYACA,GUATEQUE,MERLEY YICETH LEGUIZAMON MONTAÑEZ,PARTIDO SOCIAL DE UNIDAD NACIONAL PARTIDO DE LA U,95031
Concejo,BOYACA,GUATEQUE,MIGUEL ANGEL PANADERO DUEÑEZ,PARTIDO CONSERVADOR COLOMBIANO,94985
Concejo,BOYACA,GUATEQUE,MIGUEL ANTONIO VARGAS LEGUIZAMO,PARTIDO CENTRO DEMOCRATICO,94963
Concejo,BOYACA,GUATEQUE,MIRYA ASTRID BUITRAGO ACEVEDO,MOVIMIENTO ALTERNATIVO INDIGENA Y SOCIAL - MAIS,94979
Concejo,BOYACA,GUATEQUE,MONICA DEL PILAR SANCHEZ AREVALO,PARTIDO CONSERVADOR COLOMBIANO,94983
Concejo,BOYACA,GUATEQUE,NEIL ROLANDO GARCIA RODRIGUEZ,PARTIDO LIBERAL COLOMBIANO,94948
Concejo,BOYACA,GUATEQUE,NELSON  ZIPAQUIRA RAMOS,MOVIMIENTO ALTERNATIVO INDIGENA Y SOCIAL - MAIS,94977
Concejo,BOYACA,GUATEQUE,NELSON HERNAN MOYA BARRETO,PARTIDO CAMBIO RADICAL,94998
Concejo,BOYACA,GUATEQUE,NORA  ARENAS ,PARTIDO CAMBIO RADICAL,95001
Concejo,BOYACA,GUATEQUE,OMAR GUSTAVO LEIVA CARRANZA,MOVIMIENTO ALTERNATIVO INDIGENA Y SOCIAL - MAIS,94970
Concejo,BOYACA,GUATEQUE,OSCAR EFRAIN ROCHA CASTAÑEDA,PARTIDO ALIANZA VERDE,95006
Concejo,BOYACA,GUATEQUE,OTONIEL  CORTES APONTE,PARTIDO ALIANZA SOCIAL INDEPENDIENTE - ASI,95016
Concejo,BOYACA,GUATEQUE,PABLO ALONSO MARQUEZ VELASCO,PARTIDO CAMBIO RADICAL,94999
Concejo,BOYACA,GUATEQUE,PABLO FERNANDO VALERO LOPEZ,PARTIDO ALIANZA SOCIAL INDEPENDIENTE - ASI,95014
Concejo,BOYACA,GUATEQUE,PAOLA ANDREA ROJAS CARRANZA,PARTIDO CENTRO DEMOCRATICO,94968
Concejo,BOYACA,GUATEQUE,PAULA ANDREA MARTINEZ QUINTERO,PARTIDO CONSERVADOR COLOMBIANO,94989
Concejo,BOYACA,GUATEQUE,PROSPERO  ARISMENDY SUAREZ,PARTIDO CAMBIO RADICAL,94993
Concejo,BOYACA,GUATEQUE,RUBEN  ROJAS BERMUDEZ,PARTIDO CAMBIO RADICAL,94992
Concejo,BOYACA,GUATEQUE,SANDRA PATRICIA RAMIREZ RAMIREZ,PARTIDO CENTRO DEMOCRATICO,94964
Concejo,BOYACA,GUATEQUE,STEFANIE  MAHECHA MORALES,PARTIDO LIBERAL COLOMBIANO,94950
Concejo,BOYACA,GUATEQUE,TITO SAUL VACCA BUITRAGO,PARTIDO CONSERVADOR COLOMBIANO,94984
Concejo,BOYACA,GUATEQUE,VITERLICIA  SANCHEZ RODRIGUEZ,PARTIDO CAMBIO RADICAL,95002
Concejo,BOYACA,GUATEQUE,WALFEL ANTONIO SORIANO MATEUS,PARTIDO ALIANZA SOCIAL INDEPENDIENTE - ASI,95021
Concejo,BOYACA,GUATEQUE,WILLIAM HERNANDO SUAREZ SANCHEZ,PARTIDO SOCIAL DE UNIDAD NACIONAL PARTIDO DE LA U,95025
Concejo,BOYACA,GUATEQUE,WILMAR GIOVANNY RUIZ ,PARTIDO SOCIAL DE UNIDAD NACIONAL PARTIDO DE LA U,95024
Concejo,BOYACA,GUATEQUE,YEISON FERNANDO RAMIREZ PINTO,PARTIDO SOCIAL DE UNIDAD NACIONAL PARTIDO DE LA U,95028
Concejo,BOYACA,GUATEQUE,YIYE  VELASQUEZ ROMERO,PARTIDO CONSERVADOR COLOMBIANO,94987
Concejo,BOYACA,GUATEQUE,YOHADRY LISBETH PARRA MARTINEZ,PARTIDO ALIANZA SOCIAL INDEPENDIENTE - ASI,95023
Concejo,BOYACA,GUATEQUE,ZAIDA CAMILA PEREZ CUADROS,PARTIDO ALIANZA SOCIAL INDEPENDIENTE - ASI,95022
